[
  {
    "title": "ADRA Deutschland e.V.",
    "url": "https://www.dzi.de/organisation/adra-deutschland-e-v/",
    "weltanschaulicheAusrichtung": "christlich",
    "finanzen": {
      "bezugsjahr": 2018,
      "gesamtEinnahmen": "19.739.972,55 EUR",
      "anteilKosten": "niedrig"
    },
    "volltext": "Arbeitsschwerpunkte\nAids, Bildung, Bildungs- und Kampagnenarbeit, Entwicklungszusammenarbeit, Flüchtlingsfürsorge, Gesundheitshilfe, Katastrophenhilfe, Kinder- und Jugendhilfe, Umwelt- und Naturschutz, Völkerverständigung\nLänderschwerpunkte\nAfghanistan, Äthiopien, Burkina Faso, Burundi, Fidschi, Haiti, Honduras, Indien, Irak, Jemen, Kambodscha, Kenia, Libanon, Liberia, Madagaskar, Mali, Mongolei, Myanmar, Nepal, Niger, Pakistan, Peru, Philippinen, Serbien, Simbabwe, Somalia, Südsudan, Ukraine, Vanuatu, Vietnam\n… mehr\nTätigkeitsfelder\nADRA Deutschland e.V. ist eine weltweit tätige Entwicklungshilfeorganisation der protestantischen Freikirche der Siebenten-Tags-Adventisten. Die Organisation arbeitet in den Bereichen Ernährungssicherung, Gesundheitshilfe, Bildung, Einkommensgenerierung, Katastrophenvorsorge und integrierte Programme sowie Katastrophenhilfe und Freiwilligendienste in vielen Ländern der Welt. Die geförderten Projekte umfassen beispielsweise Wiederaufbauprogramme, die Verbesserung der Trinkwasserversorgung und Hygienebedingungen, die landwirtschaftliche Entwicklung, die Flüchtlingshilfe und die Durchführung von Aids-/HIV-Programmen.\nFinanzen\nBezugsjahr:\n2018\nGesamteinnahmen:\n19.739.972,55 EUR\nDavon Sammlungseinnahmen Hilfetext:\n2.830.946,58 EUR\nAnteil Werbe- und Verwaltungskosten Hilfetext:\nniedrig\nEinschätzung durch das DZI Hilfetext\nADRA Deutschland e.V., Darmstadt, wurde das DZI Spenden-Siegel zuerkannt. Der Verein ist förderungswürdig.\nDie sieben Spenden-Siegel-Standards erfüllt der Verein wie folgt:\n1.Die Organisation leistet satzungsgemäße Arbeit.\n2.Leitung und Aufsicht sind angemessen strukturiert, klar voneinander getrennt und werden wirksam wahrgenommen.\n3.Werbung und Öffentlichkeitsarbeit informieren klar, wahr, sachlich und offen.\n4.Der Anteil der Werbe- und Verwaltungsausgaben an den Gesamtausgaben ist nach DZI-Maßstab niedrig („niedrig“ = unter 10%). Die Wirksamkeit des Mitteleinsatzes wird überprüft, und die Ergebnisse werden dokumentiert und veröffentlicht.\n5.Die von der Organisation gezahlten Vergütungen berücksichtigen den Status der Gemeinnützigkeit, die Qualifikation, das Maß an Verantwortung und den branchenüblichen Rahmen.\n6.Mittelbeschaffung und -verwendung sowie die Vermögenslage werden nachvollziehbar dokumentiert und hinreichend angemessen geprüft.\n7.Die Organisation berichtet offen und hinreichend umfassend über ihre Arbeit, Strukturen und Finanzen.\nTräger des DZI Spenden-Siegels seit 15.11.2007\nKontakt\nWebsite\nwww.adra.de\nE-Mail\ninfo@adra.de\nTelefon\n06151-81150\nFax\n06151-811512\nAnschrift\nRobert-Bosch-Straße 10\n64331 Weiterstadt\nSpendenkonten\nIBAN: DE87660205000007704000\nBIC: BFSWDE33KRL\nBank für Sozialwirtschaft\nAllgemeine Informationen\nGründungsjahr\n1987\nSitz der Organisation\nDarmstadt\nRechtsform\nVerein\nWeltanschauliche Ausrichtung\nchristlich\nOrganisation\nLeitungsorgan\nVorstand\nGeschäftsführung\nChristian Molke\nMitglieder/Gesellschafter\n16 stimmberechtigte Mitglieder\nAnzahl Mitarbeiter Hilfetext\nhauptamtlich: 40 ehrenamtlich: 70"
  },
  {
    "title": "Afghanische Kinderhilfe Deutschland e.V.",
    "url": "https://www.dzi.de/organisation/afghanische-kinderhilfe-deutschland-e-v/",
    "weltanschaulicheAusrichtung": "unabhängig",
    "finanzen": {
      "bezugsjahr": 2019,
      "gesamtEinnahmen": "103.405,23 EUR",
      "anteilKosten": "niedrig"
    },
    "volltext": "Arbeitsschwerpunkte\nBildung, Corona-Hilfe, Gesundheitshilfe, Kinder- und Jugendhilfe\nLänderschwerpunkte\nAfghanistan\nTätigkeitsfelder\nDie Afghanische Kinderhilfe Deutschland e.V. unterstützt zwei Tageskliniken in den Großräumen Dogh Abad (südlich von Kabul) und Deh Sabz (nordöstlich von Kabul). Während ein Großteil der laufenden Kosten beider Kliniken über die erhobenen Gebühren erwirtschaftet wird, übernimmt der Verein insbesondere die Zahlung von Gehältern des Klinikpersonals sowie die Finanzierung medizinischer Geräte. Die Tagesklinik in Dogh Abad dient zudem als Impfstation; die dafür anfallenden laufenden Kosten werden von UNICEF gedeckt. Darüber hinaus fördert die Afghanische Kinderhilfe Deutschland e.V. eine an die Klinik in Dogh Abad angeschlossene Berufsschule. Dort werden ausschließlich Mädchen, überwiegend Waisenkinder, in den Bereichen Computer, Näharbeit, Stickerei und Englisch ausgebildet.\nFinanzen\nBezugsjahr:\n2019\nGesamteinnahmen:\n103.405,23 EUR\nDavon Sammlungseinnahmen Hilfetext:\n64.405,23 EUR\nAnteil Werbe- und Verwaltungskosten Hilfetext:\nniedrig\nEinschätzung durch das DZI Hilfetext\nAfghanische Kinderhilfe Deutschland e.V., Düsseldorf, wurde das DZI Spenden-Siegel zuerkannt. Der Verein ist förderungswürdig.\nDie sieben Spenden-Siegel-Standards erfüllt der Verein wie folgt:\n1.Die Organisation leistet satzungsgemäße Arbeit.\n2.Leitung und Aufsicht sind angemessen strukturiert, hinreichend klar voneinander getrennt und werden wirksam wahrgenommen.\n3.Werbung und Öffentlichkeitsarbeit informieren klar, wahr, sachlich und offen.\n4.Der Anteil der Werbe- und Verwaltungsausgaben an den Gesamtausgaben ist nach DZI-Maßstab niedrig („niedrig“ = unter 10%). Die Wirksamkeit des Mitteleinsatzes wird überprüft, und die Ergebnisse werden dokumentiert und veröffentlicht.\n5.Vergütungen (trifft nicht zu).\n6.Mittelbeschaffung und -verwendung sowie die Vermögenslage werden nachvollziehbar dokumentiert und angemessen geprüft.\n7.Die Organisation berichtet offen und umfassend über ihre Arbeit, Strukturen und Finanzen.\nTräger des DZI Spenden-Siegels seit 17.06.2010\nKontakt\nWebsite\nwww.akhd.de\nE-Mail\ninfo@akhd.de\nTelefon\n0211-434303\nAnschrift\nNovalisstraße 8\n40474 Düsseldorf\nSpendenkonten\nIBAN: DE19300501100047027800\nBIC: DUSSDEDDXXX\nStadtsparkasse Düsseldorf\nAllgemeine Informationen\nGründungsjahr\n2002\nSitz der Organisation\nDüsseldorf\nRechtsform\nVerein\nWeltanschauliche Ausrichtung\nunabhängig\nOrganisation\nLeitungsorgan\nVorstand\nMitglieder/Gesellschafter\n81 stimmberechtigte Mitglieder\nAnzahl Mitarbeiter Hilfetext\nehrenamtlich: 15"
  },
  {
    "title": "Basisgesundheitsdienst Partnerdiözese Jabalpur/Indien e.V.",
    "url": "https://www.dzi.de/organisation/basisgesundheitsdienst-partnerdioezese-jabalpur-indien-e-v/",
    "weltanschaulicheAusrichtung": "christlich",
    "finanzen": {
      "bezugsjahr": 2018,
      "gesamtEinnahmen": "92.443,25 EUR",
      "anteilKosten": "niedrig"
    },
    "volltext": "Arbeitsschwerpunkte\nAltenhilfe, Behindertenhilfe, Bildung, Bildungs- und Kampagnenarbeit, Entwicklungszusammenarbeit, Familienfürsorge, Gesundheitshilfe, Kinder- und Jugendhilfe\nLänderschwerpunkte\nIndien\nTätigkeitsfelder\nBereits seit den 1960er Jahren arbeiten die Pfarrgemeinde St. Margareta in Münster und die Diözese Jabalpur (Bundesstaat Madhya Pradesh) zusammen. Der aus dieser Partnerschaft entstandene Basisgesundheitsdienst Partnerdiözese Jabalpur/Indien e.V. hat es sich zur Aufgabe gemacht, insbesondere die in dieser Region Zentralindiens lebenden Ureinwohner, die Adivasi, zu unterstützen. Der Verein fördert eine Vielzahl von Projekten in der Partnerdiözese durch Anschubfinanzierungen, beispielsweise den Bau bzw. die Erweiterung von Schulen, Internaten und Berufsbildungszentren, die Ausbildung von Gesundheitshelfern, die Errichtung und Vergrößerung von Krankenhäusern, Ambulanzstationen und Sterbehäusern. Mit ihrer Öffentlichkeitsarbeit in Deutschland will die Organisation vor allem Problembewusstsein im Hinblick auf die Situation der alteingesessenen Bevölkerung in der zentralindischen Diözese schaffen.\nFinanzen\nBezugsjahr:\n2018\nGesamteinnahmen:\n92.443,25 EUR\nDavon Sammlungseinnahmen Hilfetext:\n92.374,51 EUR\nAnteil Werbe- und Verwaltungskosten Hilfetext:\nniedrig\nEinschätzung durch das DZI Hilfetext\nDem Basisgesundheitsdienst Partnerdiözese Jabalpur/Indien e.V., Münster, wurde das DZI Spenden-Siegel zuerkannt. Der Verein ist förderungswürdig.\nDie sieben Spenden-Siegel-Standards erfüllt der Verein wie folgt:\n1.Die Organisation leistet satzungsgemäße Arbeit.\n2.Leitung und Aufsicht sind angemessen strukturiert, klar voneinander getrennt und werden wirksam wahrgenommen.\n3.Werbung und Öffentlichkeitsarbeit informieren klar, wahr, sachlich und offen.\n4.Der Anteil der Werbe- und Verwaltungsausgaben an den Gesamtausgaben ist nach DZI-Maßstab niedrig („niedrig“ = unter 10%). Die Wirksamkeit des Mitteleinsatzes wird überprüft, und die Ergebnisse werden dokumentiert und veröffentlicht.\n5.Vergütungen (trifft nicht zu)\n6.Mittelbeschaffung und -verwendung sowie die Vermögenslage werden nachvollziehbar dokumentiert und angemessen geprüft.\n7.Die Organisation berichtet offen und umfassend über ihre Arbeit, Strukturen und Finanzen.\nTräger des DZI Spenden-Siegels seit 23.11.1992\nKontakt\nWebsite\nwww.bgd-muenster.de\nE-Mail\nbgd@muenster.org\nTelefon\n0251-315901\nAnschrift\nHegerskamp 71\n48155 Münster\nSpendenkonten\nIBAN: DE98400602650003433100\nBIC: GENODEM1DKM\nDKM Darlehnskasse Münster\nAllgemeine Informationen\nGründungsjahr\n1985\nSitz der Organisation\nMünster\nRechtsform\nVerein\nWeltanschauliche Ausrichtung\nchristlich\nOrganisation\nLeitungsorgan\nVorstand\nMitglieder/Gesellschafter\n53 stimmberechtigte Mitglieder\nAnzahl Mitarbeiter Hilfetext\nehrenamtlich: 10"
  },
  {
    "title": "Bayerische Sportstiftung",
    "url": "https://www.dzi.de/organisation/bayerische-sportstiftung/",
    "weltanschaulicheAusrichtung": "unabhängig",
    "finanzen": {
      "bezugsjahr": 2019,
      "gesamtEinnahmen": "65.637,69 EUR",
      "anteilKosten": "angemessen"
    },
    "volltext": "Arbeitsschwerpunkte\nKinder- und Jugendhilfe, Sport\nLänderschwerpunkte\nDeutschland\nTätigkeitsfelder\nDie Stiftung fördert insbesondere Nachwuchsleistungssportler in bayerischen Vereinen und Leistungssportstrukturen. Neben Geld- und Sachleistungen sollen die jungen Athleten auch durch die Vermittlung von Ausbildungs- und Arbeitsplätzen gefördert werden. Unterstützt werden vorrangig Sportlerinnen und Sportler, die Mitglied in einem Verein oder Verband des Bayerischen Landes-Sportverbandes e.V. sind. Die Förderkriterien sind in den Fördergrundsätzen der Stiftung festgelegt und auf deren Website einsehbar.\nFinanzen\nBezugsjahr:\n2019\nGesamteinnahmen:\n65.637,69 EUR\nDavon Sammlungseinnahmen Hilfetext:\n8.993,43 EUR\nAnteil Werbe- und Verwaltungskosten Hilfetext:\nangemessen\nEinschätzung durch das DZI Hilfetext\nDer Bayerische Sportstiftung, München, wurde das DZI Spenden-Siegel zuerkannt. Die Stiftung ist förderungswürdig.\nDie sieben Spenden-Siegel-Standards erfüllt die Stiftung wie folgt:\n1.Die Organisation leistet satzungsgemäße Arbeit.\n2.Leitung und Aufsicht sind angemessen strukturiert, klar voneinander getrennt und werden wirksam wahrgenommen.\n3.Werbung und Öffentlichkeitsarbeit informieren klar, wahr, sachlich und offen.\n4.Der Anteil der Werbe- und Verwaltungsausgaben an den Gesamtausgaben ist nach DZI-Maßstab angemessen („angemessen“ = 10% bis unter 20%). Die Wirksamkeit des Mitteleinsatzes wird überprüft, und die Ergebnisse werden dokumentiert und veröffentlicht.\n5.Vergütungen: trifft nicht zu.\n6.Mittelbeschaffung und -verwendung sowie die Vermögenslage werden nachvollziehbar dokumentiert und angemessen geprüft.\n7.Die Organisation berichtet offen und umfassend über ihre Arbeit, Strukturen und Finanzen.\nTräger des DZI Spenden-Siegels seit 15.07.2016\nKontakt\nWebsite\nwww.bayerische-sportstiftung.de\nE-Mail\ninfo@bayerische-sportstiftung.de\nTelefon\n089-15702634\nAnschrift\nGeorg-Brauchle-Ring 93\n80992 München\nSpendenkonten\nIBAN: DE78701500000000666222\nBIC: SSKMDEMMXXX\nStadtsparkasse München\nAllgemeine Informationen\nGründungsjahr\n2010\nSitz der Organisation\nMünchen\nRechtsform\nStiftung\nWeltanschauliche Ausrichtung\nunabhängig\nOrganisation\nLeitungsorgan\nVorstand\nAnzahl Mitarbeiter Hilfetext\nehrenamtlich: 23"
  },
  {
    "title": "Cap Anamur/Deutsche Not-Ärzte e.V.",
    "url": "https://www.dzi.de/organisation/cap-anamur-deutsche-not-aerzte-e-v/",
    "weltanschaulicheAusrichtung": "unabhängig",
    "finanzen": {
      "bezugsjahr": 2019,
      "gesamtEinnahmen": "4.036.716,28 EUR",
      "anteilKosten": "niedrig"
    },
    "volltext": "Arbeitsschwerpunkte\nCorona-Hilfe, Entwicklungszusammenarbeit, Flüchtlingsfürsorge, Gesundheitshilfe, Katastrophenhilfe\nLänderschwerpunkte\nAfghanistan, Bangladesch, Demokratische Volksrepublik Korea, Libanon, Mongolei, Nepal, Sierra Leone, Sudan, Zentralafrikanische Republik\nTätigkeitsfelder\nCap Anamur ist hauptsächlich in der Not- und Katastrophenhilfe tätig. In rund zehn Ländern leistet der Verein weltweit Hilfe für Flüchtlinge und Menschen in Not. Schwerpunkt ist der Aufbau und die Sicherstellung der medizinischen Versorgung. Darüber hinaus beinhaltet die Arbeit die Versorgung mit Trinkwasser, Lebensmitteln, Hygieneartikeln, Bekleidung, Medikamenten und Baumaterial sowie mit technischen und medizinischen Geräten. Die internationalen Teams arbeiten nach dem Grundsatz „Hilfe zur Selbsthilfe“ eng mit lokalen Mitarbeitern zusammen. Neben der Rehabilitierung oder dem Neubau von Krankenhäusern und Gesundheitsstationen engagiert sich Cap Anamur in der Verbesserung der Infrastruktur und der Ausbildung.\nFinanzen\nBezugsjahr:\n2019\nGesamteinnahmen:\n4.036.716,28 EUR\nDavon Sammlungseinnahmen Hilfetext:\n3.900.606,89 EUR\nAnteil Werbe- und Verwaltungskosten Hilfetext:\nniedrig\nEinschätzung durch das DZI Hilfetext\nKomitee Cap Anamur/Deutsche Not-Ärzte e.V., Köln, wurde das DZI Spenden-Siegel zuerkannt. Der Verein ist förderungswürdig.\nDie sieben Spenden-Siegel-Standards erfüllt der Verein wie folgt:\n1.Die Organisation leistet satzungsgemäße Arbeit.\n2.Leitung und Aufsicht sind angemessen strukturiert, klar voneinander getrennt und werden wirksam wahrgenommen.\n3.Werbung und Öffentlichkeitsarbeit informieren klar, wahr, sachlich und offen.\n4.Der Anteil der Werbe- und Verwaltungsausgaben an den Gesamtausgaben ist nach DZI-Maßstab niedrig („niedrig“ = unter 10%). Die Wirksamkeit des Mitteleinsatzes wird überprüft, und die Ergebnisse werden dokumentiert und veröffentlicht.\n5.Die von der Organisation gezahlten Vergütungen berücksichtigen den Status der Gemeinnützigkeit, die Qualifikation, das Maß an Verantwortung und den branchenüblichen Rahmen.\n6.Mittelbeschaffung und -verwendung sowie die Vermögenslage werden nachvollziehbar dokumentiert und angemessen geprüft.\n7.Die Organisation berichtet offen und umfassend über ihre Arbeit, Strukturen und Finanzen.\nTräger des DZI Spenden-Siegels seit 18.10.2004\nKontakt\nWebsite\nwww.cap-anamur.org\nE-Mail\noffice@cap-anamur.org\nTelefon\n0221-9138150\nFax\n0221-9138159\nAnschrift\nThebäerstraße 30\n50823 Köln\nSpendenkonten\nIBAN: DE85370501980002222222\nBIC: COLSDE33XXX\nSparkasse KölnBonn\nAllgemeine Informationen\nGründungsjahr\n1979\nSitz der Organisation\nKöln\nRechtsform\nVerein\nWeltanschauliche Ausrichtung\nunabhängig\nOrganisation\nLeitungsorgan\nVorstand\nGeschäftsführung\nBernd Göken\nMitglieder/Gesellschafter\n16 stimmberechtigte Mitglieder\nAnzahl Mitarbeiter Hilfetext\nhauptamtlich: 26 ehrenamtlich: 3"
  },
  {
    "title": "Caritasverband der Erzdiözese München und Freising e.V.",
    "url": "https://www.dzi.de/organisation/caritasverband-der-erzdioezese-muenchen-und-freising-e-v/",
    "weltanschaulicheAusrichtung": "katholisch",
    "finanzen": {
      "bezugsjahr": 2018,
      "gesamtEinnahmen": "447.309.090,50 EUR",
      "anteilKosten": "niedrig"
    },
    "volltext": "Arbeitsschwerpunkte\nAids, Altenhilfe, Behindertenhilfe, Bildung, Corona-Hilfe, Familienfürsorge, Flüchtlingsfürsorge, Gesundheitshilfe, Kinder- und Jugendhilfe, Religion, Suchthilfe\nLänderschwerpunkte\nDeutschland\nTätigkeitsfelder\nUnter dem Dach des Caritasverbands der Erzdiözese München und Freising e.V. sind etwa 1.200 Einrichtungen zusammengeschlossen. Über 350 Einrichtungen unterhält der Verband in eigener Trägerschaft. Als größter Wohlfahrtsverband in Oberbayern deckt die Organisation das breite Spektrum an sozialen Diensten für alle Lebensalter und in vielfältigen Notlagen ab. Hierzu gehören beispielsweise Kindertageseinrichtungen, Beratungsstellen für Eltern, Kinder, Jugendliche, soziale Beratungsstellen, Schuldnerberatungsstellen, Suchthilfeeinrichtungen, Asyl- und Migrationsberatungsstellen und Flüchtlingsdienste, Behinderteneinrichtungen, Werkstätten für Menschen mit Behinderung, ambulante Pflegedienste, Alten- und Pflegeheime sowie sozialpsychiatrische Dienste.\nFinanzen\nBezugsjahr:\n2018\nGesamteinnahmen:\n447.309.090,50 EUR\nDavon Sammlungseinnahmen Hilfetext:\n11.828.713,81 EUR\nAnteil Werbe- und Verwaltungskosten Hilfetext:\nniedrig\nEinschätzung durch das DZI Hilfetext\nDem Caritasverband der Erzdiözese München und Freising e.V., München, wurde das DZI Spenden-Siegel zuerkannt. Der Verein ist förderungswürdig.\nDie sieben Spenden-Siegel-Standards erfüllt der Verein wie folgt:\n1.Die Organisation leistet satzungsgemäße Arbeit.\n2.Leitung und Aufsicht sind angemessen strukturiert, klar voneinander getrennt und werden hinreichend wirksam wahrgenommen.\n3.Werbung und Öffentlichkeitsarbeit informieren klar, wahr, sachlich und offen.\n4.Der Anteil der Werbe- und Verwaltungsausgaben an den Gesamtausgaben ist nach DZI-Maßstab niedrig („niedrig“ = unter 10%). Die Wirksamkeit des Mitteleinsatzes wird überprüft, und die Ergebnisse werden dokumentiert und veröffentlicht.\n5.Die von der Organisation gezahlten Vergütungen berücksichtigen den Status der Gemeinnützigkeit, die Qualifikation, das Maß an Verantwortung und den branchenüblichen Rahmen.\n6.Mittelbeschaffung und -verwendung sowie die Vermögenslage werden nachvollziehbar dokumentiert und angemessen geprüft.\n7.Die Organisation berichtet offen und hinreichend umfassend über ihre Arbeit, Strukturen und Finanzen.\nTräger des DZI Spenden-Siegels seit 16.12.1996\nKontakt\nWebsite\nwww.caritas-nah-am-naechsten.de\nE-Mail\nspenden-info@caritasmuenchen.de\nTelefon\n089-551690\nFax\n089-55169577\nAnschrift\nHirtenstraße 2-4\n80335 München\nSpendenkonten\nIBAN: DE53750903000002297779\nBIC: GENODEF1M05\nLIGA Bank\nAllgemeine Informationen\nGründungsjahr\n1901\nSitz der Organisation\nMünchen\nRechtsform\nVerein\nWeltanschauliche Ausrichtung\nkatholisch\nOrganisation\nLeitungsorgan\nVorstand\nMitglieder/Gesellschafter\n115 stimmberechtigte Mitglieder\nAnzahl Mitarbeiter Hilfetext\nhauptamtlich: 9184 ehrenamtlich: 10500"
  },
  {
    "title": "DAHW Deutsche Lepra- und Tuberkulosehilfe e.V.",
    "url": "https://www.dzi.de/organisation/dahw-deutsche-lepra-und-tuberkulosehilfe-e-v/",
    "weltanschaulicheAusrichtung": "unabhängig",
    "finanzen": {
      "bezugsjahr": 2018,
      "gesamtEinnahmen": "14.077.441,33 EUR",
      "anteilKosten": "vertretbar"
    },
    "volltext": "Arbeitsschwerpunkte\nBehindertenhilfe, Bildungs- und Kampagnenarbeit, Corona-Hilfe, Entwicklungszusammenarbeit, Gesundheitshilfe\nLänderschwerpunkte\nAfghanistan, Äthiopien, Bhutan, Bolivien, Brasilien, Indien, Jemen, Kolumbien, Liberia, Myanmar, Nepal, Nigeria, Pakistan, Paraguay, Senegal, Sierra Leone, Sudan, Südsudan, Tansania, Togo, Uganda\n… mehr\nTätigkeitsfelder\nDie DAHW Deutsche Lepra- und Tuberkulosehilfe fördert Projekte und Programme zur Bekämpfung von Lepra und Tuberkulose weltweit. Die räumlichen Arbeitsschwerpunkte liegen in Asien sowie in Afrika. Daneben werden auch Vorhaben in Südamerika sowie vereinzelt in Osteuropa gefördert. Die Hilfsmaßnahmen konzentrieren sich auf die Förderung von Leprakontrollprogrammen, von medizinischen Leistungen und Einrichtungen sowie von Projekten zur sozialen Rehabilitation der Leprapatienten. Darüber hinaus werden Maßnahmen der Gesundheitsaufklärung und Ausbildungszentren unterstützt. Zur Organisation und Betreuung der Projekte werden Regionalbüros unterhalten. Die Arbeit der Deutschen Lepra- und Tuberkulosehilfe, vor allem die Öffentlichkeitsarbeit, wird von über 250 „Aktionsgruppen“ in verschiedenen Städten der Bundesrepublik unterstützt.\nFinanzen\nBezugsjahr:\n2018\nGesamteinnahmen:\n14.077.441,33 EUR\nDavon Sammlungseinnahmen Hilfetext:\n6.823.563,11 EUR\nAnteil Werbe- und Verwaltungskosten Hilfetext:\nvertretbar\nEinschätzung durch das DZI Hilfetext\nDer DAHW Deutschen Lepra- und Tuberkulosehilfe e.V., Würzburg, wurde das DZI Spenden-Siegel zuerkannt. Der Verein ist förderungswürdig.\nDie sieben Spenden-Siegel-Standards erfüllt der Verein wie folgt:\n1.Die Organisation leistet satzungsgemäße Arbeit.\n2.Leitung und Aufsicht sind angemessen strukturiert, klar voneinander getrennt und werden wirksam wahrgenommen.\n3.Werbung und Öffentlichkeitsarbeit informieren klar, wahr, sachlich und offen.\n4.Der Anteil der Werbe- und Verwaltungsausgaben an den Gesamtausgaben ist nach DZI-Maßstab vertretbar („vertretbar“ = 20% bis 30%). Die Wirksamkeit des Mitteleinsatzes wird überprüft, und die Ergebnisse werden dokumentiert und veröffentlicht.\n5.Die von der Organisation gezahlten Vergütungen berücksichtigen den Status der Gemeinnützigkeit, die Qualifikation, das Maß an Verantwortung und den branchenüblichen Rahmen.\n6.Mittelbeschaffung und -verwendung sowie die Vermögenslage werden nachvollziehbar dokumentiert und angemessen geprüft.\n7.Die Organisation berichtet offen und umfassend über ihre Arbeit, Strukturen und Finanzen.\nTräger des DZI Spenden-Siegels seit 27.04.1993\nKontakt\nWebsite\nwww.dahw.de\nE-Mail\ninfo@dahw.de\nTelefon\n0931-79480\nFax\n0931-7948160\nAnschrift\nRaiffeisenstraße 3\n97080 Würzburg\nSpendenkonten\nIBAN: DE35790500000000009696\nBIC: BYLADEM1SWU\nSparkasse Mainfranken Würzburg\nAllgemeine Informationen\nGründungsjahr\n1957\nSitz der Organisation\nWürzburg\nRechtsform\nVerein\nWeltanschauliche Ausrichtung\nunabhängig\nOrganisation\nLeitungsorgan\nVorstand\nGeschäftsführung\nBurkard Kömm\nMitglieder/Gesellschafter\n83 stimmberechtigte Mitglieder\nAnzahl Mitarbeiter Hilfetext\nhauptamtlich: 63 ehrenamtlich: 10"
  },
  {
    "title": "Das Hunger Projekt e.V.",
    "url": "https://www.dzi.de/organisation/das-hunger-projekt-e-v/",
    "weltanschaulicheAusrichtung": "unabhängig",
    "finanzen": {
      "bezugsjahr": 2018,
      "gesamtEinnahmen": "668.157,62 EUR",
      "anteilKosten": "vertretbar"
    },
    "volltext": "Arbeitsschwerpunkte\nBildungs- und Kampagnenarbeit, Entwicklungszusammenarbeit, Frauenförderung, Menschenrechte\nLänderschwerpunkte\nÄthiopien, Bangladesch, Benin, Burkina Faso, Deutschland, Ghana, Indien, Malawi, Mexiko, Mosambik, Peru, Sambia, Senegal, Uganda\nTätigkeitsfelder\nDas Global Hunger Project setzt sich seit 1977 für die nachhaltige Überwindung des chronischen Hungers ein. Ziel hierbei ist es, Menschen zur Zusammenarbeit zu befähigen und aus eigener Kraft ihre Lebensbedingungen in den Bereichen Gesundheit, Ernährung, Einkommen und Ausbildung zu verbessern. Gleichzeitig bindet es einheimische Fach- und Führungskräfte aller Sektoren der Gesellschaft ein, um so ein unterstützendes gesellschaftspolitisches Umfeld für die lokalen Maßnahmen, Projekte und Kampagnen zu schaffen (Community-Led Development). Ein Schwerpunkt der Arbeit liegt im Empowerment der Frauen. Sie werden ausgebildet und dazu befähigt, in den lokalen demokratischen Gremien mitzuwirken, um so ihre zentrale Bedeutung im Entwicklungsprozess hervorzuheben und mitzugestalten. Mit Einkommen schaffenden Maßnahmen, Kleinkrediten, Alphabetisierungskursen, Gesundheitsvorsorge und vielen weiteren Programmen werden sie systematisch gestärkt. Neben dem Einsatz für die Gleichstellung von Frau und Mann legt das Hunger Projekt den Fokus auf die Förderung demokratischer Strukturen und politischer Mitsprache. Der deutsche Zweig des Hunger Projekts leistet darüber hinaus Bildungs- und Kampagnenarbeit (Globales Lernen).\nFinanzen\nBezugsjahr:\n2018\nGesamteinnahmen:\n668.157,62 EUR\nDavon Sammlungseinnahmen Hilfetext:\n245.589,86 EUR\nAnteil Werbe- und Verwaltungskosten Hilfetext:\nvertretbar\nEinschätzung durch das DZI Hilfetext\nDer Organisation Das Hunger Projekt e.V., Ravensburg, wurde das DZI Spenden-Siegel zuerkannt. Der Verein ist förderungswürdig.\nDie sieben Spenden-Siegel-Standards erfüllt der Verein wie folgt:\n1.Die Organisation leistet satzungsgemäße Arbeit.\n2.Leitung und Aufsicht sind angemessen strukturiert, klar voneinander getrennt und werden\nwirksam wahrgenommen.\n3.Werbung und Öffentlichkeitsarbeit informieren klar, wahr, sachlich und offen.\n4.Der Anteil der Werbe- und Verwaltungsausgaben an den Gesamtausgaben ist nach DZI-Maßstab vertretbar („vertretbar“ = 20% bis 30%). Die Wirksamkeit des Mitteleinsatzes wird überprüft, und die Ergebnisse werden dokumentiert und veröffentlicht.\n5.Die von der Organisation gezahlten Vergütungen berücksichtigen den Status der Gemeinnützigkeit, die Qualifikation, das Maß an Verantwortung und den branchenüblichen Rahmen.\n6.Mittelbeschaffung und -verwendung sowie die Vermögenslage werden nachvollziehbar dokumentiert und angemessen geprüft.\n7.Die Organisation berichtet offen und umfassend über ihre Arbeit, Strukturen und Finanzen.\nTräger des DZI Spenden-Siegels seit 27.01.2003\nKontakt\nWebsite\nwww.das-hunger-projekt.de\nE-Mail\ninfo@das-hunger-projekt.de\nTelefon\n089-21552420\nAnschrift\nRüdesheimer Straße 7\n80686 München\nSpendenkonten\nIBAN: DE10370501980000047571\nBIC: COLSDE33\nSparkasse KölnBonn\nAllgemeine Informationen\nGründungsjahr\n1983\nSitz der Organisation\nRavensburg\nRechtsform\nVerein\nWeltanschauliche Ausrichtung\nunabhängig\nOrganisation\nLeitungsorgan\nVorstand\nGeschäftsführung\nLeni Nebel (Landesdirektorin)\nMitglieder/Gesellschafter\n50 stimmberechtigte Mitglieder\nAnzahl Mitarbeiter Hilfetext\nhauptamtlich: 5 ehrenamtlich: 60"
  },
  {
    "title": "EIRENE Internationaler Christlicher Friedensdienst e.V.",
    "url": "https://www.dzi.de/organisation/eirene-internationaler-christlicher-friedensdienst-e-v/",
    "weltanschaulicheAusrichtung": "christlich",
    "finanzen": {
      "bezugsjahr": 2019,
      "gesamtEinnahmen": "6.899.966,54 EUR",
      "anteilKosten": "angemessen"
    },
    "volltext": "Arbeitsschwerpunkte\nBildung, Bildungs- und Kampagnenarbeit, Entwicklungszusammenarbeit, Frauenförderung, Menschenrechte, Völkerverständigung\nLänderschwerpunkte\nBelgien, Bolivien, Bosnien und Herzegowina, Burkina Faso, Burundi, Costa Rica, Demokratische Republik Kongo, Deutschland, Frankreich, Kanada, Mali, Marokko, Nicaragua, Niger, Nordirland, Ruanda, Rumänien, Uganda, USA\n… mehr\nTätigkeitsfelder\nEIRENE (griechisch für Frieden) entsendet Freiwillige in Projekte nach Afrika, Lateinamerika, West- und Osteuropa sowie in die USA und Kanada. Im Durchschnitt sind rund 30 Personen neben dem lokalen Personal in Entwicklungsprojekten und -programmen (Südprogramm: Afrika und Lateinamerika) sowie etwa 50 Freiwillige im Friedens- und Sozialdienst (Nord- und Ostprogramm: USA, Kanada und Europa) tätig. In Deutschland leistet EIRENE Informations- und Bildungsarbeit und fördert den Austausch und die Verständigung zwischen den Ländern und Kulturen. Das Südprogramm des Vereins umfasst die Förderung von Entwicklungs- und Kleinprojekten insbesondere im Niger, der DR Kongo sowie in Nicaragua und Costa Rica. Im Rahmen dieses Programms bietet der Verein fachlich Qualifizierten die Möglichkeit, in einem Projekt Entwicklungsdienst zu leisten. Das Nord- und Ostprogramm soll zur Verwirklichung der Menschenrechte und zur Versöhnung in Kriegsgebieten beitragen und Solidarität mit an den gesellschaftlichen Rand gedrängten Menschen ausdrücken (u.a. Obdachlose, Behinderte, psychisch kranke Menschen, Arbeitslose). Im Rahmen des Ostprogramms vermittelt EIRENE Freiwillige in Projekte nach Bosnien-Herzegowina und Rumänien. Sie tragen dort zum Aufbau der Zivilgesellschaften bei und arbeiten mit Straßenkindern, diskriminierten Minderheiten oder Jugendlichen zusammen.\nFinanzen\nBezugsjahr:\n2019\nGesamteinnahmen:\n6.899.966,54 EUR\nDavon Sammlungseinnahmen Hilfetext:\n854.146,24 EUR\nAnteil Werbe- und Verwaltungskosten Hilfetext:\nangemessen\nEinschätzung durch das DZI Hilfetext\nEIRENE Internationaler Christlicher Friedensdienst e.V., Neuwied, wurde das DZI Spenden-Siegel zuerkannt. Der Verein ist förderungswürdig.\nDie sieben Spenden-Siegel-Standards erfüllt der Verein wie folgt:\n1.Die Organisation leistet satzungsgemäße Arbeit.\n2.Leitung und Aufsicht sind angemessen strukturiert, klar voneinander getrennt und werden wirksam wahrgenommen.\n3.Werbung und Öffentlichkeitsarbeit informieren klar, wahr, sachlich und offen.\n4.Der Anteil der Werbe- und Verwaltungsausgaben an den Gesamtausgaben ist nach DZI-Maßstab angemessen („angemessen“ = 10% bis unter 20%). Die Wirksamkeit des Mitteleinsatzes wird überprüft, und die Ergebnisse werden dokumentiert und veröffentlicht.\n5.Die von der Organisation gezahlten Vergütungen berücksichtigen den Status der Gemeinnützigkeit, die Qualifikation, das Maß an Verantwortung und den branchenüblichen Rahmen.\n6.Mittelbeschaffung und -verwendung sowie die Vermögenslage werden nachvollziehbar dokumentiert und angemessen geprüft.\n7.Die Organisation berichtet offen und umfassend über ihre Arbeit, Strukturen und Finanzen.\nTräger des DZI Spenden-Siegels seit 12.05.1995\nKontakt\nWebsite\nwww.eirene.org\nE-Mail\neirene-int@eirene.org\nTelefon\n02631-83790\nFax\n02631-837990\nAnschrift\nEngerser Straße 81\n56564 Neuwied\nSpendenkonten\nIBAN: DE16350601901011380014\nBIC: GENODED1DKD\nBank für Kirche und Diakonie - KD-Bank\nAllgemeine Informationen\nGründungsjahr\n1957\nSitz der Organisation\nNeuwied\nRechtsform\nVerein\nWeltanschauliche Ausrichtung\nchristlich\nOrganisation\nLeitungsorgan\nVorstand\nGeschäftsführung\nDr. Anthea Bethge\nMitglieder/Gesellschafter\n302 stimmberechtigte Mitglieder\nAnzahl Mitarbeiter Hilfetext\nhauptamtlich: 71 ehrenamtlich: 120"
  },
  {
    "title": "Elternverein für leukämie- und krebskranke Kinder, Gießen e.V.",
    "url": "https://www.dzi.de/organisation/elternverein-fuer-leukaemie-und-krebskranke-kinder-giessen-e-v/",
    "weltanschaulicheAusrichtung": "unabhängig",
    "finanzen": {
      "bezugsjahr": 2018,
      "gesamtEinnahmen": "868.911,40 EUR",
      "anteilKosten": "angemessen"
    },
    "volltext": "Arbeitsschwerpunkte\nEinzelfallhilfe, Familienfürsorge, Forschung, Gesundheitshilfe, Kinder- und Jugendhilfe\nLänderschwerpunkte\nDeutschland\nTätigkeitsfelder\nDer Verein betreut Kinder und Jugendliche, die an Leukämie oder Krebs erkrankt sind, sowie deren Eltern. Dazu fördert er die Station Peiper der Universitätskinderklinik Gießen und Marburg, Standort Gießen, und hilft auf der nach dem Leipziger Kinderarzt Prof. Dr. med. Albrecht Peiper (1889-1969) benannten Kinderkrebsstation, die Behandlung und Betreuung unter anderem durch die Finanzierung von Personalstellen zu verbessern und die Station kindgerecht zu gestalten. Zudem unterstützt er das Familienzentrum für krebskranke Kinder Gießen e.V., das den betroffenen Familien während der stationären Behandlungsphase ein vorübergehendes Zuhause in der Nähe ihrer Kinder bietet. Darüber hinaus finanziert der Verein einen Ambulanzdienst, der die Kinder und Eltern zu Hause betreut, und gewährt auf Antrag finanzielle Hilfen für durch die Krankheit in Not geratene Familien. Ein weiterer Schwerpunkt ist die Förderung der angewandten Forschung auf dem Gebiet der Leukämieerkrankung von Kindern und Jugendlichen.\nFinanzen\nBezugsjahr:\n2018\nGesamteinnahmen:\n868.911,40 EUR\nDavon Sammlungseinnahmen Hilfetext:\n833.956,43 EUR\nAnteil Werbe- und Verwaltungskosten Hilfetext:\nangemessen\nEinschätzung durch das DZI Hilfetext\nDem Elternverein für leukämie- und krebskranke Kinder, Gießen e.V., Gießen, wurde das DZI Spenden-Siegel zuerkannt. Der Verein ist förderungswürdig.\nDie sieben Spenden-Siegel-Standards erfüllt der Verein wie folgt:\n1.Die Organisation leistet satzungsgemäße Arbeit.\n2.Leitung und Aufsicht sind angemessen strukturiert, klar voneinander getrennt und werden wirksam wahrgenommen.\n3.Werbung und Öffentlichkeitsarbeit informieren klar, wahr, sachlich und offen.\n4.Der Anteil der Werbe- und Verwaltungsausgaben an den Gesamtausgaben ist nach DZI-Maßstab angemessen („angemessen“ = 10% bis unter 20%). Die Wirksamkeit des Mitteleinsatzes wird überprüft, und die Ergebnisse werden dokumentiert und veröffentlicht.\n5.Die von der Organisation gezahlten Vergütungen berücksichtigen den Status der Gemeinnützigkeit, die Qualifikation, das Maß an Verantwortung und den branchenüblichen Rahmen.\n6.Mittelbeschaffung und -verwendung sowie die Vermögenslage werden nachvollziehbar dokumentiert und angemessen geprüft.\n7.Die Organisation berichtet offen und umfassend über ihre Arbeit, Strukturen und Finanzen.\nTräger des DZI Spenden-Siegels seit 11.05.1995\nKontakt\nWebsite\nwww.krebskrankekinder-giessen.de\nE-Mail\nkrebskranke-kinder-giessen@t-online.de\nTelefon\n06172-74341\nFax\n06172-777935\nAnschrift\nAm Houiller Platz 15\n61381 Friedrichsdorf\nSpendenkonten\nIBAN: DE09513900000000019119\nBIC: VBMHDE5F\nVolksbank Mittelhessen\nAllgemeine Informationen\nGründungsjahr\n1982\nSitz der Organisation\nGießen\nRechtsform\nVerein\nWeltanschauliche Ausrichtung\nunabhängig\nOrganisation\nLeitungsorgan\nVorstand\nMitglieder/Gesellschafter\n440 stimmberechtigte Mitglieder\nAnzahl Mitarbeiter Hilfetext\nhauptamtlich: 8 ehrenamtlich: 20"
  },
  {
    "title": "Fidesco e.V.",
    "url": "https://www.dzi.de/organisation/fidesco-e-v/",
    "weltanschaulicheAusrichtung": "katholisch",
    "finanzen": {
      "bezugsjahr": 2019,
      "gesamtEinnahmen": "170.353,22 EUR",
      "anteilKosten": "angemessen"
    },
    "volltext": "Arbeitsschwerpunkte\nBildung, Bildungs- und Kampagnenarbeit, Entwicklungszusammenarbeit, Frauenförderung, Gesundheitshilfe, Kinder- und Jugendhilfe, Religion\nLänderschwerpunkte\nBrasilien, Demokratische Republik Kongo, Deutschland, Guinea, Haiti, Kambodscha, Kolumbien, Madagaskar, Ruanda, Südafrika, Timor-Leste\nTätigkeitsfelder\nBei dem Verein handelt es sich um den deutschen Zweig der im Jahr 1981 von der katholischen Gemeinschaft Emmanuel gegründeten Missions- und Entwicklungshilfeorganisation Fidesco International. Sie leistet in erster Linie Entwicklungshilfe in den Bereichen Sozialarbeit, Bildungs- und Gesundheitswesen, Verwaltung, Handwerk sowie landwirtschaftliche Entwicklung. Einen weiteren Schwerpunkt bilden die Missionsarbeit und der hiermit verbundene Nord-Süd-Austausch von gut ausgebildeten Volontären. Die Fachkräfte werden vor ihrer Entsendung in die ein- bis zweijährige Missionsarbeit von der Organisation auf ihre Einsätze vorbereitet. Sie arbeiten nach dem Grundsatz der „Hilfe zur Selbsthilfe“ eng mit den lokalen Mitarbeitern in den Projekten zusammen und fördern so die Anstrengungen der Betroffenen, ihre Lebensumstände aus eigener Kraft zu verbessern. Neben der Anwerbung, Betreuung und finanziellen Unterstützung von Volontären in Deutschland liegt der Schwerpunkt der Vereinsarbeit insbesondere in der Förderung eines Straßenkinderzentrums in Ruanda, eines Gesundheitszentrums mit Geburtsklinik in Guinea sowie einer Berufsschule in Haiti. In Deutschland betreibt die Organisation Bildungs- und Informationsarbeit beispielsweise durch Veranstaltungen und Vorträge an Schulen und fördert zudem kulturelle Austauschprojekte.\nFinanzen\nBezugsjahr:\n2019\nGesamteinnahmen:\n170.353,22 EUR\nDavon Sammlungseinnahmen Hilfetext:\n121.674,55 EUR\nAnteil Werbe- und Verwaltungskosten Hilfetext:\nangemessen\nEinschätzung durch das DZI Hilfetext\nFidesco e.V., Altötting, wurde das DZI Spenden-Siegel zuerkannt. Der Verein ist förderungswürdig.\nDie sieben Spenden-Siegel-Standards erfüllt der Verein wie folgt:\n1.Die Organisation leistet satzungsgemäße Arbeit.\n2.Leitung und Aufsicht sind angemessen strukturiert, klar voneinander getrennt und werden wirksam wahrgenommen.\n3.Werbung und Öffentlichkeitsarbeit informieren klar, wahr, sachlich und offen.\n4.Der Anteil der Werbe- und Verwaltungsausgaben an den Gesamtausgaben ist nach DZI-Maßstab angemessen („angemessen“ = 10% bis unter 20%). Die Wirksamkeit des Mitteleinsatzes wird überprüft, und die Ergebnisse werden dokumentiert und veröffentlicht.\n5.Die von der Organisation gezahlten Vergütungen berücksichtigen den Status der Gemeinnützigkeit, die Qualifikation, das Maß an Verantwortung und den branchenüblichen Rahmen.\n6.Mittelbeschaffung und -verwendung sowie die Vermögenslage werden nachvollziehbar dokumentiert und angemessen geprüft.\n7.Die Organisation berichtet offen und umfassend über ihre Arbeit, Strukturen und Finanzen.\nTräger des DZI Spenden-Siegels seit 03.05.2013\nKontakt\nWebsite\nwww.fidesco.de\nwww.fidesco-international.org/de\nE-Mail\ninfo@fidesco.de\nTelefon\n0931-40480080\nAnschrift\nBinsenstraße 36\n97297 Waldbüttelbrunn\nSpendenkonten\nIBAN: DE60550205000008632100\nBIC: BFSWDE33MNZ\nBank für Sozialwirtschaft\nAllgemeine Informationen\nGründungsjahr\n1987\nSitz der Organisation\nAltötting\nRechtsform\nVerein\nWeltanschauliche Ausrichtung\nkatholisch\nOrganisation\nLeitungsorgan\nVorstand\nGeschäftsführung\nKarel Dekempe\nMitglieder/Gesellschafter\n10 stimmberechtigte Mitglieder\nAnzahl Mitarbeiter Hilfetext\nhauptamtlich: 3 ehrenamtlich: 21"
  },
  {
    "title": "Flughafenverein München e.V.",
    "url": "https://www.dzi.de/organisation/flughafenverein-muenchen-e-v/",
    "weltanschaulicheAusrichtung": "christlich",
    "finanzen": {
      "bezugsjahr": 2018,
      "gesamtEinnahmen": "162.916,78 EUR",
      "anteilKosten": "angemessen"
    },
    "volltext": "Arbeitsschwerpunkte\nAltenhilfe, Behindertenhilfe, Bildung, Corona-Hilfe, Einzelfallhilfe, Flüchtlingsfürsorge, Katastrophenhilfe, Kinder- und Jugendhilfe, Rettungswesen\nLänderschwerpunkte\nDeutschland\nTätigkeitsfelder\nDer Flughafenverein München e.V. unterstützt auf vielfältige Weise Menschen in Not. Meist handelt es sich um individuelle Hilfen, etwa bei Schicksalsschlägen. Der Schwerpunkt der Aktivitäten liegt in der Region um den Flughafen München. Die Organisation engagiert sich aber auch bei Not- und Katastrophenfällen im Ausland. Hinzu kommen bisweilen Hilfsgüter-Transporte ins Ausland. Voraussetzung für Hilfe sind eine konkrete Notsituation und die Bedürftigkeit der Betroffenen. Dies wird im Vorfeld vom Verein geprüft, gegebenenfalls in Kooperation mit anderen Stellen, etwa Ämtern oder Konsulaten. Bei Unterstützungsleistungen für Mitarbeiter der Flughafen München GmbH oder ihrer Tochtergesellschaften erfolgen zum Teil Abstimmungen mit Betriebsräten oder dem Sozialdienst.\nFinanzen\nBezugsjahr:\n2018\nGesamteinnahmen:\n162.916,78 EUR\nDavon Sammlungseinnahmen Hilfetext:\n162.916,78 EUR\nAnteil Werbe- und Verwaltungskosten Hilfetext:\nangemessen\nEinschätzung durch das DZI Hilfetext\nDem Flughafenverein München e.V., Freising, wurde das DZI Spenden-Siegel zuerkannt. Der Verein ist förderungswürdig.\nDie sieben Spenden-Siegel-Standards erfüllt der Verein wie folgt:\n1.Die Organisation leistet satzungsgemäße Arbeit.\n2.Leitung und Aufsicht sind angemessen strukturiert, klar voneinander getrennt und werden wirksam wahrgenommen.\n3.Werbung und Öffentlichkeitsarbeit informieren klar, wahr, sachlich und offen.\n4.Der Anteil der Werbe- und Verwaltungsausgaben an den Gesamtausgaben ist nach DZI-Maßstab angemessen („angemessen“ = 10% bis unter 20%). Die Wirksamkeit des Mitteleinsatzes wird überprüft, und die Ergebnisse werden dokumentiert und veröffentlicht.\n5.Vergütungen (trifft nicht zu)\n6.Mittelbeschaffung und -verwendung sowie die Vermögenslage werden nachvollziehbar dokumentiert und angemessen geprüft.\n7.Die Organisation berichtet offen und umfassend über ihre Arbeit, Strukturen und Finanzen.\nTräger des DZI Spenden-Siegels seit 19.05.2016\nKontakt\nWebsite\nwww.flughafenverein.de\nE-Mail\ninfo@flughafenverein.de\nTelefon\n089-97564200\nFax\n089-97564206\nAnschrift\nTerminalstraße Mitte 18\n85356 Flughafen München\nSpendenkonten\nIBAN: DE12700519950000966333\nBIC: BYLADEM1ERD\nSparkasse Erding-Dorfen\nAllgemeine Informationen\nGründungsjahr\n1996\nSitz der Organisation\nFreising\nRechtsform\nVerein\nWeltanschauliche Ausrichtung\nchristlich\nOrganisation\nLeitungsorgan\nVorstand\nMitglieder/Gesellschafter\n565 stimmberechtigte Mitglieder\nAnzahl Mitarbeiter Hilfetext\nehrenamtlich: 4"
  },
  {
    "title": "Gegen NOMA – PARMED e.V.",
    "url": "https://www.dzi.de/organisation/gegen-noma-parmed-e-v/",
    "weltanschaulicheAusrichtung": "unabhängig",
    "finanzen": {
      "bezugsjahr": 2018,
      "gesamtEinnahmen": "475.522,53 EUR",
      "anteilKosten": "angemessen"
    },
    "volltext": "Arbeitsschwerpunkte\nBildungs- und Kampagnenarbeit, Entwicklungszusammenarbeit, Gesundheitshilfe, Kinder- und Jugendhilfe\nLänderschwerpunkte\nBurkina Faso, Deutschland\nTätigkeitsfelder\nGegen NOMA - PARMED e.V. setzt sich für die nachhaltige Bekämpfung der Kinderkrankheit Noma in Burkina Faso ein. Der Schwerpunkt liegt in der Umsetzung von Präventionsprogrammen in Partnerschaft mit dem burkinischen Gesundheitsministerium. Hierzu wurden zunächst in allen 650 Dörfern der Sahel-Region ca. 1.500 einheimische Gesundheitsagenten bzw. traditionelle Heiler sowie Pressevertreter und Mitglieder lokaler Vereine für die Prävention, Frühdiagnose und adäquate Behandlung der Krankheit ausgebildet. Anschließend wurden mehrere hunderttausend Einwohner der Region durch eine breit angelegte Sensibilisierungskampagne in den verschiedenen Landessprachen über die Krankheit Noma und allgemeine Hygiene, Mund- und Zahnhygiene sowie Mangelernährung aufgeklärt. Neben der Sensibilisierungs- und Aufklärungsarbeit hat Gegen Noma gemeinsam mit verschiedenen Akteuren auf nationaler und regionaler Ebene die Einrichtung eines gemeindebasierten, elektronischen Forschungs- und Überwachungssystems initiiert. Dies soll dem Verein und allen Ebenen des Gesundheitssystems in der Sahel-Region eine verbesserte Überwachung von Noma und anderen Mund- und Gesichtskrankheiten ermöglichen. Dazu gehört die Entwicklung einer mobilen App, um durch die Nutzung von Mobiltelefonen Informationen zu übertragen und zu verbreiten sowie Daten zu Noma-Fällen und anderen Krankheiten systematisch zu sammeln und zu überwachen. Gegen Noma plant, seine Aktivitäten in der Sahel-Region auf andere Regionen Burkina Fasos auszuweiten und die Kapazitäten von Gesundheitspersonal in der Prävention, Pflege und Überwachung von Noma und weiteren Mund- und Gesichtskrankheiten auf nationaler Ebene zu stärken. Verantwortlich für die Koordination der Programme vor Ort ist ein von Gegen Noma zusammengestelltes und gesteuertes Projektteam des Projektpartners RESEAU in Ouagadougou. Weiterhin unterstützt der Verein mehrere Gesundheitsstationen sowie eine Universität in Burkina Faso (Medizin-Stipendien) und kümmert sich seit 2016 auch um die Koordination bzw. die medizinische Versorgung von akuten Noma-Fällen.\nFinanzen\nBezugsjahr:\n2018\nGesamteinnahmen:\n475.522,53 EUR\nDavon Sammlungseinnahmen Hilfetext:\n198.234,53 EUR\nAnteil Werbe- und Verwaltungskosten Hilfetext:\nangemessen\nEinschätzung durch das DZI Hilfetext\nGegen NOMA - PARMED e.V., Kempten (Allgäu), wurde das DZI Spenden-Siegel zuerkannt. Der Verein ist förderungswürdig.\nDie sieben Spenden-Siegel-Standards erfüllt der Verein wie folgt:\n1.Die Organisation leistet satzungsgemäße Arbeit.\n2.Leitung und Aufsicht sind angemessen strukturiert, klar voneinander getrennt und werden wirksam wahrgenommen.\n3.Werbung und Öffentlichkeitsarbeit informieren klar, wahr, sachlich und offen.\n4.Der Anteil der Werbe- und Verwaltungsausgaben an den Gesamtausgaben ist nach DZI-Maßstab angemessen („angemessen“ = 10% bis unter 20%). Die Wirksamkeit des Mitteleinsatzes wird überprüft, und die Ergebnisse werden dokumentiert und veröffentlicht.\n5.Vergütungen (trifft nicht zu).\n6.Mittelbeschaffung und -verwendung sowie die Vermögenslage werden nachvollziehbar dokumentiert und angemessen geprüft.\n7.Die Organisation berichtet offen und umfassend über ihre Arbeit, Strukturen und Finanzen.\nTräger des DZI Spenden-Siegels seit 08.08.2013\nKontakt\nWebsite\nwww.gegen-noma.de\nE-Mail\ninfo@gegen-noma.de\nTelefon\n0831-2539358\nFax\n0831-2539378\nAnschrift\nOberstdorfer Straße 7\n87435 Kempten (Allgäu)\nSpendenkonten\nIBAN: DE96510800600013944001\nBIC: DRESDEFF510\nCommerzbank\nAllgemeine Informationen\nGründungsjahr\n2008\nSitz der Organisation\nKempten (Allgäu)\nRechtsform\nVerein\nWeltanschauliche Ausrichtung\nunabhängig\nOrganisation\nLeitungsorgan\nVorstand\nMitglieder/Gesellschafter\n23 stimmberechtigte Mitglieder\nAnzahl Mitarbeiter Hilfetext\nehrenamtlich: 35"
  },
  {
    "title": "Gemeinschaft Sant´Egidio e.V.",
    "url": "https://www.dzi.de/organisation/gemeinschaft-santegidio-e-v/",
    "weltanschaulicheAusrichtung": "katholisch",
    "finanzen": {
      "bezugsjahr": 2018,
      "gesamtEinnahmen": "2.826.158,21 EUR",
      "anteilKosten": "niedrig"
    },
    "volltext": "Arbeitsschwerpunkte\nAids, Altenhilfe, Behindertenhilfe, Bildung, Entwicklungszusammenarbeit, Familienfürsorge, Flüchtlingsfürsorge, Gesundheitshilfe, Katastrophenhilfe, Kinder- und Jugendhilfe, Kinderpatenschaft, Menschenrechte, Religion, Völkerverständigung\nLänderschwerpunkte\nBurkina Faso, Demokratische Republik Kongo, Deutschland, Guinea, Kenia, Malawi, Mosambik, Senegal, Südsudan, Tansania, Uganda, Zentralafrikanische Republik\nTätigkeitsfelder\nBei der Gemeinschaft Sant´Egidio e.V. handelt es sich um den deutschen Zweig der im Jahr 1968 in Rom gegründeten Comunitá di Sant´Egidio. Nationale Organisationen bestehen weltweit in mehr als 70 Ländern. Die Gemeinschaft versteht sich als eine Laienbewegung mit rund 60.000 Mitgliedern, die sich für die Weitergabe des Evangeliums und die Solidarität mit den Armen einsetzen. Im Mittelpunkt der Arbeit der Gemeinschaft stehen das Gebet und die Weitergabe des Evangeliums. Weitere Anliegen der Gemeinschaft sind der Dienst an den Armen, das Engagement für Frieden und Menschenrechte sowie die Bekämpfung von HIV/AIDS in Afrika. So unterhält der deutsche Verein beispielsweise eine Mensa für Obdachlose und arme Menschen sowie „Schulen des Friedens“, in der Kinder Hilfe bei schulischen Schwierigkeiten und familiären Sorgen erhalten und Eltern in ihren Erziehungsaufgaben unterstützt werden. Ein finanzieller Schwerpunkt der Vereinsarbeit liegt in der Unterstützung des Programms DREAM 2.0 (Disease Relief through Excellent and Advanced Means), dessen Ziel es ist, AIDS sowie weitere Krankheiten wie beispielsweise Herz-Kreislauf-Erkrankungen und Diabetes in Afrika zu bekämpfen. Darüber hinaus unterstützt die Gemeinschaft Sant’Egidio e.V. melderechtliche Registrierungen von Kindern und Erwachsenen vor allem in Burkina Faso und Mosambik und trägt so zur Stärkung der Menschenrechte bei (Programm BRAVO! Birth Registration for All Versus Oblivion).\nFinanzen\nBezugsjahr:\n2018\nGesamteinnahmen:\n2.826.158,21 EUR\nDavon Sammlungseinnahmen Hilfetext:\n541.501,45 EUR\nAnteil Werbe- und Verwaltungskosten Hilfetext:\nniedrig\nEinschätzung durch das DZI Hilfetext\nDer Gemeinschaft Sant´Egidio e.V., Würzburg, wurde das DZI Spenden-Siegel zuerkannt. Der Verein ist förderungswürdig.\nDie sieben Spenden-Siegel-Standards erfüllt der Verein wie folgt:\n1.Die Organisation leistet satzungsgemäße Arbeit.\n2.Leitung und Aufsicht sind angemessen strukturiert, klar voneinander getrennt und werden wirksam wahrgenommen.\n3.Werbung und Öffentlichkeitsarbeit informieren klar, wahr, sachlich und offen.\n4.Der Anteil der Werbe- und Verwaltungsausgaben an den Gesamtausgaben ist nach DZI-Maßstab niedrig („niedrig“ = unter 10%). Die Wirksamkeit des Mitteleinsatzes wird überprüft, und die Ergebnisse werden dokumentiert und veröffentlicht.\n5.Die von der Organisation gezahlten Vergütungen berücksichtigen den Status der Gemeinnützigkeit, die Qualifikation, das Maß an Verantwortung und den branchenüblichen Rahmen.\n6.Mittelbeschaffung und -verwendung sowie die Vermögenslage werden nachvollziehbar dokumentiert und angemessen geprüft.\n7.Die Organisation berichtet offen und umfassend über ihre Arbeit, Strukturen und Finanzen.\nTräger des DZI Spenden-Siegels seit 23.04.2009\nKontakt\nWebsite\nwww.santegidio.de\nE-Mail\ninfo@santegidio.de\nTelefon\n0931-322940\nFax\n0931-3229439\nAnschrift\nSchönthalstraße 6\n97070 Würzburg\nSpendenkonten\nIBAN: DE71750903000003029999\nBIC: GENODEF1M05\nLIGA Bank\nAllgemeine Informationen\nGründungsjahr\n1984\nSitz der Organisation\nWürzburg\nRechtsform\nVerein\nWeltanschauliche Ausrichtung\nkatholisch\nOrganisation\nLeitungsorgan\nVorstand\nMitglieder/Gesellschafter\n32 stimmberechtigte Mitglieder\nAnzahl Mitarbeiter Hilfetext\nhauptamtlich: 6 ehrenamtlich: 5000"
  },
  {
    "title": "HAMMER FORUM Medical Aid for Children e.V.",
    "url": "https://www.dzi.de/organisation/hammer-forum-medical-aid-for-children-e-v/",
    "weltanschaulicheAusrichtung": "unabhängig",
    "finanzen": {
      "bezugsjahr": 2018,
      "gesamtEinnahmen": "953.592,41 EUR",
      "anteilKosten": "vertretbar"
    },
    "volltext": "Arbeitsschwerpunkte\nBildung, Entwicklungszusammenarbeit, Gesundheitshilfe, Kinder- und Jugendhilfe\nLänderschwerpunkte\nBurkina Faso, Demokratische Republik Kongo, Eritrea, Griechenland, Guinea, Guinea-Bissau, Jemen, Palästinensische Gebiete, Somalia, Tansania\nTätigkeitsfelder\nDer Verein leistet medizinische Hilfe für erkrankte und verletzte Kinder in Krisengebieten und unterstützt dort den Auf- und Ausbau von Gesundheitseinrichtungen. Qualifizierte Fachärzte fliegen zusammen mit ihren Teams in Krisengebiete und untersuchen, behandeln und operieren Kinder vor Ort in ehrenamtlicher Tätigkeit. Sie leiten einheimische Ärzte und Pflegerinnen in den Einsatzländern bei Operationen, der Nachsorge und Pflege an. Kinder, die nicht vor Ort behandelt werden können, werden nach Deutschland oder Österreich ausgeflogen und nach einer Genesungsphase in ihr Heimatland zurückgeführt.\nFinanzen\nBezugsjahr:\n2018\nGesamteinnahmen:\n953.592,41 EUR\nDavon Sammlungseinnahmen Hilfetext:\n738.291,43 EUR\nAnteil Werbe- und Verwaltungskosten Hilfetext:\nvertretbar\nEinschätzung durch das DZI Hilfetext\nHAMMER FORUM e.V. Medizinische Hilfe für Kinder in Krisengebieten, Hamm, wurde das DZI Spenden-Siegel zuerkannt. Der Verein ist förderungswürdig.\nDie sieben Spenden-Siegel-Standards erfüllt der Verein wie folgt:\n1.Die Organisation leistet satzungsgemäße Arbeit.\n2.Leitung und Aufsicht sind angemessen strukturiert, klar voneinander getrennt und werden wirksam wahrgenommen.\n3.Werbung und Öffentlichkeitsarbeit informieren klar, wahr, sachlich und offen.\n4.Der Anteil der Werbe- und Verwaltungsausgaben an den Gesamtausgaben ist nach DZI-Maßstab vertretbar („vertretbar“ = 20% bis 30%). Die Wirksamkeit des Mitteleinsatzes wird überprüft, und die Ergebnisse werden dokumentiert und veröffentlicht.\n5.Die von der Organisation gezahlten Vergütungen berücksichtigen den Status der Gemeinnützigkeit, die Qualifikation, das Maß an Verantwortung und den branchenüblichen Rahmen.\n6.Mittelbeschaffung und -verwendung sowie die Vermögenslage werden nachvollziehbar dokumentiert und angemessen geprüft.\n7.Die Organisation berichtet offen und umfassend über ihre Arbeit, Strukturen und Finanzen.\nTräger des DZI Spenden-Siegels seit 16.12.2010\nKontakt\nWebsite\nwww.hammer-forum.de\nE-Mail\ninfo@hammer-forum.de\nTelefon\n02381-871720\nFax\n02381-8717219\nAnschrift\nCaldenhofer Weg 118\n59063 Hamm\nSpendenkonten\nIBAN: DE33410500950004070181\nBIC: WELADED1HAM\nSparkasse Hamm\nAllgemeine Informationen\nGründungsjahr\n1991\nSitz der Organisation\nHamm\nRechtsform\nVerein\nWeltanschauliche Ausrichtung\nunabhängig\nOrganisation\nLeitungsorgan\nVorstand\nMitglieder/Gesellschafter\n110 stimmberechtigte Mitglieder\nAnzahl Mitarbeiter Hilfetext\nhauptamtlich: 7 ehrenamtlich: 60"
  },
  {
    "title": "Hans-Rosenthal-Stiftung – Schnelle Hilfe in akuter Not – e.V.",
    "url": "https://www.dzi.de/organisation/hans-rosenthal-stiftung-schnelle-hilfe-in-akuter-not-e-v/",
    "weltanschaulicheAusrichtung": "unabhängig",
    "finanzen": {
      "bezugsjahr": 2018,
      "gesamtEinnahmen": "1.942.311,76 EUR",
      "anteilKosten": "angemessen"
    },
    "volltext": "Arbeitsschwerpunkte\nBehindertenhilfe, Einzelfallhilfe, Familienfürsorge, Gesundheitshilfe, Kinder- und Jugendhilfe\nLänderschwerpunkte\nDeutschland, Österreich, Schweiz\nTätigkeitsfelder\nDer Verein leistet Einzelfallhilfe für Familien und Einzelpersonen, die unverschuldet in Not geraten sind, ihre Bedürftigkeit nicht durch zumutbare Eigenanstrengungen beheben und die eine baldige finanzielle Hilfe von anderer Seite nicht erwarten können. Er setzt damit die Tätigkeit der Aktion „Dalli-Dalli-hilft“ fort, die Hans Rosenthal in seiner Fernsehsendung ins Leben rief.\nFinanzen\nBezugsjahr:\n2018\nGesamteinnahmen:\n1.942.311,76 EUR\nDavon Sammlungseinnahmen Hilfetext:\n1.865.211,04 EUR\nAnteil Werbe- und Verwaltungskosten Hilfetext:\nangemessen\nEinschätzung durch das DZI Hilfetext\nDer Hans-Rosenthal-Stiftung – Schnelle Hilfe in akuter Not – e.V., Berlin, wurde das DZI Spenden-Siegel zuerkannt. Der Verein ist förderungswürdig.\nDie sieben Spenden-Siegel-Standards erfüllt der Verein wie folgt:\n1.Die Organisation leistet satzungsgemäße Arbeit.\n2.Leitung und Aufsicht sind hinreichend angemessen strukturiert, klar voneinander getrennt und werden wirksam wahrgenommen.\n3.Werbung und Öffentlichkeitsarbeit informieren klar, wahr, sachlich und offen.\n4.Der Anteil der Werbe- und Verwaltungsausgaben an den Gesamtausgaben ist nach DZI-Maßstab angemessen („angemessen“ = 10% bis unter 20%). Die Wirksamkeit des Mitteleinsatzes wird überprüft, und die Ergebnisse werden dokumentiert und veröffentlicht.\n5.Die von der Organisation gezahlten Vergütungen berücksichtigen den Status der Gemeinnützigkeit, die Qualifikation, das Maß an Verantwortung und den branchenüblichen Rahmen.\n6.Mittelbeschaffung und -verwendung sowie die Vermögenslage werden nachvollziehbar dokumentiert und angemessen geprüft.\n7.Die Organisation berichtet offen und umfassend über ihre Arbeit, Strukturen und Finanzen.\nTräger des DZI Spenden-Siegels seit 28.10.2003\nKontakt\nWebsite\nwww.hans-rosenthal-stiftung.de\nE-Mail\nhans-rosenthal-stiftung@t-online.de\nTelefon\n030-7724355\nFax\n030-7724451\nAnschrift\nPostfach 45 04 04\n12174 Berlin\nSpendenkonten\nIBAN: DE28100708480150420800\nBIC: DEUTDEDB110\nBerliner Bank Niederlassung der Deutsche Bank PGK\nAllgemeine Informationen\nGründungsjahr\n1987\nSitz der Organisation\nBerlin\nRechtsform\nVerein\nWeltanschauliche Ausrichtung\nunabhängig\nOrganisation\nLeitungsorgan\nVorstand\nMitglieder/Gesellschafter\n7 stimmberechtigte Mitglieder\nAnzahl Mitarbeiter Hilfetext\nhauptamtlich: 1"
  },
  {
    "title": "Indienhilfe e.V.",
    "url": "https://www.dzi.de/organisation/indienhilfe-e-v/",
    "weltanschaulicheAusrichtung": "unabhängig",
    "finanzen": {
      "bezugsjahr": 2018,
      "gesamtEinnahmen": "519.143,56 EUR",
      "anteilKosten": "niedrig"
    },
    "volltext": "Arbeitsschwerpunkte\nBildung, Bildungs- und Kampagnenarbeit, Entwicklungszusammenarbeit, Gesundheitshilfe, Kinder- und Jugendhilfe, Menschenrechte, Völkerverständigung\nLänderschwerpunkte\nDeutschland, Indien\nTätigkeitsfelder\nZiel der Projektarbeit der Indienhilfe e.V. ist die Verbesserung der Lebensbedingungen von Kindern und Jugendlichen aus armen und benachteiligten Familien in ländlichen Gebieten Westbengalens sowie in Slums in Kalkutta in den Bereichen Bildung, Gesundheit, Ernährung und Recht. Schwerpunkt der Vereinsaktivitäten ist der Kampf gegen Kinderarbeit. Bei der Durchführung der Fördermaßnahmen arbeitet die Indienhilfe e.V. mit ortsansässigen Nichtregierungsorganisationen zusammen. Darüber hinaus setzt sich die Organisation für politische Teilhabe der geförderten Personengruppen ein und fördert die Vernetzung der indischen Projektpartner untereinander. In Deutschland ist der Verein als eine von 25 bayerischen Eine Welt-Stationen anerkannt und unterhält ein Indien-Archiv. Zudem vermittelt und begleitet er Schul- und Städtepartnerschaften zwischen Bayern und Indien und beteiligt sich am regionalen Agenda-21-Prozess. Durch den angeschlossenen Weltladen und die Beteiligung an Kampagnen unterstützt die Indienhilfe e.V. den fairen Handel.\nFinanzen\nBezugsjahr:\n2018\nGesamteinnahmen:\n519.143,56 EUR\nDavon Sammlungseinnahmen Hilfetext:\n345.092,48 EUR\nAnteil Werbe- und Verwaltungskosten Hilfetext:\nniedrig\nEinschätzung durch das DZI Hilfetext\nDer Indienhilfe e.V., Herrsching am Ammersee, wurde das DZI Spenden-Siegel zuerkannt. Der Verein ist förderungswürdig.\nDie sieben Spenden-Siegel-Standards erfüllt der Verein wie folgt:\n1.Die Organisation leistet satzungsgemäße Arbeit.\n2.Leitung und Aufsicht sind angemessen strukturiert, klar voneinander getrennt und werden wirksam wahrgenommen.\n3.Werbung und Öffentlichkeitsarbeit informieren klar, wahr, sachlich und offen.\n4.Der Anteil der Werbe- und Verwaltungsausgaben an den Gesamtausgaben ist nach DZI-Maßstab niedrig („niedrig“ = unter 10%). Die Wirksamkeit des Mitteleinsatzes wird überprüft, und die Ergebnisse werden dokumentiert und veröffentlicht.\n5.Die von der Organisation gezahlten Vergütungen berücksichtigen den Status der Gemeinnützigkeit, die Qualifikation, das Maß an Verantwortung und den branchenüblichen Rahmen.\n6.Mittelbeschaffung und -verwendung sowie die Vermögenslage werden nachvollziehbar dokumentiert und angemessen geprüft.\n7.Die Organisation berichtet offen und umfassend über ihre Arbeit, Strukturen und Finanzen.\nTräger des DZI Spenden-Siegels seit 30.03.1998\nKontakt\nWebsite\nwww.indienhilfe-herrsching.de\nE-Mail\nemail@indienhilfe-herrsching.de\nTelefon\n08152-1231\nFax\n08152-48278\nAnschrift\nLuitpoldstraße 20, im Welthaus „Alte Schule“\n82211 Herrsching am Ammersee\nSpendenkonten\nIBAN: DE29702501500430377663\nBIC: BYLADEM1KMS\nKreissparkasse München Starnberg Ebersberg\nAllgemeine Informationen\nGründungsjahr\n1980\nSitz der Organisation\nHerrsching am Ammersee\nRechtsform\nVerein\nWeltanschauliche Ausrichtung\nunabhängig\nOrganisation\nLeitungsorgan\nVorstand\nMitglieder/Gesellschafter\n55 stimmberechtigte Mitglieder\nAnzahl Mitarbeiter Hilfetext\nhauptamtlich: 12 ehrenamtlich: 25"
  },
  {
    "title": "Indienhilfe Köln e.V.",
    "url": "https://www.dzi.de/organisation/indienhilfe-koeln-e-v/",
    "weltanschaulicheAusrichtung": "christlich",
    "finanzen": {
      "bezugsjahr": 2018,
      "gesamtEinnahmen": "253.108,25 EUR",
      "anteilKosten": "niedrig"
    },
    "volltext": "Arbeitsschwerpunkte\nAids, Bildung, Frauenförderung, Gesundheitshilfe, Kinder- und Jugendhilfe, Kinderpatenschaft\nLänderschwerpunkte\nÄthiopien, Indien, Kenia, Tansania\nTätigkeitsfelder\nDer Verein unterstützt Projekte der katholischen Schwesterngemeinschaft „Helpers of Mary“ in Indien, Kenia, Äthiopien und Tansania, insbesondere durch Kinderpatenschaften. Diese Gemeinschaft wurde 1942 durch die gebürtige Deutsche Anna Huberta Roggendorf in Andheri, einem Vorort Mumbais (Bombays), gegründet. Die „Helpers of Mary“ betreuen zirka 60 Sozialstationen und mehrere Kinderheime, in denen Kinder, die kein Zuhause haben, von den Schwestern versorgt werden, sowie diverse Krankenbehandlungszentren und Entbindungsstationen. Einen weiteren Schwerpunkt der Arbeit der Schwestern stellt die Betreuung von Lepra- und Aidskranken dar. Zudem unterhält die Schwesterngemeinschaft in verschiedenen Stationen mobile Kliniken und engagiert sich im Bereich der Frauenförderung.\nFinanzen\nBezugsjahr:\n2018\nGesamteinnahmen:\n253.108,25 EUR\nDavon Sammlungseinnahmen Hilfetext:\n253.108,25 EUR\nAnteil Werbe- und Verwaltungskosten Hilfetext:\nniedrig\nEinschätzung durch das DZI Hilfetext\nIndienhilfe Köln e.V., Köln, wurde das DZI Spenden-Siegel zuerkannt. Der Verein ist förderungswürdig.\nDie sieben Spenden-Siegel-Standards erfüllt der Verein wie folgt:\n1.Die Organisation leistet satzungsgemäße Arbeit.\n2.Leitung und Aufsicht sind angemessen strukturiert, klar voneinander getrennt und werden wirksam wahrgenommen.\n3.Werbung und Öffentlichkeitsarbeit informieren klar, wahr, sachlich und offen.\n4.Der Anteil der Werbe- und Verwaltungsausgaben an den Gesamtausgaben ist nach DZI-Maßstab niedrig („niedrig“ = unter 10%). Die Wirksamkeit des Mitteleinsatzes wird überprüft, und die Ergebnisse werden dokumentiert und veröffentlicht.\n5.Vergütungen (trifft nicht zu).\n6.Mittelbeschaffung und -verwendung sowie die Vermögenslage werden nachvollziehbar dokumentiert und angemessen geprüft.\n7.Die Organisation berichtet offen und umfassend über ihre Arbeit, Strukturen und Finanzen.\nTräger des DZI Spenden-Siegels seit 26.08.1992\nKontakt\nWebsite\nwww.indienhilfe.koeln\nE-Mail\nindienhilfe-koeln@online.de\nTelefon\n02266-3674\nAnschrift\nc/o Martin Kramm, Pollerhofstraße 33a\n51789 Lindlar\nSpendenkonten\nIBAN: DE41370601930036480017\nBIC: GENODED1PAX\nPax-Bank\nAllgemeine Informationen\nGründungsjahr\n1981\nSitz der Organisation\nKöln\nRechtsform\nVerein\nWeltanschauliche Ausrichtung\nchristlich\nOrganisation\nLeitungsorgan\nVorstand\nMitglieder/Gesellschafter\n47 stimmberechtigte Mitglieder\nAnzahl Mitarbeiter Hilfetext\nehrenamtlich: 4"
  },
  {
    "title": "Jambo Bukoba e.V.",
    "url": "https://www.dzi.de/organisation/jambo-bukoba-e-v/",
    "weltanschaulicheAusrichtung": "unabhängig",
    "finanzen": {
      "bezugsjahr": 2017,
      "gesamtEinnahmen": "329.727,40 EUR",
      "anteilKosten": "vertretbar"
    },
    "volltext": "Arbeitsschwerpunkte\nAids, Bildung, Entwicklungszusammenarbeit, Frauenförderung, Gesundheitshilfe, Kinder- und Jugendhilfe\nLänderschwerpunkte\nTansania\nTätigkeitsfelder\nJambo Bukoba e.V. betreibt in der Region Kagera/Tansania unterschiedliche Projekte. Alle Projekte werden unter Rücksichtnahme auf die bestehenden tansanischen Verhältnisse sowie unter Einbeziehung der betroffenen Bevölkerung geplant und durchgeführt. Zu den konkreten Aktivitäten des Vereins gehört insbesondere die Umsetzung des sportpädagogischen Programms „Life Skills through Games“, welches gemeinsam mit der Deutschen Sporthochschule in Köln entwickelt wurde. Es umfasst Workshops für Lehrer zu den Themen Bildung, Gleichberechtigung und Gesundheit (z.B. Aufklärungsarbeit zum Thema Aids) sowie die Durchführung von Sportwettbewerben unter Teilnahme von Mädchen und Jungen. Hierbei werden „Lebenskompetenzen“ wie beispielsweise Kommunikationsfähigkeit, Selbstvertrauen und Teamwork vermittelt. Die Gewinnerschule wird bei einem Schulbauprojekt unterstützt (z.B. Sanitäranlagen, Klassenräume), wobei zur Stärkung der Eigenverantwortung von den lokalen Akteuren eine finanzielle Beteiligung in Höhe von 25 Prozent vorausgesetzt wird. Ziel des spezifischen Förderansatzes von Jambo Bukoba e.V. ist es, Kindern und Jugendlichen mithilfe des Sports neue Lebensperspektiven zu eröffnen, damit diese ihr Leben selbstbestimmt und in Würde gestalten können. Darüber hinaus fördert der Verein den Bau von Wasserreservoirs und Handwaschanlagen an Grundschulen sowie die Durchführung von Workshops zum Thema Hygiene. Zudem beteiligt sich die Organisation auch bei der Hilfe nach Katastrophen.\nFinanzen\nBezugsjahr:\n2017\nGesamteinnahmen:\n329.727,40 EUR\nDavon Sammlungseinnahmen Hilfetext:\n196.113,36 EUR\nAnteil Werbe- und Verwaltungskosten Hilfetext:\nvertretbar\nEinschätzung durch das DZI Hilfetext\nJambo Bukoba e.V., München, wurde das DZI Spenden-Siegel zuerkannt. Der Verein ist förderungswürdig.\nDie sieben Spenden-Siegel-Standards erfüllt der Verein wie folgt:\n1.Die Organisation leistet satzungsgemäße Arbeit.\n2.Leitung und Aufsicht sind angemessen strukturiert, klar voneinander getrennt und werden wirksam wahrgenommen.\n3.Werbung und Öffentlichkeitsarbeit informieren hinreichend klar, wahr, sachlich und offen.\n4.Der Anteil der Werbe- und Verwaltungsausgaben an den Gesamtausgaben ist nach DZI-Maßstab vertretbar („vertretbar“ = 20% bis 30%). Die Wirksamkeit des Mitteleinsatzes wird überprüft, und die Ergebnisse werden dokumentiert und veröffentlicht.\n5.Die von der Organisation gezahlten Vergütungen berücksichtigen den Status der Gemein-\nnützigkeit, die Qualifikation, das Maß an Verantwortung und den branchenüblichen Rahmen.\n6.Mittelbeschaffung und -verwendung sowie die Vermögenslage werden nachvollziehbar dokumentiert und angemessen geprüft.\n7.Die Organisation berichtet offen und hinreichend umfassend über ihre Arbeit, Strukturen und Finanzen.\nTräger des DZI Spenden-Siegels seit 05.12.2019\nKontakt\nWebsite\nwww.jambobukoba.com\nE-Mail\nclemens.mulokozi@jambobukoba.com\nTelefon\n0173-4333202\nAnschrift\nHeinrich-Wieland-Str. 170\n81735 München\nSpendenkonten\nIBAN: DE59700202700660531637\nBIC: HYVEDEMMXXX\nUniCredit Bank - HypoVereinsbank\nAllgemeine Informationen\nGründungsjahr\n2008\nSitz der Organisation\nMünchen\nRechtsform\nVerein\nWeltanschauliche Ausrichtung\nunabhängig\nOrganisation\nLeitungsorgan\nVorstand\nMitglieder/Gesellschafter\n380 stimmberechtigte Mitglieder\nAnzahl Mitarbeiter Hilfetext\nhauptamtlich: 11 ehrenamtlich: 57"
  },
  {
    "title": "Johannes-Hospiz Münster gGmbH",
    "url": "https://www.dzi.de/organisation/johannes-hospiz-muenster-ggmbh/",
    "weltanschaulicheAusrichtung": "christlich",
    "finanzen": {
      "bezugsjahr": 2018,
      "gesamtEinnahmen": "2.356.149,72 EUR",
      "anteilKosten": "angemessen"
    },
    "volltext": "Arbeitsschwerpunkte\nAltenhilfe, Bildung, Gesundheitshilfe\nLänderschwerpunkte\nDeutschland\nTätigkeitsfelder\nDie Gesellschaft betreibt ein Hospiz für schwerkranke und sterbende Menschen in Münster. Die Aufnahme erfolgt auf eigenen Wunsch. Der Fort- und Weiterbildungsbereich (Akademie) des Johannes-Hospizes wendet sich insbesondere an Fachkräfte im medizinisch-pflegerischen Bereich. Des Weiteren bildet die Organisation ehrenamtliche Helferinnen und Helfer für ihre Aufgabe in der Begleitung Sterbender und ihrer Angehörigen aus. Sie unterhält einen ehrenamtlichen ambulanten Hospizdienst und führt Öffentlichkeitsarbeit zum Thema Sterben und Tod durch.\nFinanzen\nBezugsjahr:\n2018\nGesamteinnahmen:\n2.356.149,72 EUR\nDavon Sammlungseinnahmen Hilfetext:\n647.159,22 EUR\nAnteil Werbe- und Verwaltungskosten Hilfetext:\nangemessen\nEinschätzung durch das DZI Hilfetext\nDer Johannes-Hospiz Münster gGmbH, Münster, wurde das DZI Spenden-Siegel zuerkannt. Die Organisation ist förderungswürdig.\nDie sieben Spenden-Siegel-Standards erfüllt die Gesellschaft wie folgt:\n1.Die Organisation leistet satzungsgemäße Arbeit.\n2.Leitung und Aufsicht sind angemessen strukturiert, klar voneinander getrennt und werden wirksam wahrgenommen.\n3.Werbung und Öffentlichkeitsarbeit informieren klar, wahr, sachlich und offen.\n4.Der Anteil der Werbe- und Verwaltungsausgaben an den Gesamtausgaben ist nach DZI-Maßstab angemessen („angemessen“ = 10% bis unter 20%). Die Wirksamkeit des Mitteleinsatzes wird überprüft, und die Ergebnisse werden dokumentiert und veröffentlicht.\n5.Die von der Organisation gezahlten Vergütungen berücksichtigen den Status der Gemeinnützigkeit, die Qualifikation, das Maß an Verantwortung und den branchenüblichen Rahmen.\n6.Mittelbeschaffung und -verwendung sowie die Vermögenslage werden nachvollziehbar dokumentiert und angemessen geprüft.\n7.Die Organisation berichtet offen und umfassend über ihre Arbeit, Strukturen und Finanzen.\nTräger des DZI Spenden-Siegels seit 24.07.2008\nKontakt\nWebsite\nwww.johannes-hospiz.de\nE-Mail\ninfo@johannes-hospiz.de\nTelefon\n0251-9337626\nFax\n0251-9337598\nAnschrift\nSt. Mauritz-Freiheit 44\n48145 Münster\nSpendenkonten\nIBAN: DE30400602650002222600\nBIC: GENODEM1DKM\nDKM Darlehnskasse Münster\nAllgemeine Informationen\nGründungsjahr\n1998\nSitz der Organisation\nMünster\nRechtsform\nGmbH\nWeltanschauliche Ausrichtung\nchristlich\nOrganisation\nLeitungsorgan\nGeschäftsführung\nMitglieder/Gesellschafter\n4 stimmberechtigte Mitglieder\nAnzahl Mitarbeiter Hilfetext\nhauptamtlich: 35 ehrenamtlich: 92"
  },
  {
    "title": "Karuna Deutschland e.V.",
    "url": "https://www.dzi.de/organisation/karuna-deutschland-e-v/",
    "weltanschaulicheAusrichtung": "sonstige",
    "finanzen": {
      "bezugsjahr": 2019,
      "gesamtEinnahmen": "495.549,66 EUR",
      "anteilKosten": "niedrig"
    },
    "volltext": "Arbeitsschwerpunkte\nBildung, Entwicklungszusammenarbeit, Frauenförderung, Gesundheitshilfe, Kinder- und Jugendhilfe, Menschenrechte\nLänderschwerpunkte\nIndien, Nepal\nTätigkeitsfelder\nKaruna Deutschland e.V. unterstützt verschiedene Projekte in Indien und Nepal. Dazu arbeitet der Verein unter anderem mit der britischen Schwesterorganisation Karuna Trust London und ortsansässigen Partnerorganisationen zusammen. Vor dem Hintergrund der Hilfe zur Selbsthilfe finanziert der Verein insbesondere Schulen für Mädchen und Jungen, ein Wohnheim für benachteiligte Mädchen und junge Frauen sowie den Bau und Unterhalt von Geburtshilfestationen. Ziel der Fördermaßnahmen ist es, Armut und Diskriminierung zu überwinden und insbesondere Mädchen, Frauen und Angehörigen der niedrigen Kasten (Dalits und Adivasi) neue Lebensperspektiven und einen selbstbestimmten Lebensweg zu ermöglichen. Der Verein fördert zudem die Einrichtung von Selbsthilfegruppen, die sich für die Stärkung von Frauen und die Wahrung der Menschenrechte einsetzen. Hierzu gehören beispielsweise das „Maitri-Netzwerk“ und das Projekt „Stimme der Frauen“, die unter anderem Frauen aus marginalisierten Gruppen nach Gewalterfahrungen in die Lage versetzen, juristische Schritte einzuleiten. Ein weiteres Projekt unterstützt junge Frauen durch Aus- und Fortbildung gemeinsam ein Kleingewerbe zu gründen und auf diese Weise dauerhaft eigenes Einkommen zu erwirtschaften.\nFinanzen\nBezugsjahr:\n2019\nGesamteinnahmen:\n495.549,66 EUR\nDavon Sammlungseinnahmen Hilfetext:\n40.143,59 EUR\nAnteil Werbe- und Verwaltungskosten Hilfetext:\nniedrig\nEinschätzung durch das DZI Hilfetext\nKaruna Deutschland e.V., Essen, wurde das DZI Spenden-Siegel zuerkannt. Der Verein ist förderungswürdig.\n1.Die Organisation leistet satzungsgemäße Arbeit.\n2.Leitung und Aufsicht sind angemessen strukturiert, klar voneinander getrennt und werden wirksam wahrgenommen.\n3.Werbung und Öffentlichkeitsarbeit informieren klar, wahr, sachlich und offen.\n4.Der Anteil der Werbe- und Verwaltungsausgaben an den Gesamtausgaben ist nach DZI-Maßstab niedrig („niedrig“ = unter 10%). Die Wirksamkeit des Mitteleinsatzes wird überprüft, und die Ergebnisse werden dokumentiert und veröffentlicht.\n5.Die von der Organisation gezahlten Vergütungen berücksichtigen den Status der Gemein-\nnützigkeit, die Qualifikation, das Maß an Verantwortung und den branchenüblichen Rahmen.\n6.Mittelbeschaffung und -verwendung sowie die Vermögenslage werden überwiegend nachvollziehbar dokumentiert und angemessen geprüft.\n7.Die Organisation berichtet offen und hinreichend umfassend über ihre Arbeit, Strukturen und Finanzen.\nTräger des DZI Spenden-Siegels seit 02.11.2020\nKontakt\nWebsite\nwww.karunadeutschland.org\nE-Mail\ninfo@karunadeutschland.org\nTelefon\n0201-45866102\nAnschrift\nHerkulesstraße 13 a\n45127 Essen\nSpendenkonten\nIBAN: DE54430609674019173700\nBIC: GENODEM1GLS\nGLS Gemeinschaftsbank\nAllgemeine Informationen\nGründungsjahr\n2007\nSitz der Organisation\nEssen\nRechtsform\nVerein\nWeltanschauliche Ausrichtung\nsonstige\nOrganisation\nLeitungsorgan\nVorstand\nMitglieder/Gesellschafter\n26 stimmberechtigte Mitglieder\nAnzahl Mitarbeiter Hilfetext\nhauptamtlich: 1 ehrenamtlich: 8"
  },
  {
    "title": "Katachel e.V.",
    "url": "https://www.dzi.de/organisation/katachel-e-v/",
    "weltanschaulicheAusrichtung": "unabhängig",
    "finanzen": {
      "bezugsjahr": 2019,
      "gesamtEinnahmen": "208.498,96 EUR",
      "anteilKosten": "niedrig"
    },
    "volltext": "Arbeitsschwerpunkte\nBehindertenhilfe, Bildung, Einzelfallhilfe, Entwicklungszusammenarbeit, Familienfürsorge, Frauenförderung, Gesundheitshilfe\nLänderschwerpunkte\nAfghanistan\nTätigkeitsfelder\nDer Verein fördert Projekte in der Provinz Kunduz im Norden Afghanistans. Hier unterhält er Patenschaften für Witwen und deren Kinder, leistet Hilfe für weitere Bedürftige, unterstützt den Bau und Betrieb von Schulen und fördert Infrastrukturmaßnahmen.\nFinanzen\nBezugsjahr:\n2019\nGesamteinnahmen:\n208.498,96 EUR\nDavon Sammlungseinnahmen Hilfetext:\n208.498,96 EUR\nAnteil Werbe- und Verwaltungskosten Hilfetext:\nniedrig\nEinschätzung durch das DZI Hilfetext\nKatachel e.V., Bergfeld, wurde das DZI Spenden-Siegel zuerkannt. Der Verein ist förderungswürdig.\nDie sieben Spenden-Siegel-Standards erfüllt der Verein wie folgt:\n1.Die Organisation leistet satzungsgemäße Arbeit.\n2.Leitung und Aufsicht sind angemessen strukturiert, klar voneinander getrennt und werden wirksam wahrgenommen.\n3.Werbung und Öffentlichkeitsarbeit informieren klar, wahr, sachlich und offen.\n4.Der Anteil der Werbe- und Verwaltungsausgaben an den Gesamtausgaben ist nach DZI-Maßstab niedrig („niedrig“ = unter 10%). Die Wirksamkeit des Mitteleinsatzes wird überprüft, und die Ergebnisse werden dokumentiert und veröffentlicht.\n5.Vergütungen (trifft nicht zu).\n6.Mittelbeschaffung und -verwendung sowie die Vermögenslage werden nachvollziehbar dokumentiert und angemessen geprüft.\n7.Die Organisation berichtet offen und umfassend über ihre Arbeit, Strukturen und Finanzen.\nTräger des DZI Spenden-Siegels seit 12.03.2003\nKontakt\nWebsite\nwww.katachel.de\nE-Mail\ninfo@katachel.de\nTelefon\n05368-505\nFax\n05368-978016\nAnschrift\nHauptstraße 1a\n38467 Bergfeld\nSpendenkonten\nIBAN: DE24269513110014160006\nBIC: NOLADE21GFW\nSparkasse Gifhorn-Wolfsburg\nAllgemeine Informationen\nGründungsjahr\n1994\nSitz der Organisation\nBergfeld\nRechtsform\nVerein\nWeltanschauliche Ausrichtung\nunabhängig\nOrganisation\nLeitungsorgan\nVorstand\nMitglieder/Gesellschafter\n121 stimmberechtigte Mitglieder\nAnzahl Mitarbeiter Hilfetext\nehrenamtlich: 5"
  },
  {
    "title": "LandsAid e.V. – Verein für Internationale Humanitäre Hilfe",
    "url": "https://www.dzi.de/organisation/landsaid-e-v-verein-fuer-internationale-humanitaere-hilfe/",
    "weltanschaulicheAusrichtung": "unabhängig",
    "finanzen": {
      "bezugsjahr": 2018,
      "gesamtEinnahmen": "556.107,97 EUR",
      "anteilKosten": "angemessen"
    },
    "volltext": "Arbeitsschwerpunkte\nBildung, Entwicklungszusammenarbeit, Gesundheitshilfe, Katastrophenhilfe\nLänderschwerpunkte\nBangladesch, Deutschland, Ecuador, Haiti, Indonesien, Jemen, Jordanien, Kenia, Kongo, Nepal, Pakistan, Uganda\nTätigkeitsfelder\nLandsAid verfolgt das Ziel, Menschen, die durch Natur- oder Umweltkatastrophen, durch bewaffnete Konflikte oder Unterdrückung in Not geraten sind, zu helfen. Neben notfallmedizinischer Versorgung in Katastrophenfällen fördert der Verein Projekte in den Bereichen Basismedizin und Ernährung. Ein weiterer Schwerpunkt der Vereinsarbeit liegt in der Ausbildung von Einsatzkräften. Sie beinhaltet die Einsatzvor- und -nachbereitung ebenso wie die Personalfürsorge während des Einsatzes und bietet den Teilnehmern die Möglichkeit zur Orientierung und den Einstieg in die humanitäre Arbeit. Die Ausbildung ist offen für alle Interessierten und nicht zwingend mit einem Einsatz für LandsAid verbunden. Jedoch bietet die Organisation interessierten Projektmitarbeitern die Möglichkeit, sich in der LandsAid-Datenbank registrieren zu lassen.\nFinanzen\nBezugsjahr:\n2018\nGesamteinnahmen:\n556.107,97 EUR\nDavon Sammlungseinnahmen Hilfetext:\n127.497,40 EUR\nAnteil Werbe- und Verwaltungskosten Hilfetext:\nangemessen\nEinschätzung durch das DZI Hilfetext\nLandsAid e.V. – Verein für Internationale Humanitäre Hilfe, Kaufering, wurde das DZI Spenden-Siegel zuerkannt. Der Verein ist förderungswürdig.\nDie sieben Spenden-Siegel-Standards erfüllt der Verein wie folgt:\n1.Die Organisation leistet satzungsgemäße Arbeit.\n2.Leitung und Aufsicht sind angemessen strukturiert, klar voneinander getrennt und werden wirksam wahrgenommen.\n3.Werbung und Öffentlichkeitsarbeit informieren klar, wahr, sachlich und offen.\n4.Der Anteil der Werbe- und Verwaltungsausgaben an den Gesamtausgaben ist nach DZI-Maßstab angemessen („angemessen“ = 10% bis 20%). Die Wirksamkeit des Mitteleinsatzes wird überprüft, und die Ergebnisse werden dokumentiert und veröffentlicht.\n5.Die von der Organisation gezahlten Vergütungen berücksichtigen den Status der Gemeinnützigkeit, die Qualifikation, das Maß an Verantwortung und den branchenüblichen Rahmen.\n6.Mittelbeschaffung und -verwendung sowie die Vermögenslage werden nachvollziehbar dokumentiert und angemessen geprüft.\n7.Die Organisation berichtet offen und umfassend über ihre Arbeit, Strukturen und Finanzen.\nTräger des DZI Spenden-Siegels seit 09.04.2009\nKontakt\nWebsite\nwww.landsaid.org\nE-Mail\ninfo@landsaid.org\nTelefon\n08191-4287832\nFax\n08191-4287833\nAnschrift\nDr.-Gerbl-Straße 48\n86916 Kaufering\nSpendenkonten\nIBAN: DE66700520600000014001\nBIC: BYLADEM1LLD\nSparkasse Landsberg-Dießen\nAllgemeine Informationen\nGründungsjahr\n2006\nSitz der Organisation\nKaufering\nRechtsform\nVerein\nWeltanschauliche Ausrichtung\nunabhängig\nOrganisation\nLeitungsorgan\nVorstand\nGeschäftsführung\nSven Weber\nMitglieder/Gesellschafter\n30 stimmberechtigte Mitglieder\nAnzahl Mitarbeiter Hilfetext\nhauptamtlich: 9 ehrenamtlich: 5"
  },
  {
    "title": "Leben nach Tschernobyl e.V.",
    "url": "https://www.dzi.de/organisation/leben-nach-tschernobyl-e-v/",
    "weltanschaulicheAusrichtung": "unabhängig",
    "finanzen": {
      "bezugsjahr": 2017,
      "gesamtEinnahmen": "484.871,22 EUR",
      "anteilKosten": "niedrig"
    },
    "volltext": "Arbeitsschwerpunkte\nBehindertenhilfe, Bildung, Bildungs- und Kampagnenarbeit, Gesundheitshilfe, Kinder- und Jugendhilfe, Umwelt- und Naturschutz, Völkerverständigung\nLänderschwerpunkte\nWeißrussland\nTätigkeitsfelder\nDen wesentlichen Schwerpunkt der Aktivitäten von Leben nach Tschernobyl e.V. bildet die Förderung der belarussisch-deutschen gemeinsamen Gesellschaft mit beschränkter Haftung „Rehabilitations- und Erholungskinderzentrum Nadeshda“ in Minsk/Weißrussland. In dieses Zentrum werden Kinder und Jugendliche, die aus durch die Tschernobyl-Katastrophe radioaktiv belasteten Regionen stammen, zu einem mehrwöchigen Erholungsaufenthalt aufgenommen. Zudem fördert der Verein die Umrüstung des Zentrums auf erneuerbare Energien sowie den Aufbau eines zertifizierten Umweltmanagementsystems und begleitet die Entwicklung von Umweltprojekten in Weißrussland. Leben nach Tschernobyl e.V. unterstützt das Zentrum in finanzieller Form (z.B. Finanzierung der Aufenthalte der Kinder, Anschaffung und Instandhaltung von technischen Geräten), durch die Beteiligung an der Leitung und konzeptionellen Entwicklung des Zentrums sowie durch ehrenamtliche Arbeit (z.B. Installationen, Reparaturen, Fortbildung des pädagogischen Personals etc.).\nFinanzen\nBezugsjahr:\n2017\nGesamteinnahmen:\n484.871,22 EUR\nDavon Sammlungseinnahmen Hilfetext:\n56.435,81 EUR\nAnteil Werbe- und Verwaltungskosten Hilfetext:\nniedrig\nEinschätzung durch das DZI Hilfetext\nLeben nach Tschernobyl e.V., Frankfurt am Main, wurde das Spenden-Siegel zuerkannt. Der Verein ist förderungswürdig.\nDie sieben Spenden-Siegel-Standards erfüllt der Verein wie folgt:\n1.Die Organisation leistet satzungsgemäße Arbeit.\n2.Leitung und Aufsicht sind angemessen strukturiert, klar voneinander getrennt und werden wirksam wahrgenommen.\n3.Werbung und Öffentlichkeitsarbeit informieren klar, wahr, sachlich und offen.\n4.Der Anteil der Werbe- und Verwaltungsausgaben an den Gesamtausgaben ist nach DZI-Maßstab niedrig („niedrig“ = unter 10%). Die Wirksamkeit des Mitteleinsatzes wird überprüft, und die Ergebnisse werden dokumentiert und veröffentlicht.\n5.Vergütungen (trifft nicht zu).\n6.Mittelbeschaffung und -verwendung sowie die Vermögenslage werden nachvollziehbar dokumentiert und angemessen geprüft.\n7.Die Organisation berichtet offen und hinreichend umfassend über ihre Arbeit, Strukturen und Finanzen.\nTräger des DZI Spenden-Siegels seit 04.05.2015\nKontakt\nWebsite\nwww.leben-nach-tschernobyl-ev.de\nE-Mail\nLnT.eV@t-online.de\nTelefon\n069-70760317\nFax\n069-70760319\nAnschrift\nLudolfusstraße 2-4\n60487 Frankfurt am Main\nSpendenkonten\nIBAN: DE03520604100004114400\nBIC: GENODEF1EK1\nEvangelische Bank\nAllgemeine Informationen\nGründungsjahr\n1990\nSitz der Organisation\nFrankfurt am Main\nRechtsform\nVerein\nWeltanschauliche Ausrichtung\nunabhängig\nOrganisation\nLeitungsorgan\nVorstand\nMitglieder/Gesellschafter\n28 stimmberechtigte Mitglieder\nAnzahl Mitarbeiter Hilfetext\nehrenamtlich: 4"
  },
  {
    "title": "Malteser Stiftung",
    "url": "https://www.dzi.de/organisation/malteser-stiftung/",
    "weltanschaulicheAusrichtung": "katholisch",
    "finanzen": {
      "bezugsjahr": 2018,
      "gesamtEinnahmen": "923.186,61 EUR",
      "anteilKosten": "niedrig"
    },
    "volltext": "Arbeitsschwerpunkte\nAltenhilfe, Behindertenhilfe, Bildungs- und Kampagnenarbeit, Entwicklungszusammenarbeit, Familienfürsorge, Gesundheitshilfe, Katastrophenhilfe, Kinder- und Jugendhilfe, Religion, Rettungswesen, Suchthilfe\nLänderschwerpunkte\nDeutschland, weltweit\nTätigkeitsfelder\nZiel der Malteser Stiftung ist es, die humanitäre Hilfe des Malteser Hilfsdienst e.V. langfristig zu unterstützen. Zu diesem Zweck fördert die Stiftung verschiedene Aktivitäten des Vereins wie unter anderem die Hospizarbeit, die psychosoziale Krisenintervention oder die Not- und Katastrophenhilfeeinsätze von Malteser International in Entwicklungsländern. Zudem verfügt die Malteser Stiftung über das Malteser Stiftungszentrum der Stiftungszentrum.de Servicegesellschaft mbH über das Vermögen von rund 80 Treuhandstiftungen, deren Erträge für Projekte des Malteser Verbundes verwendet werden.\nFinanzen\nBezugsjahr:\n2018\nGesamteinnahmen:\n923.186,61 EUR\nDavon Sammlungseinnahmen Hilfetext:\n868.694,65 EUR\nAnteil Werbe- und Verwaltungskosten Hilfetext:\nniedrig\nEinschätzung durch das DZI Hilfetext\nDer Malteser Stiftung, München, wurde das DZI Spenden-Siegel zuerkannt. Die Stiftung ist förderungswürdig.\nDie sieben Spenden-Siegel-Standards erfüllt die Stiftung wie folgt:\n1.Die Organisation leistet satzungsgemäße Arbeit.\n2.Leitung und Aufsicht sind angemessen strukturiert, klar voneinander getrennt und werden wirksam wahrgenommen.\n3.Werbung und Öffentlichkeitsarbeit informieren klar, wahr, sachlich und offen.\n4.Der Anteil der Werbe- und Verwaltungsausgaben an den Gesamtausgaben ist nach DZI-Maßstab niedrig („niedrig“ = unter 10%). Die Wirksamkeit des Mitteleinsatzes wird überprüft, und die Ergebnisse werden dokumentiert und in hinreichendem Maße veröffentlicht.\n5.Vergütungen (trifft nicht zu).\n6.Mittelbeschaffung und -verwendung sowie die Vermögenslage werden nachvollziehbar dokumentiert und angemessen geprüft.\n7.Die Organisation berichtet offen und umfassend über ihre Arbeit, Strukturen und Finanzen.\nTräger des DZI Spenden-Siegels seit 16.09.2010\nKontakt\nWebsite\nwww.malteser-stiftung.de\nE-Mail\nstiftung@malteser.org\nTelefon\n0221-98222323\nFax\n040-69459710272\nAnschrift\nErna-Scheffler-Straße 2\n51103 Köln\nSpendenkonten\nIBAN: DE71700205000008869107\nBIC: BFSWDE33MUE\nBank für Sozialwirtschaft\nAllgemeine Informationen\nGründungsjahr\n2003\nSitz der Organisation\nMünchen\nRechtsform\nStiftung\nWeltanschauliche Ausrichtung\nkatholisch\nOrganisation\nLeitungsorgan\nVorstand\nAnzahl Mitarbeiter Hilfetext\nehrenamtlich: 3"
  },
  {
    "title": "Marianne Strauß Stiftung",
    "url": "https://www.dzi.de/organisation/marianne-strauss-stiftung/",
    "weltanschaulicheAusrichtung": "unabhängig",
    "finanzen": {
      "bezugsjahr": 2018,
      "gesamtEinnahmen": "1.595.715,63 EUR",
      "anteilKosten": "niedrig"
    },
    "volltext": "Arbeitsschwerpunkte\nAltenhilfe, Behindertenhilfe, Einzelfallhilfe, Kinder- und Jugendhilfe, Kultur\nLänderschwerpunkte\nDeutschland\nTätigkeitsfelder\nDie Marianne Strauß Stiftung leistet gezielte Einzelfallhilfe. Diese wird insbesondere in Form von finanzieller Hilfe, aber auch durch intensive persönliche Betreuung gewährt. Die Stiftung unterstützt unverschuldet in Not geratene Menschen und hilft in besonderen Härtefällen, in denen gesetzliche oder andere Unterstützungen nicht ausreichend oder nicht rechtzeitig geleistet werden können. Die Fördermittel müssen von den Betroffenen zweckgebunden eingesetzt und ihre Verwendung muss entsprechend nachgewiesen werden. Die Marianne Strauß Stiftung arbeitet teilweise mit anderen gemeinnützigen Organisationen zusammen, darunter Sternstunden e.V., München. Die Hilfeleistungen der Stiftung konzentrieren sich auf das Bundesland Bayern.\nFinanzen\nBezugsjahr:\n2018\nGesamteinnahmen:\n1.595.715,63 EUR\nDavon Sammlungseinnahmen Hilfetext:\n217.081,13 EUR\nAnteil Werbe- und Verwaltungskosten Hilfetext:\nniedrig\nEinschätzung durch das DZI Hilfetext\nDer Marianne Strauss Stiftung, München, wurde das DZI Spenden-Siegel zuerkannt. Die Stiftung ist förderungswürdig.\nDie sieben Spenden-Siegel-Standards erfüllt der Verein wie folgt:\n1.Die Organisation leistet satzungsgemäße Arbeit.\n2.Leitung und Aufsicht sind hinreichend angemessen strukturiert, klar voneinander getrennt und werden wirksam wahrgenommen.\n3.Werbung und Öffentlichkeitsarbeit informieren klar, wahr, sachlich und offen.\n4.Der Anteil der Werbe-und Verwaltungsausgaben an den Gesamtausgaben ist nach DZI-Maßstab niedrig („niedrig“ = unter 10%). Die Wirksamkeit des Mitteleinsatzes wird überprüft, und die Ergebnisse werden dokumentiert und veröffentlicht.\n5.Die von der Organisation gezahlten Vergütungen berücksichtigen den Status der Gemeinnützigkeit, die Qualifikation, das Maß an Verantwortung und den branchenüblichen Rahmen.\n6.Mittelbeschaffung und -verwendung sowie die Vermögenslage werden nachvollziehbar dokumentiert und angemessen geprüft.\n7.Die Organisation berichtet hinreichend offen und umfassend über ihre Arbeit, Strukturen und Finanzen.\nTräger des DZI Spenden-Siegels seit 17.09.2008\nKontakt\nWebsite\nwww.msshilft.de\nE-Mail\ninfo@msshilft.de\nTelefon\n089-294967\nFax\n089-297394\nAnschrift\nOettingenstraße 22\n80538 München\nSpendenkonten\nIBAN: DE30701500001000506517\nBIC: SSKMDEMM\nStadtsparkasse München\nAllgemeine Informationen\nGründungsjahr\n1984\nSitz der Organisation\nMünchen\nRechtsform\nStiftung\nWeltanschauliche Ausrichtung\nunabhängig\nOrganisation\nLeitungsorgan\nStiftungsvorstand\nAnzahl Mitarbeiter Hilfetext\nhauptamtlich: 2 ehrenamtlich: 7"
  },
  {
    "title": "NCL-Stiftung",
    "url": "https://www.dzi.de/organisation/ncl-stiftung/",
    "weltanschaulicheAusrichtung": "unabhängig",
    "finanzen": {
      "bezugsjahr": 2018,
      "gesamtEinnahmen": "1.059.283,03 EUR",
      "anteilKosten": "niedrig"
    },
    "volltext": "Arbeitsschwerpunkte\nForschung, Gesundheitshilfe, Kinder- und Jugendhilfe\nLänderschwerpunkte\nDeutschland, Großbritannien, Luxemburg, USA\nTätigkeitsfelder\nDie NCL-Stiftung konzentriert sich auf die Bekämpfung der Krankheit Neuronale Ceroid Lipofuszinose (NCL), einer erblich bedingten und tödlich verlaufenden Stoffwechselkrankheit, die im Kindesalter ausbricht und ein zunehmendes Absterben von Nervenzellen zur Folge hat. Die Kinder verlieren sukzessive die Fähigkeit zu sehen, zu gehen und zu handeln. Im Endstadium können schließlich auch die lebenserhaltenden Funktionen nicht mehr aufrechterhalten werden. Ziel der Stiftung ist es, über die Krankheit und deren Verlauf aufzuklären, Forschungsprojekte zu initiieren, Netzwerke von Wissenschaftlern unterschiedlicher Disziplinen aufzubauen und bereits vorhandenes Wissen verwandter Gebiete zu bündeln, um letztlich Heilungsstrategien zu entwickeln. Des Weiteren übernimmt die Stiftung die Beratung von NCL-interessierten Forschenden und die Vermittlung von Drittmitteln, die von Firmen und anderen Organisationen vergeben werden.\nFinanzen\nBezugsjahr:\n2018\nGesamteinnahmen:\n1.059.283,03 EUR\nDavon Sammlungseinnahmen Hilfetext:\n925.025,83 EUR\nAnteil Werbe- und Verwaltungskosten Hilfetext:\nniedrig\nEinschätzung durch das DZI Hilfetext\nDer NCL-Stiftung, Hamburg, wurde das DZI Spenden-Siegel zuerkannt. Die Stiftung ist förderungswürdig.\nDie sieben Spenden-Siegel-Standards erfüllt die Stiftung wie folgt:\n1.Die Organisation leistet satzungsgemäße Arbeit.\n2.Leitung und Aufsicht sind angemessen strukturiert, klar voneinander getrennt und werden wirksam wahrgenommen.\n3.Werbung und Öffentlichkeitsarbeit informieren klar, wahr, sachlich und offen.\n4.Der Anteil der Werbe-und Verwaltungsausgaben an den Gesamtausgaben ist nach DZI-Maßstab niedrig („niedrig“ = unter 10%). Die Wirksamkeit des Mitteleinsatzes wird überprüft, und die Ergebnisse werden dokumentiert und veröffentlicht.\n5.Die von der Organisation gezahlten Vergütungen berücksichtigen den Status der Gemeinnützigkeit, die Qualifikation, das Maß an Verantwortung und den branchenüblichen Rahmen.\n6.Mittelbeschaffung und -verwendung sowie die Vermögenslage werden nachvollziehbar dokumentiert und angemessen geprüft.\n7.Die Organisation berichtet offen und umfassend über ihre Arbeit, Strukturen und Finanzen.\nTräger des DZI Spenden-Siegels seit 31.05.2006\nKontakt\nWebsite\nwww.ncl-stiftung.de\nE-Mail\ninfo@ncl-stiftung.de\nTelefon\n040-69666740\nFax\n040-696667469\nAnschrift\nHolstenwall 10\n20355 Hamburg\nSpendenkonten\nIBAN: DE50200505501059223030\nBIC: HASPDEHHXXX\nHamburger Sparkasse\nAllgemeine Informationen\nGründungsjahr\n2002\nSitz der Organisation\nHamburg\nRechtsform\nStiftung\nWeltanschauliche Ausrichtung\nunabhängig\nOrganisation\nLeitungsorgan\nVorstand\nAnzahl Mitarbeiter Hilfetext\nhauptamtlich: 10 ehrenamtlich: 9"
  },
  {
    "title": "NETZ Partnerschaft für Entwicklung und Gerechtigkeit e.V.",
    "url": "https://www.dzi.de/organisation/netz-partnerschaft-fuer-entwicklung-und-gerechtigkeit-e-v/",
    "weltanschaulicheAusrichtung": "unabhängig",
    "finanzen": {
      "bezugsjahr": 2018,
      "gesamtEinnahmen": "3.479.406,92 EUR",
      "anteilKosten": "niedrig"
    },
    "volltext": "Arbeitsschwerpunkte\nBildung, Bildungs- und Kampagnenarbeit, Corona-Hilfe, Entwicklungszusammenarbeit, Frauenförderung, Katastrophenhilfe, Menschenrechte, Völkerverständigung\nLänderschwerpunkte\nBangladesch, Deutschland, Indien\nTätigkeitsfelder\nNETZ Bangladesch ist insbesondere auf dem Gebiet der Entwicklungszusammenarbeit tätig. Inhaltlich legt der Verein die Schwerpunkte auf Einkommen schaffende Maßnahmen, Grundbildung und Menschenrechte. Konkret werden in Projekten lokaler Kooperationspartner zum Beispiel Existenzgründungen insbesondere von Frauen, sowie Kleinkreditprogramme, Aus- und Fortbildungsprojekte, Schulen oder auch Menschenrechtsbildung für Benachteiligte unterstützt. Mit dem Programm „Ein Leben lang genug Reis“ werden auch in Indien Familien in die Lage versetzt, dauerhaft eigenes Einkommen zu erwirtschaften. Darüber hinaus leistet die Organisation Hilfe in Katastrophenfällen. Der Verein ist des Weiteren als Entsendeorganisation des Freiwilligenprogramms „weltwärts“ des Bundesministerium für wirtschaftliche Zusammenarbeit und Entwicklung (BMZ) anerkannt. Im Inland ist NETZ Bangladesch in der Bildungs- und Öffentlichkeitsarbeit aktiv. Hierzu gehören Aufklärungsarbeit in Schulen, Veranstaltungen und Aktionstage in Kirchengemeinden, Austauschprogramme und Tagungen, der Austausch mit anderen Organisationen und die Herausgabe von Infoschriften.\nFinanzen\nBezugsjahr:\n2018\nGesamteinnahmen:\n3.479.406,92 EUR\nDavon Sammlungseinnahmen Hilfetext:\n511.910,93 EUR\nAnteil Werbe- und Verwaltungskosten Hilfetext:\nniedrig\nEinschätzung durch das DZI Hilfetext\nNETZ Partnerschaft für Entwicklung und Gerechtigkeit e.V., Wetzlar, wurde das DZI Spenden-Siegel zuerkannt. Der Verein ist förderungswürdig.\nDie sieben Spenden-Siegel-Standards erfüllt der Verein wie folgt:\n1.Die Organisation leistet satzungsgemäße Arbeit.\n2.Leitung und Aufsicht sind angemessen strukturiert, klar voneinander getrennt und werden wirksam wahrgenommen.\n3.Werbung und Öffentlichkeitsarbeit informieren klar, wahr, sachlich und offen.\n4.Der Anteil der Werbe- und Verwaltungsausgaben an den Gesamtausgaben ist nach DZI-Maßstab niedrig („niedrig“ = unter 10%). Die Wirksamkeit des Mitteleinsatzes wird überprüft, und die Ergebnisse werden dokumentiert und veröffentlicht.\n5.Die von der Organisation gezahlten Vergütungen berücksichtigen den Status der Gemein-\nnützigkeit, die Qualifikation, das Maß an Verantwortung und den branchenüblichen Rahmen.\n6.Mittelbeschaffung und -verwendung sowie die Vermögenslage werden nachvollziehbar dokumentiert und angemessen geprüft.\n7.Die Organisation berichtet offen und umfassend über ihre Arbeit, Strukturen und Finanzen.\nTräger des DZI Spenden-Siegels seit 24.10.2002\nKontakt\nWebsite\nwww.bangladesch.org\nE-Mail\ninfo@bangladesch.org\nTelefon\n06441-974630\nFax\n06441-9746329\nAnschrift\nMoritz-Hensoldt-Straße 20\n35576 Wetzlar\nSpendenkonten\nIBAN: DE82513900000000006262\nBIC: VBMHDE5F\nVolksbank Mittelhessen\nAllgemeine Informationen\nGründungsjahr\n1989\nSitz der Organisation\nWetzlar\nRechtsform\nVerein\nWeltanschauliche Ausrichtung\nunabhängig\nOrganisation\nLeitungsorgan\nVorstand\nGeschäftsführung\nDr. Max Stille, Niko Richter\nMitglieder/Gesellschafter\n274 stimmberechtigte Mitglieder\nAnzahl Mitarbeiter Hilfetext\nhauptamtlich: 45"
  },
  {
    "title": "OBDACH e.V. Wohnung+Betreuung+Beschäftigung für alleinstehende Menschen",
    "url": "https://www.dzi.de/organisation/obdach-e-v-wohnungbetreuungbeschaeftigung-fuer-alleinstehende-menschen/",
    "weltanschaulicheAusrichtung": "unabhängig",
    "finanzen": {
      "bezugsjahr": 2018,
      "gesamtEinnahmen": "938.806,76 EUR",
      "anteilKosten": "angemessen"
    },
    "volltext": "Arbeitsschwerpunkte\nBildungs- und Kampagnenarbeit, Einzelfallhilfe, Gesundheitshilfe\nLänderschwerpunkte\nDeutschland\nTätigkeitsfelder\nOBDACH e.V. kümmert sich um alleinstehende wohnungslose Menschen überwiegend im Stadtgebiet von Heidelberg und versucht, diese durch Hilfe zur Selbsthilfe an ein normales Leben heranzuführen. Durch persönliche Zuwendung soll die soziale Ausgrenzung überwunden werden, die Arbeitslosigkeit und Alkoholmissbrauch, Krankheit und Verwahrlosung verursacht haben. Zu diesem Zweck mietet OBDACH e.V. dezentral Wohnraum an und schließt mit den betreuten Personen Untermietverträge ab. Der Verein besitzt darüber hinaus mehrere Eigentumswohnungen. In Wohngemeinschaften finden die ehemals Wohnungslosen ein geschütztes Zuhause und Geborgenheit. Der betreute Personenkreis wird durch vom Verein angestellte Sozialarbeiterinnen und Sozialarbeiter sowie ehrenamtlich Tätige umfassend unterstützt, beispielsweise durch persönliche Gespräche oder die Begleitung bei Behörden- und Arztbesuchen sowie bei der Schuldenregulierung und Beschäftigungssuche. Des Weiteren bietet der Verein den ehemals Wohnungslosen sinnvolle Beschäftigungsmöglichkeiten etwa in Form von Heimwerkerarbeiten, Freizeitbeschäftigung oder Nachbarschaftshilfe an.\nFinanzen\nBezugsjahr:\n2018\nGesamteinnahmen:\n938.806,76 EUR\nDavon Sammlungseinnahmen Hilfetext:\n165.854,59 EUR\nAnteil Werbe- und Verwaltungskosten Hilfetext:\nangemessen\nEinschätzung durch das DZI Hilfetext\nOBDACH e.V. Wohnung + Betreuung + Beschäftigung für alleinstehende Menschen, Heidelberg, wurde das DZI Spenden-Siegel zuerkannt. Der Verein ist förderungswürdig.\nDie sieben Spenden-Siegel-Standards erfüllt der Verein wie folgt:\n1.Die Organisation leistet satzungsgemäße Arbeit.\n2.Leitung und Aufsicht sind angemessen strukturiert, klar voneinander getrennt und werden wirksam wahrgenommen.\n3.Werbung und Öffentlichkeitsarbeit informieren klar, wahr, sachlich und offen.\n4.Der Anteil der Werbe- und Verwaltungsausgaben an den Gesamtausgaben ist nach DZI-Maßstab angemessen („angemessen“ = 10% bis unter 20%). Die Wirksamkeit des Mitteleinsatzes wird überprüft, und die Ergebnisse werden dokumentiert und veröffentlicht.\n5.Die von der Organisation gezahlten Vergütungen berücksichtigen den Status der Gemeinnützigkeit, die Qualifikation, das Maß an Verantwortung und den branchenüblichen Rahmen.\n6.Mittelbeschaffung und -verwendung sowie die Vermögenslage werden nachvollziehbar dokumentiert und geprüft.\n7.Die Organisation berichtet offen und umfassend über ihre Arbeit, Strukturen und Finanzen.\nTräger des DZI Spenden-Siegels seit 15.02.1995\nKontakt\nWebsite\nwww.obdach-hd.de\nE-Mail\nverein@obdach-hd.de\nTelefon\n06221-1875520\nFax\n06221-187559920\nAnschrift\nBahnhofstaße 3\n69115 Heidelberg\nSpendenkonten\nIBAN: DE73672500200001017195\nBIC: SOLADES1HDB\nSparkasse Heidelberg\nAllgemeine Informationen\nGründungsjahr\n1987\nSitz der Organisation\nHeidelberg\nRechtsform\nVerein\nWeltanschauliche Ausrichtung\nunabhängig\nOrganisation\nLeitungsorgan\nVorstand\nGeschäftsführung\nSilke Ssymank\nMitglieder/Gesellschafter\n123 stimmberechtigte Mitglieder\nAnzahl Mitarbeiter Hilfetext\nhauptamtlich: 14 ehrenamtlich: 15"
  },
  {
    "title": "Opportunity International Deutschland (OID)",
    "url": "https://www.dzi.de/organisation/opportunity-international-deutschland-oid/",
    "weltanschaulicheAusrichtung": "christlich",
    "finanzen": {
      "bezugsjahr": 2018,
      "gesamtEinnahmen": "2.245.462,30 EUR",
      "anteilKosten": "vertretbar"
    },
    "volltext": "Arbeitsschwerpunkte\nBildung, Bildungs- und Kampagnenarbeit, Corona-Hilfe, Entwicklungszusammenarbeit, Frauenförderung\nLänderschwerpunkte\nGhana, Haiti, Indien, Indonesien, Philippinen, Uganda\nTätigkeitsfelder\nDer Arbeitsschwerpunkt von OID liegt in der Armutsbekämpfung in Entwicklungsländern, und zwar insbesondere durch die Vergabe von Kleinkrediten an mittellose Menschen. Konkret zielen die Projektmaßnahmen darauf ab, die unmittelbare Lebenssituation zu verbessern und die wirtschaftliche Kraft (Einkommensschaffung) der Armen zu fördern, indem Menschen, die nach konventionellen Kriterien keinerlei Chancen für den Erhalt eines Kredites hätten, Zugang zu finanziellen Mitteln erhalten. Das bedeutet, ein Kreditsystem ohne Garantien wie Grundbesitz oder berufliche Bildung zu schaffen und stattdessen die Eigeninitiative dieser Menschen zu fördern. Die Kleinkredite und begleitenden Trainings werden dabei speziell auf die Bedürfnisse der Kreditnehmerinnen und -nehmer abgestimmt, bei denen es sich überwiegend um Frauen handelt.\nFinanzen\nBezugsjahr:\n2018\nGesamteinnahmen:\n2.245.462,30 EUR\nDavon Sammlungseinnahmen Hilfetext:\n1.361.172,09 EUR\nAnteil Werbe- und Verwaltungskosten Hilfetext:\nvertretbar\nEinschätzung durch das DZI Hilfetext\nOpportunity International Deutschland (OID), Schorndorf, wurde das DZI Spenden-Siegel zuerkannt. Die Stiftung ist förderungswürdig.\nDie sieben Spenden-Siegel-Standards erfüllt die Stiftung wie folgt:\n1.Die Organisation leistet satzungsgemäße Arbeit.\n2.Leitung und Aufsicht sind angemessen strukturiert, klar voneinander getrennt und werden wirksam wahrgenommen.\n3.Werbung und Öffentlichkeitsarbeit informieren klar, wahr, sachlich und offen.\n4.Der Anteil der Werbe- und Verwaltungsausgaben an den Gesamtausgaben ist nach DZI-Maßstab vertretbar („vertretbar“ = 20% bis 30%). Die Wirksamkeit des Mitteleinsatzes wird überprüft, und die Ergebnisse werden dokumentiert und veröffentlicht.\n5.Die von der Organisation gezahlten Vergütungen berücksichtigen den Status der Gemeinnützigkeit, die Qualifikation, das Maß an Verantwortung und den branchenüblichen Rahmen.\n6.Mittelbeschaffung und -verwendung sowie die Vermögenslage werden nachvollziehbar dokumentiert und geprüft.\n7.Die Organisation berichtet offen und umfassend über ihre Arbeit, Strukturen und Finanzen.\nTräger des DZI Spenden-Siegels seit 19.12.2006\nKontakt\nWebsite\nwww.oid.org\nE-Mail\ninfo@oid.org\nTelefon\n0221-25081630\nFax\n0221-25081639\nAnschrift\nBremsstraße 6\n50969 Köln\nSpendenkonten\nIBAN: DE15370205000001275800\nBIC: BFSWDE33XXX\nBank für Sozialwirtschaft\nAllgemeine Informationen\nGründungsjahr\n1996\nSitz der Organisation\nSchorndorf\nRechtsform\nStiftung\nWeltanschauliche Ausrichtung\nchristlich\nOrganisation\nLeitungsorgan\nStiftungsvorstand\nAnzahl Mitarbeiter Hilfetext\nhauptamtlich: 10 ehrenamtlich: 35"
  },
  {
    "title": "Patengemeinschaft für hungernde Kinder e.V.",
    "url": "https://www.dzi.de/organisation/patengemeinschaft-fuer-hungernde-kinder-e-v/",
    "weltanschaulicheAusrichtung": "unabhängig",
    "finanzen": {
      "bezugsjahr": 2018,
      "gesamtEinnahmen": "594.642,96 EUR",
      "anteilKosten": "niedrig"
    },
    "volltext": "Arbeitsschwerpunkte\nBehindertenhilfe, Bildung, Einzelfallhilfe, Entwicklungszusammenarbeit, Familienfürsorge, Frauenförderung, Gesundheitshilfe, Kinder- und Jugendhilfe, Kinderpatenschaft\nLänderschwerpunkte\nIndien\nTätigkeitsfelder\nDie Patengemeinschaft für hungernde Kinder e.V. unterstützt Kinder und Jugendliche in mehr als 30 Kinderheimen und Ausbildungseinrichtungen in Südindien mit dem Ziel, ihnen eine Schul- und gegebenenfalls Berufsausbildung zu ermöglichen. Zu diesem Zweck bestehen vor Ort zwei Vereine indischen Rechts. Im Rahmen von Familienhilfen hilft die Organisation beim Bau von Häusern, sanitären Einrichtungen sowie mit Einrichtungsgegenständen, Bekleidung oder auch der Verteilung von Kühen und Ziegen. Außerdem engagiert sich der Verein in der Gesundheitshilfe und der Krankenpflege durch den Unterhalt einer Orthopädieklinik mit Rehabilitationszentrum und orthopädischer Werkstatt. Weitere Aktivitäten umfassen den Betrieb von Frauenausbildungszentren und Kindertagesstätten, die Unterstützung von Existenzgründungen, Hilfen für Behinderte und Taubstumme sowie bauliche Maßnahmen wie Brunnenbohrungen oder Zuschüsse zu Häuserrenovierungen. Eine Zielgruppe ist dabei die gesellschaftlich benachteiligte Bevölkerungsgruppe der Adivasi.\nFinanzen\nBezugsjahr:\n2018\nGesamteinnahmen:\n594.642,96 EUR\nDavon Sammlungseinnahmen Hilfetext:\n590.993,55 EUR\nAnteil Werbe- und Verwaltungskosten Hilfetext:\nniedrig\nEinschätzung durch das DZI Hilfetext\nDer Patengemeinschaft für hungernde Kinder e.V., Sahms, wurde das DZI Spenden-Siegel zuerkannt. Der Verein ist förderungswürdig.\nDie sieben Spenden-Siegel-Standards erfüllt der Verein wie folgt:\n1.Die Organisation leistet satzungsgemäße Arbeit.\n2.Leitung und Aufsicht sind angemessen strukturiert, klar voneinander getrennt und werden wirksam wahrgenommen.\n3.Werbung und Öffentlichkeitsarbeit informieren klar, wahr, sachlich und offen.\n4.Der Anteil der Werbe- und Verwaltungsausgaben an den Gesamtausgaben ist nach DZI-Maßstab niedrig („niedrig“ = unter 10%). Die Wirksamkeit des Mitteleinsatzes wird überprüft, und die Ergebnisse werden dokumentiert und veröffentlicht.\n5.Vergütungen (trifft nicht zu).\n6.Mittelbeschaffung und -verwendung sowie die Vermögenslage werden nachvollziehbar dokumentiert und angemessen geprüft.\n7.Die Organisation berichtet offen und umfassend über ihre Arbeit, Strukturen und Finanzen.\nTräger des DZI Spenden-Siegels seit 26.05.1995\nKontakt\nWebsite\nwww.patengemeinschaft.de\nE-Mail\ninfo@patengemeinschaft.de\nTelefon\n040-86624884\nAnschrift\nLigusterweg 21c\n22609 Hamburg\nSpendenkonten\nIBAN: DE66120300001001188810\nBIC: BYLADEM1001\nDeutsche Kreditbank\nAllgemeine Informationen\nGründungsjahr\n1969\nSitz der Organisation\nSahms\nRechtsform\nVerein\nWeltanschauliche Ausrichtung\nunabhängig\nOrganisation\nLeitungsorgan\nVorstand\nMitglieder/Gesellschafter\n69 stimmberechtigte Mitglieder\nAnzahl Mitarbeiter Hilfetext\nehrenamtlich: 15"
  },
  {
    "title": "PERSPEKTIVEN Gemeinschaft zur Unterstützung von Projekten für sozial Benachteiligte in Osteuropa e.V.",
    "url": "https://www.dzi.de/organisation/perspektiven-gemeinschaft-zur-unterstuetzung-von-projekten-fuer-sozial-benachteiligte-in-osteuropa-e-v/",
    "weltanschaulicheAusrichtung": "unabhängig",
    "finanzen": {
      "bezugsjahr": 2018,
      "gesamtEinnahmen": "673.591,10 EUR",
      "anteilKosten": "niedrig"
    },
    "volltext": "Arbeitsschwerpunkte\nBehindertenhilfe, Bildung, Einzelfallhilfe, Familienfürsorge, Gesundheitshilfe, Kinder- und Jugendhilfe, Menschenrechte\nLänderschwerpunkte\nRussische Föderation\nTätigkeitsfelder\nPerspektiven e.V. unterstützt im Raum Sankt Petersburg, Russland, angesiedelte Projekte für behinderte Kinder und Erwachsene sowie für Kinder und Jugendliche aus sozialen Risikogruppen und leistet auf diese Weise Hilfe zur Selbsthilfe. Im Bereich der Behindertenarbeit konzentriert sich die Organisation auf zwei staatliche Heime mit dem Ziel, die Lebensbedingungen der Bewohner durch ergänzende Betreuungsangebote zu verbessern. Zudem werden auch Familien mit behinderten Kindern bei deren Betreuung unterstützt und beraten. Neben der direkten Betreuung und Unterstützung leistet der Verein auch Rechtsberatung für Menschen mit Behinderungen und setzt sich im Rahmen politischer Arbeit für eine Stärkung von deren Rechten in Russland ein. Projektträger der Aktivitäten in Russland ist der in St. Petersburg ansässige Verein Perspektivy. Der russische Partnerverein ist für die Durchführung der Projektarbeit gemäß beschlossener Projekt- und Budgetanträge, für die Planung, Begleitung, Kontrolle und Evaluation der vom deutschen Verein finanzierten Aktivitäten verantwortlich. Perspektiven e.V. bietet zudem Praktikumsplätze in den Projekten für interessierte Menschen aller Altersstufen an.\nFinanzen\nBezugsjahr:\n2018\nGesamteinnahmen:\n673.591,10 EUR\nDavon Sammlungseinnahmen Hilfetext:\n337.016,55 EUR\nAnteil Werbe- und Verwaltungskosten Hilfetext:\nniedrig\nEinschätzung durch das DZI Hilfetext\nPERSPEKTIVEN Gemeinschaft zur Unterstützung von Projekten für sozial Benachteiligte in Osteuropa e.V., Nieheim, wurde das DZI Spenden-Siegel zuerkannt. Der Verein ist förderungswürdig.\nDie sieben Spenden-Siegel-Standards erfüllt der Verein wie folgt:\n1.Die Organisation leistet satzungsgemäße Arbeit.\n2.Leitung und Aufsicht sind angemessen strukturiert, klar voneinander getrennt und werden wirksam wahrgenommen.\n3.Werbung und Öffentlichkeitsarbeit informieren klar, wahr, sachlich und offen.\n4.Der Anteil der Werbe- und Verwaltungsausgaben an den Gesamtausgaben ist nach DZI-Maßstab niedrig („niedrig“ = unter 10%). Die Wirksamkeit des Mitteleinsatzes wird überprüft, und die Ergebnisse werden dokumentiert und veröffentlicht.\n5.Die von der Organisation gezahlten Vergütungen berücksichtigen den Status der Gemeinnützigkeit, die Qualifikation, das Maß an Verantwortung und den branchenüblichen Rahmen.\n6.Mittelbeschaffung und -verwendung sowie die Vermögenslage werden nachvollziehbar dokumentiert und angemessen geprüft.\n7.Die Organisation berichtet offen und umfassend über ihre Arbeit, Strukturen und Finanzen.\nTräger des DZI Spenden-Siegels seit 16.12.2009\nKontakt\nWebsite\nwww.perspektiven-verein.de\nE-Mail\nkontakt@perspektiven-verein.de\nTelefon\n039037-956087\nAnschrift\nc/o Thomas Seifert, Klein Gartz 10\n29410 Salzwedel\nSpendenkonten\nIBAN: DE94370205000007155100\nBIC: BFSWDE33XXX\nBank für Sozialwirtschaft\nAllgemeine Informationen\nGründungsjahr\n1992\nSitz der Organisation\nNieheim\nRechtsform\nVerein\nWeltanschauliche Ausrichtung\nunabhängig\nOrganisation\nLeitungsorgan\nVorstand\nGeschäftsführung\nThomas Seifert\nMitglieder/Gesellschafter\n39 stimmberechtigte Mitglieder\nAnzahl Mitarbeiter Hilfetext\nhauptamtlich: 1 ehrenamtlich: 10"
  },
  {
    "title": "Rambazotti – internationaler Kinder- und Jugendcircus e.V.",
    "url": "https://www.dzi.de/organisation/rambazotti-internationaler-kinder-und-jugendcircus-e-v/",
    "weltanschaulicheAusrichtung": "unabhängig",
    "finanzen": {
      "bezugsjahr": 2017,
      "gesamtEinnahmen": "349.274,68 EUR",
      "anteilKosten": "angemessen"
    },
    "volltext": "Arbeitsschwerpunkte\nBehindertenhilfe, Bildung, Gesundheitshilfe, Kinder- und Jugendhilfe, Sport, Straffälligenhilfe, Völkerverständigung\nLänderschwerpunkte\nDeutschland\nTätigkeitsfelder\nDer Verein betreibt den Circus „Rambazotti“, in dem Kinder und Jugendliche auftreten. Teil dieses pädagogischen Gesamtprojekts, das überwiegend als Zweckbetrieb geführt wird, sind wöchentliche Trainingsstunden, Wochenend-Workshops und Tourneen im In- und Ausland, in denen die Kinder und Jugendlichen Selbstständigkeit und Verantwortung sowie einen konstruktiven, vielseitigen und positiven Umgang mit sich und ihrer Umwelt erlernen sollen. Darüber hinaus unterhält der Verein ein „Circus-(Pädagogik-)Haus“, einen eigenen „Circuswagen“, betreibt einen „Circusladen“, der die entsprechenden Utensilien anbietet, sowie ein Café. Für Kinder mit physischen oder psychischen Defiziten oder Behinderungen hält die Organisation besondere therapeutische Angebote bereit.\nFinanzen\nBezugsjahr:\n2017\nGesamteinnahmen:\n349.274,68 EUR\nDavon Sammlungseinnahmen Hilfetext:\n187.633,43 EUR\nAnteil Werbe- und Verwaltungskosten Hilfetext:\nangemessen\nEinschätzung durch das DZI Hilfetext\nRambazotti – internationaler Kinder- und Jugendcircus e.V., Kassel, wurde das DZI Spenden-Siegel zuerkannt. Der Verein ist förderungswürdig.\nDie sieben Spenden-Siegel-Standards erfüllt der Verein wie folgt:\n1.Die Organisation leistet satzungsgemäße Arbeit.\n2.Leitung und Aufsicht sind angemessen strukturiert, klar voneinander getrennt und werden wirksam wahrgenommen.\n3.Werbung und Öffentlichkeitsarbeit informieren klar, wahr, sachlich und offen.\n4.Der Anteil der Werbe- und Verwaltungsausgaben an den Gesamtausgaben ist nach DZI-Maßstab angemessen („angemessen“ = 10% bis unter 20%). Die Wirksamkeit des Mitteleinsatzes wird überprüft, und die Ergebnisse werden dokumentiert und veröffentlicht.\n5.Die von der Organisation gezahlten Vergütungen berücksichtigen den Status der Gemeinnützigkeit, die Qualifikation, das Maß an Verantwortung und den branchenüblichen Rahmen.\n6.Mittelbeschaffung und -verwendung sowie die Vermögenslage werden nachvollziehbar dokumentiert und angemessen geprüft.\n7.Die Organisation berichtet offen und umfassend über ihre Arbeit, Strukturen und Finanzen.\nTräger des DZI Spenden-Siegels seit 07.10.2010\nKontakt\nWebsite\nwww.rambazotti.de\nE-Mail\ninfo@rambazotti.de\nTelefon\n0561-44440\nFax\n0561-31690040\nAnschrift\nLudwig-Erhard-Straße 21\n34131 Kassel\nSpendenkonten\nIBAN: DE86520503530001234561\nBIC: HELADEF1KAS\nKasseler Sparkasse\nAllgemeine Informationen\nGründungsjahr\n1995\nSitz der Organisation\nKassel\nRechtsform\nVerein\nWeltanschauliche Ausrichtung\nunabhängig\nOrganisation\nLeitungsorgan\nVorstand\nGeschäftsführung\nIris Riedmüller\nMitglieder/Gesellschafter\n36 stimmberechtigte Mitglieder\nAnzahl Mitarbeiter Hilfetext\nhauptamtlich: 5 ehrenamtlich: 38"
  },
  {
    "title": "Reiner Meutsch Stiftung – fly and help",
    "url": "https://www.dzi.de/organisation/reiner-meutsch-stiftung-fly-and-help/",
    "weltanschaulicheAusrichtung": "unabhängig",
    "finanzen": {
      "bezugsjahr": 2019,
      "gesamtEinnahmen": "5.344.732,32 EUR",
      "anteilKosten": "niedrig"
    },
    "volltext": "Arbeitsschwerpunkte\nBildung, Entwicklungszusammenarbeit, Kinder- und Jugendhilfe\nLänderschwerpunkte\nArgentinien, Äthiopien, Bolivien, Botsuana, Brasilien, Burkina Faso, Burundi, Demokratische Republik Kongo, Dominikanische Republik, Ghana, Guatemala, Haiti, Indien, Indonesien, Kambodscha, Kenia, Kuba, Laos, Liberia, Madagaskar, Malawi, Mali, Myanmar, Namibia, Nepal, Nicaragua, Nigeria, Peru, Philippinen, Ruanda, Salomonen, Sambia, Senegal, Sierra Leone, Sri Lanka, Südafrika, Sudan, Südsudan, Tansania, Togo, Tschad, Türkei, Uganda, Vietnam\n… mehr\nTätigkeitsfelder\nDie Reiner Meutsch Stiftung – fly and help engagiert sich in der Entwicklungszusammenarbeit. Sie unterstützt in verschiedenen Ländern vor allem Projekte, die sich für die schulische Ausbildung von Kindern und Jugendlichen einsetzen. Die Fördergelder werden insbesondere für Bauinvestitionen und die Ausstattung von Schulen verwendet, beispielsweise für den Bau neuer Klassenräume, die Verbesserung der hygienischen Situation sowie die Finanzierung von Lehrern und Lehrmaterialien.\nFinanzen\nBezugsjahr:\n2019\nGesamteinnahmen:\n5.344.732,32 EUR\nDavon Sammlungseinnahmen Hilfetext:\n4.755.026,47 EUR\nAnteil Werbe- und Verwaltungskosten Hilfetext:\nniedrig\nEinschätzung durch das DZI Hilfetext\nDer Reiner Meutsch Stiftung – fly and help, Kroppach, wurde das DZI Spenden-Siegel zuerkannt. Die Stiftung ist förderungswürdig.\nDie sieben Spenden-Siegel-Standards erfüllt die Stiftung wie folgt:\n1.Die Organisation leistet satzungsgemäße Arbeit.\n2.Leitung und Aufsicht sind angemessen strukturiert, klar voneinander getrennt und werden wirksam wahrgenommen.\n3.Werbung und Öffentlichkeitsarbeit informieren klar, wahr, sachlich und offen.\n4.Der Anteil der Werbe- und Verwaltungsausgaben an den Gesamtausgaben ist nach DZI-Maßstab niedrig („niedrig“ = unter 10%). Die Wirksamkeit des Mitteleinsatzes wird überprüft, und die Ergebnisse werden dokumentiert und veröffentlicht.\n5.Vergütungen (trifft nicht zu).\n6.Mittelbeschaffung und -verwendung sowie die Vermögenslage werden nachvollziehbar dokumentiert und angemessen geprüft.\n7.Die Organisation berichtet offen und umfassend über ihre Arbeit, Strukturen und Finanzen.\nTräger des DZI Spenden-Siegels seit 15.07.2014\nKontakt\nWebsite\nwww.fly-and-help.de\nE-Mail\ninfo@fly-and-help.de\nTelefon\n02688-989011\nFax\n02688-989013\nAnschrift\nLangstraße 10\n57612 Kroppach\nSpendenkonten\nIBAN: DE94573918000000005550\nBIC: GENODE51WW1\nWesterwald Bank\nAllgemeine Informationen\nGründungsjahr\n2009\nSitz der Organisation\nKroppach\nRechtsform\nStiftung\nWeltanschauliche Ausrichtung\nunabhängig\nOrganisation\nLeitungsorgan\nVorstand\nGeschäftsführung\nJürgen Schumacher\nAnzahl Mitarbeiter Hilfetext\nehrenamtlich: 13"
  },
  {
    "title": "Samaritan´s Purse e.V.",
    "url": "https://www.dzi.de/organisation/samaritans-purse-e-v/",
    "weltanschaulicheAusrichtung": "christlich",
    "finanzen": {
      "bezugsjahr": 2019,
      "gesamtEinnahmen": "23.522.526,85 EUR",
      "anteilKosten": "angemessen"
    },
    "volltext": "Arbeitsschwerpunkte\nCorona-Hilfe, Entwicklungszusammenarbeit, Flüchtlingsfürsorge, Gesundheitshilfe, Katastrophenhilfe, Kinder- und Jugendhilfe, Religion\nLänderschwerpunkte\nBahamas, Bangladesch, Georgien, Indien, Indonesien, Irak, Kambodscha, Kongo, Lettland, Litauen, Montenegro, Mosambik, Myanmar, Nordmazedonien, Philippinen, Polen, Republik Moldau, Rumänien, Serbien, Slowakei, Thailand, Uganda, Ukraine\n… mehr\nTätigkeitsfelder\nSamaritan’s Purse e.V. (ehemals Geschenke der Hoffnung e.V.) ist ein christliches Hilfswerk und Zweig der amerikanischen Organisation „Samaritan´s Purse“. Der Verein hat seine Wurzeln in der im Jahre 1950 in den USA errichteten Organisation „Billy Graham Evangelistic Association“, die nach ihrem Gründer, dem amerikanischen Evangelisten und Baptistenpastor Billy Graham, benannt ist. Ziel der amerikanischen Organisation ist die Verbreitung der christlichen Botschaft insbesondere mittels Evangelisationskampagnen. Die Schwerpunkte der deutschen Vereinsarbeit liegen neben der Weitergabe des Evangeliums in der humanitären Hilfe sowie der Unterstützung von bedürftigen Kindern und Familien im Rahmen der Entwicklungszusammenarbeit. Einen besonderen Arbeitsschwerpunkt des Vereins bildet die Aktion „Weihnachten im Schuhkarton®“. Mit dieser Maßnahme werden Spender sowohl um Sach- als auch um Geldspenden gebeten. Der Verein wirbt darum, Schuhkartons mit Geschenken wie Spielzeug, Kleidung, Schulmaterialien sowie Hygieneartikeln zu packen. Die gesammelten Pakete werden über christliche Gemeinden an bedürftige Kinder, vor allem in Osteuropa, verteilt. Bei der Verteilung wird von den Gemeinden dort, wo es erlaubt und erwünscht ist, zusätzlich ein Heft mit biblischen Geschichten angeboten, die den Grund für das Weihnachtsfest erläutern. Die Auswahl der bedürftigen Kinder erfolgt häufig in Kooperation mit örtlichen Sozialämtern. „Weihnachten im Schuhkarton“ ist Teil der weltweiten Aktion „Operation Christmas Child“, die von „Samaritan´s Purse“(USA) getragen wird. Darüber hinaus unterstützt der deutsche Verein weitere, unter anderem von Samaritan´s Purse (USA) geförderte Entwicklungsprojekte, wie beispielsweise Maßnahmen der medizinischen Versorgung, der Existenzsicherung, der Flüchtlingsfürsorge, der Katastrophenhilfe oder der Versorgung mit sauberem Wasser.\nFinanzen\nBezugsjahr:\n2019\nGesamteinnahmen:\n23.522.526,85 EUR\nDavon Sammlungseinnahmen Hilfetext:\n22.614.916,55 EUR\nAnteil Werbe- und Verwaltungskosten Hilfetext:\nangemessen\nEinschätzung durch das DZI Hilfetext\nSamaritan´s Purse e.V., Berlin, wurde das DZI Spenden-Siegel zuerkannt. Der Verein ist förderungswürdig.\nDie sieben Spenden-Siegel-Standards erfüllt der Verein wie folgt:\n1.Die Organisation leistet satzungsgemäße Arbeit.\n2.Leitung und Aufsicht sind angemessen strukturiert, klar voneinander getrennt und werden wirksam wahrgenommen.\n3.Werbung und Öffentlichkeitsarbeit informieren klar, wahr, sachlich und offen.\n4.Der Anteil der Werbe- und Verwaltungsausgaben an den Gesamtausgaben ist nach DZI-Maßstab angemessen („angemessen“ = 10% bis unter 20%). Die Wirksamkeit des Mitteleinsatzes wird überprüft, und die Ergebnisse werden dokumentiert und veröffentlicht.\n5.Die von der Organisation gezahlten Vergütungen berücksichtigen den Status der Gemeinnützigkeit, die Qualifikation, das Maß an Verantwortung und den branchenüblichen Rahmen.\n6.Mittelbeschaffung und -verwendung sowie die Vermögenslage werden nachvollziehbar dokumentiert und angemessen geprüft.\n7.Die Organisation berichtet offen und umfassend über ihre Arbeit, Strukturen und Finanzen.\nTräger des DZI Spenden-Siegels seit 23.05.2003\nKontakt\nWebsite\nwww.die-samariter.org\nE-Mail\ninfo@die-samariter.org\nTelefon\n030-76883300\nFax\n030-76883333\nAnschrift\nHaynauer Straße 72a\n12249 Berlin\nSpendenkonten\nIBAN: DE12370601935544332211\nBIC: GENODED1PAX\nPax-Bank\nAllgemeine Informationen\nGründungsjahr\n1963\nSitz der Organisation\nBerlin\nRechtsform\nVerein\nWeltanschauliche Ausrichtung\nchristlich\nOrganisation\nLeitungsorgan\nVorstand\nMitglieder/Gesellschafter\n11 stimmberechtigte Mitglieder\nAnzahl Mitarbeiter Hilfetext\nhauptamtlich: 69 ehrenamtlich: 10400"
  },
  {
    "title": "Save the Children Deutschland e.V.",
    "url": "https://www.dzi.de/organisation/save-the-children-deutschland-e-v/",
    "weltanschaulicheAusrichtung": "unabhängig",
    "finanzen": {
      "bezugsjahr": 2019,
      "gesamtEinnahmen": "43.806.312,58 EUR",
      "anteilKosten": "angemessen"
    },
    "volltext": "Arbeitsschwerpunkte\nBildung, Corona-Hilfe, Entwicklungszusammenarbeit, Gesundheitshilfe, Katastrophenhilfe, Kinder- und Jugendhilfe, Menschenrechte\nLänderschwerpunkte\nAfghanistan, Ägypten, Äthiopien, Bangladesch, Demokratische Republik Kongo, Deutschland, Guatemala, Indien, Indonesien, Irak, Jemen, Jordanien, Kenia, Libanon, Mosambik, Myanmar, Palästinensische Gebiete, Somalia, Südsudan, Syrien, Tansania, Türkei, Uganda\n… mehr\nTätigkeitsfelder\nSave the Children Deutschland e.V. ist der deutsche Zweig des 1919 in England gegründeten Kinderhilfswerks Save the Children, das sich weltweit insbesondere für das Wohlergehen und die Rechte von Kindern einsetzt. Insgesamt 30 nationale Mitgliedsorganisationen sind in dem Netzwerk „Save the Children International“ mit Sitz in London zusammengeschlossen. Mit eigenen Programmen und Projekten für bessere Lebensbedingungen von Kindern und Familien ist die Gesamtorganisation in rund 120 Ländern der Welt tätig. In Kriegsfällen und bei Naturkatastrophen leistet das Netzwerk Not- und Wiederaufbauhilfe. Zu den langfristig angelegten Arbeitsschwerpunkten von Save the Children Deutschland e.V. gehören insbesondere Themen wie Gesundheit, Bildung und Schutz für die am stärksten benachteiligten Kinder der Welt.\nFinanzen\nBezugsjahr:\n2019\nGesamteinnahmen:\n43.806.312,58 EUR\nDavon Sammlungseinnahmen Hilfetext:\n20.804.872,21 EUR\nAnteil Werbe- und Verwaltungskosten Hilfetext:\nangemessen\nEinschätzung durch das DZI Hilfetext\nSave the Children Deutschland e.V., Berlin, wurde das Spenden-Siegel zuerkannt. Der Verein ist förderungswürdig.\nDie sieben Spenden-Siegel-Standards erfüllt der Verein wie folgt:\n1.Die Organisation leistet satzungsgemäße Arbeit.\n2.Leitung und Aufsicht sind angemessen strukturiert, klar voneinander getrennt und werden wirksam wahrgenommen.\n3.Werbung und Öffentlichkeitsarbeit informieren klar, wahr, sachlich und offen.\n4.Der Anteil der Werbe- und Verwaltungsausgaben an den Gesamtausgaben ist nach DZI-Maßstab angemessen („angemessen“ = 10% bis unter 20%). Die Wirksamkeit des Mitteleinsatzes wird überprüft, und die Ergebnisse werden dokumentiert und veröffentlicht.\n5.Die von der Organisation gezahlten Vergütungen berücksichtigen den Status der Gemeinnützigkeit, die Qualifikation, das Maß an Verantwortung und den branchenüblichen Rahmen.\n6.Mittelbeschaffung und -verwendung sowie die Vermögenslage werden nachvollziehbar dokumentiert und angemessen geprüft.\n7.Die Organisation berichtet offen und umfassend über ihre Arbeit, Strukturen und Finanzen.\nTräger des DZI Spenden-Siegels seit 28.09.2011\nKontakt\nWebsite\nwww.savethechildren.de\nE-Mail\ninfo@savethechildren.de\nTelefon\n030-275959790\nFax\n030-275959799\nAnschrift\nSeesener Straße 10-13\n10709 Berlin\nSpendenkonten\nIBAN: DE92100205000003292912\nBIC: BFSWDE33BER\nBank für Sozialwirtschaft\nAllgemeine Informationen\nGründungsjahr\n2004\nSitz der Organisation\nBerlin\nRechtsform\nVerein\nWeltanschauliche Ausrichtung\nunabhängig\nOrganisation\nLeitungsorgan\nVorstand\nGeschäftsführung\nSusanna Krüger\nMitglieder/Gesellschafter\n36 stimmberechtigte Mitglieder\nAnzahl Mitarbeiter Hilfetext\nhauptamtlich: 144 ehrenamtlich: 36"
  },
  {
    "title": "Tabitha Global Care Germany e.V.",
    "url": "https://www.dzi.de/organisation/tabitha-global-care-germany-e-v/",
    "weltanschaulicheAusrichtung": "christlich",
    "finanzen": {
      "bezugsjahr": 2018,
      "gesamtEinnahmen": "286.446,80 EUR",
      "anteilKosten": "niedrig"
    },
    "volltext": "Arbeitsschwerpunkte\nAids, Behindertenhilfe, Bildung, Einzelfallhilfe, Entwicklungszusammenarbeit, Familienfürsorge, Flüchtlingsfürsorge, Frauenförderung, Gesundheitshilfe, Kinder- und Jugendhilfe, Kinderpatenschaft, Religion\nLänderschwerpunkte\nDemokratische Republik Kongo, Sambia, Uganda\nTätigkeitsfelder\nIm Mittelpunkt der Arbeit von Tabitha Global Care Germany e.V. steht die Unterstützung von Kindern, Familien und ihrem Umfeld im Kampf gegen Armut. Dazu betreibt der Verein Projekte in verschiedenen Bereichen wie Bildung, Trinkwasserversorgung, Gesundheit und Hygiene sowie Landwirtschaft und Nutztierhaltung. Die räumlichen Schwerpunkte liegen dabei in Uganda und Sambia. Hauptprojekt des Vereins ist das Tabitha Village in Kawolokota, Uganda. Hier hat die Organisation für sehr bedürftige Familien kleine Häuser und eine Schule errichtet, in der 120 Kinder unterrichtet werden können. In einem Community Center finden Seminare, Hygieneschulungen, Mikrofinanz-Trainings, Lebensberatungen und Gottesdienste statt. Ein weiterer Schwerpunkt liegt im Bau von Trinkwasserbrunnen. Ein Teil der Projektarbeit wird durch Patenschaften ermöglicht.\nFinanzen\nBezugsjahr:\n2018\nGesamteinnahmen:\n286.446,80 EUR\nDavon Sammlungseinnahmen Hilfetext:\n262.852,67 EUR\nAnteil Werbe- und Verwaltungskosten Hilfetext:\nniedrig\nEinschätzung durch das DZI Hilfetext\nTabitha Global Care Germany e.V., Fritzlar, wurde das DZI Spenden-Siegel zuerkannt. Der Verein ist förderungswürdig.\nDie sieben Spenden-Siegel-Standards erfüllt der Verein wie folgt:\n1.Die Organisation leistet satzungsgemäße Arbeit.\n2.Leitung und Aufsicht sind angemessen strukturiert, klar voneinander getrennt und werden wirksam wahrgenommen.\n3.Werbung und Öffentlichkeitsarbeit informieren klar, wahr, überwiegend sachlich und offen.\n4.Der Anteil der Werbe- und Verwaltungsausgaben an den Gesamtausgaben ist nach DZI-Maßstab niedrig („niedrig“ = unter 10%). Die Wirksamkeit des Mitteleinsatzes wird überprüft, und die Ergebnisse werden dokumentiert und veröffentlicht.\n5.Vergütungen (trifft nicht zu).\n6.Mittelbeschaffung und -verwendung sowie die Vermögenslage werden nachvollziehbar dokumentiert und angemessen geprüft.\n7.Die Organisation berichtet offen und hinreichend umfassend über ihre Arbeit, Strukturen und Finanzen.\nTräger des DZI Spenden-Siegels seit 20.11.2019\nKontakt\nWebsite\nwww.tabithaglobalcare.com\nE-Mail\nkontakt@tabithaglobalcare.com\nTelefon\n05622-916545\nAnschrift\nÜber den Bergen 6a\n34560 Fritzlar\nSpendenkonten\nIBAN: DE77520626010000222224\nBIC: GENODEF1HRV\nVR PartnerBank Chattengau-Schwalm-Eder\nAllgemeine Informationen\nGründungsjahr\n2016\nSitz der Organisation\nFritzlar\nRechtsform\nVerein\nWeltanschauliche Ausrichtung\nchristlich\nOrganisation\nLeitungsorgan\nVorstand\nMitglieder/Gesellschafter\n29 stimmberechtigte Mitglieder\nAnzahl Mitarbeiter Hilfetext\nehrenamtlich: 50"
  },
  {
    "title": "Tafel Deutschland e.V.",
    "url": "https://www.dzi.de/organisation/tafel-deutschland-e-v/",
    "weltanschaulicheAusrichtung": "unabhängig",
    "finanzen": {
      "bezugsjahr": 2018,
      "gesamtEinnahmen": "8.172.202,14 EUR",
      "anteilKosten": "angemessen"
    },
    "volltext": "Arbeitsschwerpunkte\nAltenhilfe, Bildungs- und Kampagnenarbeit, Corona-Hilfe, Familienfürsorge, Flüchtlingsfürsorge, Kinder- und Jugendhilfe, Kultur, Umwelt- und Naturschutz\nLänderschwerpunkte\nDeutschland\nTätigkeitsfelder\nDie Tafel Deutschland e.V. ist die Dachorganisation der über 900 lokalen Tafeln, die ihrerseits rechtlich selbstständig sind oder aber in Trägerschaft eines gemeinnützigen Wohlfahrtsverbands arbeiten. Sie geben überschüssige, beanstandungsfreie Lebensmittel aus Produktion, Handel und Gastronomie kostenlos oder zu einem symbolischen Beitrag an bedürftige Menschen ab. Der Verband mit seinen bundesweit mehr als 2.000 Ausgabestellen wird von rund 40.000 ehrenamt-lichen Helferinnen und Helfern sowie unzähligen kleinen und großen Unternehmen unterstützt. Die Angebote der Tafeln werden nach Angaben des Verbands regelmäßig von mehr als einer Million Menschen in Anspruch genommen. Hauptaufgaben der Tafel Deutschland sind die Vermittlung von Sponsorenleistungen für die Tafeln, die Förderung ausgewählter Tafelprojekte, die Interessenvertretung gegenüber Politik, Wirtschaft und Gesellschaft, die Unterstützung seiner Mitglieder durch Wissensaustausch, Weiterbildung und Beratung sowie Hilfestellungen bei Neugründungen von örtlichen Tafeln.\nFinanzen\nBezugsjahr:\n2018\nGesamteinnahmen:\n8.172.202,14 EUR\nDavon Sammlungseinnahmen Hilfetext:\n6.822.093,64 EUR\nAnteil Werbe- und Verwaltungskosten Hilfetext:\nangemessen\nEinschätzung durch das DZI Hilfetext\nDer Tafel Deutschland e.V., Berlin, wurde das DZI Spenden-Siegel zuerkannt. Der Verein ist förderungswürdig.\nDie sieben Spenden-Siegel-Standards erfüllt der Verein wie folgt:\n1.Die Organisation leistet satzungsgemäße Arbeit.\n2.Leitung und Aufsicht sind hinreichend angemessen strukturiert, klar voneinander getrennt und werden wirksam wahrgenommen.\n3.Werbung und Öffentlichkeitsarbeit informieren klar, wahr, sachlich und offen.\n4.Der Anteil der Werbe- und Verwaltungsausgaben an den Gesamtausgaben ist nach DZI-Maßstab angemessen („angemessen“ = 10% bis unter 20%). Die Wirksamkeit des Mitteleinsatzes wird überprüft, und die Ergebnisse werden dokumentiert und veröffentlicht.\n5.Die von der Organisation gezahlten Vergütungen berücksichtigen den Status der Gemeinnützigkeit, die Qualifikation, das Maß an Verantwortung und den branchenüblichen Rahmen.\n6.Mittelbeschaffung und -verwendung sowie die Vermögenslage werden nachvollziehbar dokumentiert und angemessen geprüft.\n7.Die Organisation berichtet offen und umfassend über ihre Arbeit, Strukturen und Finanzen.\nTräger des DZI Spenden-Siegels seit 10.12.2010\nKontakt\nWebsite\nwww.tafel.de\nE-Mail\ninfo@tafel.de\nTelefon\n030-20059760\nFax\n030-200597616\nAnschrift\nGermaniastraße 18\n12099 Berlin\nSpendenkonten\nIBAN: DE63100205000001118500\nBIC: BFSWDE33BER\nBank für Sozialwirtschaft\nAllgemeine Informationen\nGründungsjahr\n1996\nSitz der Organisation\nBerlin\nRechtsform\nVerein\nWeltanschauliche Ausrichtung\nunabhängig\nOrganisation\nLeitungsorgan\nVorstand\nGeschäftsführung\nEvelin Schulz\nMitglieder/Gesellschafter\n947 stimmberechtigte Mitglieder\nAnzahl Mitarbeiter Hilfetext\nhauptamtlich: 25 ehrenamtlich: 48"
  },
  {
    "title": "UNO-Flüchtlingshilfe e.V.",
    "url": "https://www.dzi.de/organisation/uno-fluechtlingshilfe-e-v/",
    "weltanschaulicheAusrichtung": "unabhängig",
    "finanzen": {
      "bezugsjahr": 2018,
      "gesamtEinnahmen": "33.011.106,88 EUR",
      "anteilKosten": "vertretbar"
    },
    "volltext": "Arbeitsschwerpunkte\nBildung, Flüchtlingsfürsorge, Gesundheitshilfe, Katastrophenhilfe, Menschenrechte\nLänderschwerpunkte\nÄgypten, Äthiopien, Bangladesch, Brasilien, Demokratische Republik Kongo, Deutschland, Ecuador, Griechenland, Indonesien, Irak, Italien, Jemen, Jordanien, Kamerun, Kenia, Kolumbien, Libyen, Marokko, Niger, Nigeria, Peru, Somalia, Spanien, Südsudan, Syrien, Tschad, Türkei, Uganda, Venezuela, Zentralafrikanische Republik\n… mehr\nTätigkeitsfelder\nDie UNO-Flüchtlingshilfe ist der deutsche Partner des Flüchtlingshilfswerks der Vereinten Nationen (UNHCR). Ziel der Organisation ist es, das Leben von Flüchtlingen zu schützen und dazu beizutragen, dass alle Flüchtlinge ihr Schicksal wieder in die eigene Hand nehmen können. Insbesondere unterstützt die UNO-Flüchtlingshilfe die direkte Nothilfe im akuten Krisenfall, Aus- und Weiterbildungsprogramme für eine bessere Zukunft und Hilfsprogramme für freiwillig zurückkehrende Flüchtlinge. Hinzu kommen zahlreiche Projekte für Geflüchtete in Deutschland, vor allem im Bereich der psychosozialen Therapie für traumatisierte Flüchtlinge und der Asylverfahrensberatung. Mit gezielter Öffentlichkeitsarbeit informiert die Organisation über Fluchtursachen und -folgen, um so das Verständnis für das Schicksal der Flüchtlinge zu vertiefen.\nFinanzen\nBezugsjahr:\n2018\nGesamteinnahmen:\n33.011.106,88 EUR\nDavon Sammlungseinnahmen Hilfetext:\n26.605.062,80 EUR\nAnteil Werbe- und Verwaltungskosten Hilfetext:\nvertretbar\nEinschätzung durch das DZI Hilfetext\nUNO-Flüchtlingshilfe e.V., Bonn, wurde das DZI Spenden-Siegel zuerkannt. Der Verein ist förderungswürdig.\nDie sieben Spenden-Siegel-Standards erfüllt der Verein wie folgt:\n1.Die Organisation leistet satzungsgemäße Arbeit.\n2.Leitung und Aufsicht sind angemessen strukturiert, klar voneinander getrennt und werden wirksam wahrgenommen.\n3.Werbung und Öffentlichkeitsarbeit informieren klar, wahr, sachlich und offen.\n4.Der Anteil der Werbe- und Verwaltungsausgaben an den Gesamtausgaben ist nach DZI-Maßstab vertretbar („vertretbar“ = 20% bis 30%). Die Wirksamkeit des Mitteleinsatzes wird überprüft, und die Ergebnisse werden dokumentiert und in hinreichendem Maße veröffentlicht.\n5.Die von der Organisation gezahlten Vergütungen berücksichtigen den Status der Gemeinnützigkeit, die Qualifikation, das Maß an Verantwortung und den branchenüblichen Rahmen.\n6.Mittelbeschaffung und -verwendung sowie die Vermögenslage werden nachvollziehbar dokumentiert und angemessen Maße geprüft.\n7.Die Organisation berichtet offen und hinreichend umfassend über ihre Arbeit, Strukturen und Finanzen.\nTräger des DZI Spenden-Siegels seit 10.04.2003\nKontakt\nWebsite\nwww.uno-fluechtlingshilfe.de\nE-Mail\ninfo@uno-fluechtlingshilfe.de\nTelefon\n0228-90908600\nFax\n0228-90908601\nAnschrift\nGraurheindorfer Straße 149a\n53117 Bonn\nSpendenkonten\nIBAN: DE78370501980020008850\nBIC: COLSDE33\nSparkasse KölnBonn\nAllgemeine Informationen\nGründungsjahr\n1980\nSitz der Organisation\nBonn\nRechtsform\nVerein\nWeltanschauliche Ausrichtung\nunabhängig\nOrganisation\nLeitungsorgan\nVorstand\nGeschäftsführung\nPeter Ruhenstroth-Bauer\nMitglieder/Gesellschafter\n98 stimmberechtigte Mitglieder\nAnzahl Mitarbeiter Hilfetext\nhauptamtlich: 46 ehrenamtlich: 7"
  },
  {
    "title": "Verein Programm Klasse 2000 e.V.",
    "url": "https://www.dzi.de/organisation/verein-programm-klasse-2000-e-v/",
    "weltanschaulicheAusrichtung": "unabhängig",
    "finanzen": {
      "bezugsjahr": 2019,
      "gesamtEinnahmen": "5.075.072,98 EUR",
      "anteilKosten": "angemessen"
    },
    "volltext": "Arbeitsschwerpunkte\nBildung, Gesundheitshilfe, Kinder- und Jugendhilfe, Suchthilfe\nLänderschwerpunkte\nDeutschland\nTätigkeitsfelder\nDer Verein führt das Unterrichtsprogramm Klasse2000 zur Gesundheitsförderung, Gewalt- und Suchtprävention in Grund- und Förderschulen durch. Das Programm wurde 1991 am Institut für Präventive Pneumologie des Klinikums Nürnberg entwickelt und wird seitdem laufend überarbeitet sowie evaluiert. Klasse2000 begleitet Kinder von Klasse 1 bis 4. Pro Schuljahr führen Lehrkräfte sowie durch den Verein speziell geschulte Gesundheitsfördererinnen und -förderer zirka 15 Klasse2000-Stunden durch. Ziel ist es, die Gesundheits- und Lebenskompetenzen der Kinder zu stärken: Sie sollen eine positive Einstellung zur Gesundheit gewinnen und erfahren, was sie selbst tun können, damit es ihnen gut geht. Die Themen reichen von Ernährung, Bewegung und Entspannung bis hin zur gewaltfreien Konfliktlösung, zum angemessenen Umgang mit unangenehmen Gefühlen und Nein-Sagen zu Rauchen und Alkohol. Positive Wirkungen des Programms auf das Ernährungs- und Bewegungsverhalten während der Grundschulzeit sowie auf den Konsum von Zigaretten und Alkohol im Jugendalter sind durch wissenschaftliche Studien belegt. Die Finanzierung des Programms erfolgt über Spenden und Fördergelder, meist in Form von Patenschaften für einzelne Klassen. Wichtigster Partner des Vereins sind die Lions Clubs in Deutschland.\nFinanzen\nBezugsjahr:\n2019\nGesamteinnahmen:\n5.075.072,98 EUR\nDavon Sammlungseinnahmen Hilfetext:\n950.572,43 EUR\nAnteil Werbe- und Verwaltungskosten Hilfetext:\nangemessen\nEinschätzung durch das DZI Hilfetext\nDem Verein Programm Klasse 2000 e.V., Nürnberg, wurde das DZI Spenden-Siegel zuerkannt. Der Verein ist förderungswürdig.\nDie sieben Spenden-Siegel-Standards erfüllt der Verein wie folgt:\n1.Die Organisation leistet satzungsgemäße Arbeit.\n2.Leitung und Aufsicht sind angemessen strukturiert, klar voneinander getrennt und werden wirksam wahrgenommen.\n3.Werbung und Öffentlichkeitsarbeit informieren klar, wahr, sachlich und offen.\n4.Der Anteil der Werbe- und Verwaltungsausgaben an den Gesamtausgaben ist nach DZI-Maßstab angemessen („angemessen“ = 10% bis unter 20%). Die Wirksamkeit des Mitteleinsatzes wird überprüft, und die Ergebnisse werden dokumentiert und veröffentlicht.\n5.Die von der Organisation gezahlten Vergütungen berücksichtigen den Status der Gemeinnützigkeit, die Qualifikation, das Maß an Verantwortung und den branchenüblichen Rahmen.\n6.Mittelbeschaffung und -verwendung sowie die Vermögenslage werden nachvollziehbar dokumentiert und angemessen geprüft.\n7.Die Organisation berichtet offen und umfassend über ihre Arbeit, Strukturen und Finanzen.\nTräger des DZI Spenden-Siegels seit 15.06.2005\nKontakt\nWebsite\nwww.klasse2000.de\nE-Mail\ninfo@klasse2000.de\nTelefon\n0911-891210\nFax\n0911-8912130\nAnschrift\nFeldgasse 37\n90489 Nürnberg\nSpendenkonten\nIBAN: DE87760606180000001600\nBIC: GENODEF1NO2\nVolksbank Raiffeisenbank Nürnberg\nAllgemeine Informationen\nGründungsjahr\n2002\nSitz der Organisation\nNürnberg\nRechtsform\nVerein\nWeltanschauliche Ausrichtung\nunabhängig\nOrganisation\nLeitungsorgan\nVorstand\nGeschäftsführung\nThomas Duprée\nMitglieder/Gesellschafter\n26 stimmberechtigte Mitglieder\nAnzahl Mitarbeiter Hilfetext\nhauptamtlich: 33 ehrenamtlich: 6"
  },
  {
    "title": "Verein zur Förderung der Städtepartnerschaft Kreuzberg – San Rafael del Sur e.V.",
    "url": "https://www.dzi.de/organisation/verein-zur-foerderung-der-staedtepartnerschaft-kreuzberg-san-rafael-del-sur-e-v/",
    "weltanschaulicheAusrichtung": "unabhängig",
    "finanzen": {
      "bezugsjahr": 2018,
      "gesamtEinnahmen": "136.494,93 EUR",
      "anteilKosten": "niedrig"
    },
    "volltext": "Arbeitsschwerpunkte\nBildung, Bildungs- und Kampagnenarbeit, Entwicklungszusammenarbeit, Frauenförderung, Gesundheitshilfe, Katastrophenhilfe, Menschenrechte, Völkerverständigung\nLänderschwerpunkte\nDeutschland, Nicaragua\nTätigkeitsfelder\nDer Verein unterstützt Projekte in dem nicaraguanischen Landkreis San Rafael del Sur. Hier leben cirka 42.000 Menschen in der gleichnamigen Stadt und in 59 weiteren, sehr unterschiedlich entwickelten Dörfern und Gemeinden. Das Ziel der Projektentwicklung und -unterstützung ist die Verbesserung der Lebensbedingungen sozial benachteiligter Bevölkerungsgruppen, insbesondere im ländlichen Bereich, nach dem Prinzip der Selbstorganisation. Die Schwerpunkte der Projektarbeit liegen in den Bereichen Gesundheit, Trinkwasserversorgung und Bildung sowie der Förderung der landwirtschaftlichen Produktion. Der Verein arbeitet dabei eng mit der Partnerorganisation „Centro de Desarrollo Rural“ (CEDRU, Zentrum für ländliche Entwicklung) zusammen.\nFinanzen\nBezugsjahr:\n2018\nGesamteinnahmen:\n136.494,93 EUR\nDavon Sammlungseinnahmen Hilfetext:\n31.819,58 EUR\nAnteil Werbe- und Verwaltungskosten Hilfetext:\nniedrig\nEinschätzung durch das DZI Hilfetext\nDem Verein zur Förderung der Städtepartnerschaft Kreuzberg – San Rafael del Sur e.V., Berlin, wurde das DZI Spenden-Siegel zuerkannt. Der Verein ist förderungswürdig.\nDie sieben Spenden-Siegel-Standards erfüllt der Verein wie folgt:\n1.Die Organisation leistet satzungsgemäße Arbeit.\n2.Leitung und Aufsicht sind angemessen strukturiert, klar voneinander getrennt und werden wirksam wahrgenommen.\n3.Werbung und Öffentlichkeitsarbeit informieren klar, wahr, sachlich und offen.\n4.Der Anteil der Werbe- und Verwaltungsausgaben an den Gesamtausgaben ist nach DZI-Maßstab niedrig („niedrig“ = unter 10%). Die Wirksamkeit des Mitteleinsatzes wird überprüft, und die Ergebnisse werden dokumentiert und veröffentlicht.\n5.Die von der Organisation gezahlten Vergütungen berücksichtigen den Status der Gemeinnützigkeit, die Qualifikation, das Maß an Verantwortung und den branchenüblichen Rahmen.\n6.Mittelbeschaffung und -verwendung sowie die Vermögenslage werden nachvollziehbar dokumentiert und angemessen geprüft.\n7.Die Organisation berichtet offen und hinreichend umfassend über ihre Arbeit, Strukturen und Finanzen.\nTräger des DZI Spenden-Siegels seit 05.06.2003\nKontakt\nWebsite\nwww.staepa-berlin.de\nE-Mail\ninfo@staepa-berlin.de\nTelefon\n030-61209165\nFax\n030-61209167\nAnschrift\nAdalbertstraße 23b\n10997 Berlin\nSpendenkonten\nIBAN: DE35100100100464805104\nBIC: PBNKDEFF\nPostbank\nAllgemeine Informationen\nGründungsjahr\n1985\nSitz der Organisation\nBerlin\nRechtsform\nVerein\nWeltanschauliche Ausrichtung\nunabhängig\nOrganisation\nLeitungsorgan\nVorstand\nMitglieder/Gesellschafter\n107 stimmberechtigte Mitglieder\nAnzahl Mitarbeiter Hilfetext\nhauptamtlich: 2 ehrenamtlich: 2"
  },
  {
    "title": "Watoto e.V.",
    "url": "https://www.dzi.de/organisation/watoto-e-v/",
    "weltanschaulicheAusrichtung": "unabhängig",
    "finanzen": {
      "bezugsjahr": 2017,
      "gesamtEinnahmen": "309.405,36 EUR",
      "anteilKosten": "niedrig"
    },
    "volltext": "Arbeitsschwerpunkte\nBildung, Entwicklungszusammenarbeit, Kinder- und Jugendhilfe, Kinderpatenschaft\nLänderschwerpunkte\nKenia\nTätigkeitsfelder\nWatoto (Suaheli: „Kinder“) unterstützt die Mekaela Academies in Kenia. Mekaela Academies wurde 1993 gegründet, um Kindern in Afrika unabhängig von ihrer finanziellen Situation eine schulische Ausbildung zu ermöglichen. Die Einrichtung besteht derzeit aus fünf Schulen, drei Grund- und Hauptschulen mit Vorschule sowie zwei Gymnasien. Drei Schulen haben einen Internatsbetrieb. Insgesamt besuchen rund 1.100 Jungen und Mädchen die Einrichtungen der Mekaela Academies. Der deutsche Verein Watoto sammelt Spenden für Baumaßnahmen und Investitionen an den Schulen und vermittelt über Patenschaften Stipendien an Kinder mittelloser Familien.\nFinanzen\nBezugsjahr:\n2017\nGesamteinnahmen:\n309.405,36 EUR\nDavon Sammlungseinnahmen Hilfetext:\n232.005,36 EUR\nAnteil Werbe- und Verwaltungskosten Hilfetext:\nniedrig\nEinschätzung durch das DZI Hilfetext\nWatoto e.V., Hamburg, wurde das DZI Spenden-Siegel zuerkannt. Der Verein ist förderungswürdig.\nDie sieben Spenden-Siegel-Standards erfüllt der Verein wie folgt:\n1.Die Organisation leistet satzungsgemäße Arbeit.\n2.Leitung und Aufsicht sind angemessen strukturiert, klar voneinander getrennt und werden wirksam wahrgenommen.\n3.Werbung und Öffentlichkeitsarbeit informieren klar, wahr, sachlich und offen.\n4.Der Anteil der Werbe- und Verwaltungsausgaben an den Gesamtausgaben ist nach DZI-Maßstab niedrig („niedrig“ = unter 10%). Die Wirksamkeit des Mitteleinsatzes wird überprüft, und die Ergebnisse werden dokumentiert und veröffentlicht.\n5.Vergütungen (trifft nicht zu).\n6.Mittelbeschaffung und -verwendung sowie die Vermögenslage werden nachvollziehbar dokumentiert und geprüft.\n7.Die Organisation berichtet offen und umfassend über ihre Arbeit, Strukturen und Finanzen.\nTräger des DZI Spenden-Siegels seit 22.10.2009\nKontakt\nWebsite\nwww.watoto.de\nE-Mail\npostfach@watoto.de\nTelefon\n040-55640112\nFax\n0321-35676776\nAnschrift\nLiepmannweg 15\n22399 Hamburg\nSpendenkonten\nIBAN: DE59520503530002193892\nBIC: HELADEF1KAS\nKasseler Sparkasse\nAllgemeine Informationen\nGründungsjahr\n1998\nSitz der Organisation\nHamburg\nRechtsform\nVerein\nWeltanschauliche Ausrichtung\nunabhängig\nOrganisation\nLeitungsorgan\nVorstand\nMitglieder/Gesellschafter\n20 stimmberechtigte Mitglieder\nAnzahl Mitarbeiter Hilfetext\nehrenamtlich: 16"
  },
  {
    "title": "WELTFRIEDENSDIENST e.V.",
    "url": "https://www.dzi.de/organisation/weltfriedensdienst-e-v/",
    "weltanschaulicheAusrichtung": "unabhängig",
    "finanzen": {
      "bezugsjahr": 2018,
      "gesamtEinnahmen": "6.663.291,92 EUR",
      "anteilKosten": "niedrig"
    },
    "volltext": "Arbeitsschwerpunkte\nBildung, Entwicklungszusammenarbeit, Frauenförderung, Gesundheitshilfe, Kinder- und Jugendhilfe, Menschenrechte, Umwelt- und Naturschutz, Völkerverständigung\nLänderschwerpunkte\nArgentinien, Benin, Bolivien, Brasilien, Burundi, Deutschland, Ecuador, Ghana, Guatemala, Guinea, Guinea-Bissau, Kenia, Laos, Myanmar, Namibia, Nicaragua, Palästinensische Gebiete, Peru, Sambia, Senegal, Simbabwe, Südafrika, Tansania\n… mehr\nTätigkeitsfelder\nDer WELTFRIEDENSDIENST e.V. versteht seine Arbeit als Engagement für mehr Gerechtigkeit und gegen die ungleiche Verteilung von gesellschaftlichem Reichtum. In Afrika, Lateinamerika und\nAsien unterstützt der WELTFRIEDENSDIENST e.V. Menschen, die aus eigener Initiative an der Verbesserung ihrer Lebensbedingungen arbeiten. Arbeitsschwerpunkte sind Friedensarbeit, Bildung, der Schutz der natürlichen Ressourcen sowie Menschenrechte. Mit Hilfe von Bildungs- und Öffentlichkeitsarbeit und der Vermittlung von Projektpartnerschaften trägt der WELTFRIEDENSDIENST e.V. zur Sensibilisierung für die Probleme des Südens bei. Darüber hinaus gibt der Verein Impulse in entwicklungspolitischen Diskussionen und Kampagnen. Der WELTFRIEDENSDIENST e.V. ist Träger des Zivilen Friedensdienst und staatlich anerkannter Träger der Entwicklungszusammenarbeit.\nFinanzen\nBezugsjahr:\n2018\nGesamteinnahmen:\n6.663.291,92 EUR\nDavon Sammlungseinnahmen Hilfetext:\n752.889,30 EUR\nAnteil Werbe- und Verwaltungskosten Hilfetext:\nniedrig\nEinschätzung durch das DZI Hilfetext\nDem WELTFRIEDENSDIENST e.V., Berlin, wurde das DZI Spenden-Siegel zuerkannt. Der Verein ist förderungswürdig.\nDie sieben Spenden-Siegel-Standards erfüllt der Verein wie folgt:\n1.Die Organisation leistet satzungsgemäße Arbeit.\n2.Leitung und Aufsicht sind angemessen strukturiert, klar voneinander getrennt und werden wirksam wahrgenommen.\n3.Werbung und Öffentlichkeitsarbeit informieren klar, wahr, sachlich und offen.\n4.Der Anteil der Werbe- und Verwaltungsausgaben an den Gesamtausgaben ist nach DZI-Maßstab niedrig („niedrig“ = unter 10%). Die Wirksamkeit des Mitteleinsatzes wird überprüft, und die Ergebnisse werden dokumentiert und veröffentlicht.\n5.Die von der Organisation gezahlten Vergütungen berücksichtigen den Status der Gemeinnützigkeit, die Qualifikation, das Maß an Verantwortung und den branchenüblichen Rahmen.\n6.Mittelbeschaffung und -verwendung sowie die Vermögenslage werden nachvollziehbar dokumentiert und angemessen geprüft.\n7.Die Organisation berichtet offen und hinreichend umfassend über ihre Arbeit, Strukturen und Finanzen.\nTräger des DZI Spenden-Siegels seit 28.10.1992\nKontakt\nWebsite\nwww.weltfriedensdienst.de\nE-Mail\ninfo@weltfriedensdienst.de\nTelefon\n030-2539900\nFax\n030-2511887\nAnschrift\nAm Borsigturm 9\n13507 Berlin\nSpendenkonten\nIBAN: DE06100205000003147505\nBIC: BFSWDE33BER\nBank für Sozialwirtschaft\nAllgemeine Informationen\nGründungsjahr\n1959\nSitz der Organisation\nBerlin\nRechtsform\nVerein\nWeltanschauliche Ausrichtung\nunabhängig\nOrganisation\nLeitungsorgan\nVorstand\nGeschäftsführung\nJudith Ohene\nMitglieder/Gesellschafter\n151 stimmberechtigte Mitglieder\nAnzahl Mitarbeiter Hilfetext\nhauptamtlich: 18 ehrenamtlich: 120"
  },
  {
    "title": "Zukunftsstiftung Entwicklung",
    "url": "https://www.dzi.de/organisation/zukunftsstiftung-entwicklung/",
    "weltanschaulicheAusrichtung": "unabhängig",
    "finanzen": {
      "bezugsjahr": 2019,
      "gesamtEinnahmen": "6.525.348,83 EUR",
      "anteilKosten": "niedrig"
    },
    "volltext": "Arbeitsschwerpunkte\nBildung, Entwicklungszusammenarbeit, Frauenförderung, Gesundheitshilfe, Kinder- und Jugendhilfe, Kinderpatenschaft, Menschenrechte, Umwelt- und Naturschutz\nLänderschwerpunkte\nAfghanistan, Argentinien, Äthiopien, Bolivien, Brasilien, Ghana, Indien, Kenia, Mexiko, Mongolei, Nepal, Nicaragua, Pakistan, Peru, Russische Föderation, Simbabwe, Südafrika, Tansania, Uganda\n… mehr\nTätigkeitsfelder\nDie Zukunftsstiftung Entwicklung fördert Projekte insbesondere in Afrika, Asien und Südamerika. Sie unterstützt beispielsweise Selbsthilfeprojekte im Bereich der ökologischen Landwirtschaft, regenerativer Energien und im Kleingewerbe, fördert soziale Projekte wie etwa Behinderten- und Kinderheime und engagiert sich in Menschenrechtsprojekten und in der Basisgesundheitsvorsorge. Darüber hinaus vermittelt die Stiftung Patenschaften, die in erster Linie auf schulische Förderungen ausgerichtet sind.\nFinanzen\nBezugsjahr:\n2019\nGesamteinnahmen:\n6.525.348,83 EUR\nDavon Sammlungseinnahmen Hilfetext:\n4.353.116,06 EUR\nAnteil Werbe- und Verwaltungskosten Hilfetext:\nniedrig\nEinschätzung durch das DZI Hilfetext\nDer Zukunftsstiftung Entwicklung, Bochum, wurde das DZI Spenden-Siegel zuerkannt. Die Stiftung ist förderungswürdig.\nDie sieben Spenden-Siegel-Standards erfüllt die Stiftung wie folgt:\n1.Die Organisation leistet satzungsgemäße Arbeit.\n2.Leitung und Aufsicht sind angemessen strukturiert, klar voneinander getrennt und werden wirksam wahrgenommen.\n3.Werbung und Öffentlichkeitsarbeit informieren klar, wahr, sachlich und offen.\n4.Der Anteil der Werbe- und Verwaltungsausgaben an den Gesamtausgaben ist nach DZI-Maßstab niedrig („niedrig“ = unter 10%). Die Wirksamkeit des Mitteleinsatzes wird überprüft, und die Ergebnisse werden dokumentiert und veröffentlicht.\n5.Die von der Organisation gezahlten Vergütungen berücksichtigen den Status der Gemeinnützigkeit, die Qualifikation, das Maß an Verantwortung und den branchenüblichen Rahmen.\n6.Mittelbeschaffung und -verwendung sowie die Vermögenslage werden nachvollziehbar dokumentiert und angemessen geprüft.\n7.Die Organisation berichtet offen und umfassend über ihre Arbeit, Strukturen und Finanzen.\nTräger des DZI Spenden-Siegels seit 14.12.2020\nKontakt\nWebsite\nwww.zukunftsstiftung-entwicklung.de\nE-Mail\nentwicklung@gls-treuhand.de\nTelefon\n0234-57975224\nFax\n0234-57975188\nAnschrift\nChriststraße 9\n44789 Bochum\nSpendenkonten\nIBAN: DE05430609670012330010\nBIC: GENODEM1GLS\nGLS Gemeinschaftsbank\nAllgemeine Informationen\nGründungsjahr\n2001\nSitz der Organisation\nBochum\nRechtsform\nnicht rechtsfähige Stiftung\nWeltanschauliche Ausrichtung\nunabhängig\nOrganisation\nLeitungsorgan\nGeschäftsführung\nAnzahl Mitarbeiter Hilfetext\nhauptamtlich: 13 ehrenamtlich: 9"
  },
  {
    "title": "Basisgesundheitsdienst Partnerdiözese Jabalpur/Indien e.V.",
    "url": "https://www.dzi.de/organisation/basisgesundheitsdienst-partnerdioezese-jabalpur-indien-e-v/",
    "weltanschaulicheAusrichtung": "christlich",
    "finanzen": {
      "bezugsjahr": 2018,
      "gesamtEinnahmen": "92.443,25 EUR",
      "anteilKosten": "niedrig"
    },
    "volltext": "Arbeitsschwerpunkte\nAltenhilfe, Behindertenhilfe, Bildung, Bildungs- und Kampagnenarbeit, Entwicklungszusammenarbeit, Familienfürsorge, Gesundheitshilfe, Kinder- und Jugendhilfe\nLänderschwerpunkte\nIndien\nTätigkeitsfelder\nBereits seit den 1960er Jahren arbeiten die Pfarrgemeinde St. Margareta in Münster und die Diözese Jabalpur (Bundesstaat Madhya Pradesh) zusammen. Der aus dieser Partnerschaft entstandene Basisgesundheitsdienst Partnerdiözese Jabalpur/Indien e.V. hat es sich zur Aufgabe gemacht, insbesondere die in dieser Region Zentralindiens lebenden Ureinwohner, die Adivasi, zu unterstützen. Der Verein fördert eine Vielzahl von Projekten in der Partnerdiözese durch Anschubfinanzierungen, beispielsweise den Bau bzw. die Erweiterung von Schulen, Internaten und Berufsbildungszentren, die Ausbildung von Gesundheitshelfern, die Errichtung und Vergrößerung von Krankenhäusern, Ambulanzstationen und Sterbehäusern. Mit ihrer Öffentlichkeitsarbeit in Deutschland will die Organisation vor allem Problembewusstsein im Hinblick auf die Situation der alteingesessenen Bevölkerung in der zentralindischen Diözese schaffen.\nFinanzen\nBezugsjahr:\n2018\nGesamteinnahmen:\n92.443,25 EUR\nDavon Sammlungseinnahmen Hilfetext:\n92.374,51 EUR\nAnteil Werbe- und Verwaltungskosten Hilfetext:\nniedrig\nEinschätzung durch das DZI Hilfetext\nDem Basisgesundheitsdienst Partnerdiözese Jabalpur/Indien e.V., Münster, wurde das DZI Spenden-Siegel zuerkannt. Der Verein ist förderungswürdig.\nDie sieben Spenden-Siegel-Standards erfüllt der Verein wie folgt:\n1.Die Organisation leistet satzungsgemäße Arbeit.\n2.Leitung und Aufsicht sind angemessen strukturiert, klar voneinander getrennt und werden wirksam wahrgenommen.\n3.Werbung und Öffentlichkeitsarbeit informieren klar, wahr, sachlich und offen.\n4.Der Anteil der Werbe- und Verwaltungsausgaben an den Gesamtausgaben ist nach DZI-Maßstab niedrig („niedrig“ = unter 10%). Die Wirksamkeit des Mitteleinsatzes wird überprüft, und die Ergebnisse werden dokumentiert und veröffentlicht.\n5.Vergütungen (trifft nicht zu)\n6.Mittelbeschaffung und -verwendung sowie die Vermögenslage werden nachvollziehbar dokumentiert und angemessen geprüft.\n7.Die Organisation berichtet offen und umfassend über ihre Arbeit, Strukturen und Finanzen.\nTräger des DZI Spenden-Siegels seit 23.11.1992\nKontakt\nWebsite\nwww.bgd-muenster.de\nE-Mail\nbgd@muenster.org\nTelefon\n0251-315901\nAnschrift\nHegerskamp 71\n48155 Münster\nSpendenkonten\nIBAN: DE98400602650003433100\nBIC: GENODEM1DKM\nDKM Darlehnskasse Münster\nAllgemeine Informationen\nGründungsjahr\n1985\nSitz der Organisation\nMünster\nRechtsform\nVerein\nWeltanschauliche Ausrichtung\nchristlich\nOrganisation\nLeitungsorgan\nVorstand\nMitglieder/Gesellschafter\n53 stimmberechtigte Mitglieder\nAnzahl Mitarbeiter Hilfetext\nehrenamtlich: 10"
  },
  {
    "title": "Bayerische Sportstiftung",
    "url": "https://www.dzi.de/organisation/bayerische-sportstiftung/",
    "weltanschaulicheAusrichtung": "unabhängig",
    "finanzen": {
      "bezugsjahr": 2019,
      "gesamtEinnahmen": "65.637,69 EUR",
      "anteilKosten": "angemessen"
    },
    "volltext": "Arbeitsschwerpunkte\nKinder- und Jugendhilfe, Sport\nLänderschwerpunkte\nDeutschland\nTätigkeitsfelder\nDie Stiftung fördert insbesondere Nachwuchsleistungssportler in bayerischen Vereinen und Leistungssportstrukturen. Neben Geld- und Sachleistungen sollen die jungen Athleten auch durch die Vermittlung von Ausbildungs- und Arbeitsplätzen gefördert werden. Unterstützt werden vorrangig Sportlerinnen und Sportler, die Mitglied in einem Verein oder Verband des Bayerischen Landes-Sportverbandes e.V. sind. Die Förderkriterien sind in den Fördergrundsätzen der Stiftung festgelegt und auf deren Website einsehbar.\nFinanzen\nBezugsjahr:\n2019\nGesamteinnahmen:\n65.637,69 EUR\nDavon Sammlungseinnahmen Hilfetext:\n8.993,43 EUR\nAnteil Werbe- und Verwaltungskosten Hilfetext:\nangemessen\nEinschätzung durch das DZI Hilfetext\nDer Bayerische Sportstiftung, München, wurde das DZI Spenden-Siegel zuerkannt. Die Stiftung ist förderungswürdig.\nDie sieben Spenden-Siegel-Standards erfüllt die Stiftung wie folgt:\n1.Die Organisation leistet satzungsgemäße Arbeit.\n2.Leitung und Aufsicht sind angemessen strukturiert, klar voneinander getrennt und werden wirksam wahrgenommen.\n3.Werbung und Öffentlichkeitsarbeit informieren klar, wahr, sachlich und offen.\n4.Der Anteil der Werbe- und Verwaltungsausgaben an den Gesamtausgaben ist nach DZI-Maßstab angemessen („angemessen“ = 10% bis unter 20%). Die Wirksamkeit des Mitteleinsatzes wird überprüft, und die Ergebnisse werden dokumentiert und veröffentlicht.\n5.Vergütungen: trifft nicht zu.\n6.Mittelbeschaffung und -verwendung sowie die Vermögenslage werden nachvollziehbar dokumentiert und angemessen geprüft.\n7.Die Organisation berichtet offen und umfassend über ihre Arbeit, Strukturen und Finanzen.\nTräger des DZI Spenden-Siegels seit 15.07.2016\nKontakt\nWebsite\nwww.bayerische-sportstiftung.de\nE-Mail\ninfo@bayerische-sportstiftung.de\nTelefon\n089-15702634\nAnschrift\nGeorg-Brauchle-Ring 93\n80992 München\nSpendenkonten\nIBAN: DE78701500000000666222\nBIC: SSKMDEMMXXX\nStadtsparkasse München\nAllgemeine Informationen\nGründungsjahr\n2010\nSitz der Organisation\nMünchen\nRechtsform\nStiftung\nWeltanschauliche Ausrichtung\nunabhängig\nOrganisation\nLeitungsorgan\nVorstand\nAnzahl Mitarbeiter Hilfetext\nehrenamtlich: 23"
  },
  {
    "title": "Cap Anamur/Deutsche Not-Ärzte e.V.",
    "url": "https://www.dzi.de/organisation/cap-anamur-deutsche-not-aerzte-e-v/",
    "weltanschaulicheAusrichtung": "unabhängig",
    "finanzen": {
      "bezugsjahr": 2019,
      "gesamtEinnahmen": "4.036.716,28 EUR",
      "anteilKosten": "niedrig"
    },
    "volltext": "Arbeitsschwerpunkte\nCorona-Hilfe, Entwicklungszusammenarbeit, Flüchtlingsfürsorge, Gesundheitshilfe, Katastrophenhilfe\nLänderschwerpunkte\nAfghanistan, Bangladesch, Demokratische Volksrepublik Korea, Libanon, Mongolei, Nepal, Sierra Leone, Sudan, Zentralafrikanische Republik\nTätigkeitsfelder\nCap Anamur ist hauptsächlich in der Not- und Katastrophenhilfe tätig. In rund zehn Ländern leistet der Verein weltweit Hilfe für Flüchtlinge und Menschen in Not. Schwerpunkt ist der Aufbau und die Sicherstellung der medizinischen Versorgung. Darüber hinaus beinhaltet die Arbeit die Versorgung mit Trinkwasser, Lebensmitteln, Hygieneartikeln, Bekleidung, Medikamenten und Baumaterial sowie mit technischen und medizinischen Geräten. Die internationalen Teams arbeiten nach dem Grundsatz „Hilfe zur Selbsthilfe“ eng mit lokalen Mitarbeitern zusammen. Neben der Rehabilitierung oder dem Neubau von Krankenhäusern und Gesundheitsstationen engagiert sich Cap Anamur in der Verbesserung der Infrastruktur und der Ausbildung.\nFinanzen\nBezugsjahr:\n2019\nGesamteinnahmen:\n4.036.716,28 EUR\nDavon Sammlungseinnahmen Hilfetext:\n3.900.606,89 EUR\nAnteil Werbe- und Verwaltungskosten Hilfetext:\nniedrig\nEinschätzung durch das DZI Hilfetext\nKomitee Cap Anamur/Deutsche Not-Ärzte e.V., Köln, wurde das DZI Spenden-Siegel zuerkannt. Der Verein ist förderungswürdig.\nDie sieben Spenden-Siegel-Standards erfüllt der Verein wie folgt:\n1.Die Organisation leistet satzungsgemäße Arbeit.\n2.Leitung und Aufsicht sind angemessen strukturiert, klar voneinander getrennt und werden wirksam wahrgenommen.\n3.Werbung und Öffentlichkeitsarbeit informieren klar, wahr, sachlich und offen.\n4.Der Anteil der Werbe- und Verwaltungsausgaben an den Gesamtausgaben ist nach DZI-Maßstab niedrig („niedrig“ = unter 10%). Die Wirksamkeit des Mitteleinsatzes wird überprüft, und die Ergebnisse werden dokumentiert und veröffentlicht.\n5.Die von der Organisation gezahlten Vergütungen berücksichtigen den Status der Gemeinnützigkeit, die Qualifikation, das Maß an Verantwortung und den branchenüblichen Rahmen.\n6.Mittelbeschaffung und -verwendung sowie die Vermögenslage werden nachvollziehbar dokumentiert und angemessen geprüft.\n7.Die Organisation berichtet offen und umfassend über ihre Arbeit, Strukturen und Finanzen.\nTräger des DZI Spenden-Siegels seit 18.10.2004\nKontakt\nWebsite\nwww.cap-anamur.org\nE-Mail\noffice@cap-anamur.org\nTelefon\n0221-9138150\nFax\n0221-9138159\nAnschrift\nThebäerstraße 30\n50823 Köln\nSpendenkonten\nIBAN: DE85370501980002222222\nBIC: COLSDE33XXX\nSparkasse KölnBonn\nAllgemeine Informationen\nGründungsjahr\n1979\nSitz der Organisation\nKöln\nRechtsform\nVerein\nWeltanschauliche Ausrichtung\nunabhängig\nOrganisation\nLeitungsorgan\nVorstand\nGeschäftsführung\nBernd Göken\nMitglieder/Gesellschafter\n16 stimmberechtigte Mitglieder\nAnzahl Mitarbeiter Hilfetext\nhauptamtlich: 26 ehrenamtlich: 3"
  },
  {
    "title": "Caritasverband der Erzdiözese München und Freising e.V.",
    "url": "https://www.dzi.de/organisation/caritasverband-der-erzdioezese-muenchen-und-freising-e-v/",
    "weltanschaulicheAusrichtung": "katholisch",
    "finanzen": {
      "bezugsjahr": 2018,
      "gesamtEinnahmen": "447.309.090,50 EUR",
      "anteilKosten": "niedrig"
    },
    "volltext": "Arbeitsschwerpunkte\nAids, Altenhilfe, Behindertenhilfe, Bildung, Corona-Hilfe, Familienfürsorge, Flüchtlingsfürsorge, Gesundheitshilfe, Kinder- und Jugendhilfe, Religion, Suchthilfe\nLänderschwerpunkte\nDeutschland\nTätigkeitsfelder\nUnter dem Dach des Caritasverbands der Erzdiözese München und Freising e.V. sind etwa 1.200 Einrichtungen zusammengeschlossen. Über 350 Einrichtungen unterhält der Verband in eigener Trägerschaft. Als größter Wohlfahrtsverband in Oberbayern deckt die Organisation das breite Spektrum an sozialen Diensten für alle Lebensalter und in vielfältigen Notlagen ab. Hierzu gehören beispielsweise Kindertageseinrichtungen, Beratungsstellen für Eltern, Kinder, Jugendliche, soziale Beratungsstellen, Schuldnerberatungsstellen, Suchthilfeeinrichtungen, Asyl- und Migrationsberatungsstellen und Flüchtlingsdienste, Behinderteneinrichtungen, Werkstätten für Menschen mit Behinderung, ambulante Pflegedienste, Alten- und Pflegeheime sowie sozialpsychiatrische Dienste.\nFinanzen\nBezugsjahr:\n2018\nGesamteinnahmen:\n447.309.090,50 EUR\nDavon Sammlungseinnahmen Hilfetext:\n11.828.713,81 EUR\nAnteil Werbe- und Verwaltungskosten Hilfetext:\nniedrig\nEinschätzung durch das DZI Hilfetext\nDem Caritasverband der Erzdiözese München und Freising e.V., München, wurde das DZI Spenden-Siegel zuerkannt. Der Verein ist förderungswürdig.\nDie sieben Spenden-Siegel-Standards erfüllt der Verein wie folgt:\n1.Die Organisation leistet satzungsgemäße Arbeit.\n2.Leitung und Aufsicht sind angemessen strukturiert, klar voneinander getrennt und werden hinreichend wirksam wahrgenommen.\n3.Werbung und Öffentlichkeitsarbeit informieren klar, wahr, sachlich und offen.\n4.Der Anteil der Werbe- und Verwaltungsausgaben an den Gesamtausgaben ist nach DZI-Maßstab niedrig („niedrig“ = unter 10%). Die Wirksamkeit des Mitteleinsatzes wird überprüft, und die Ergebnisse werden dokumentiert und veröffentlicht.\n5.Die von der Organisation gezahlten Vergütungen berücksichtigen den Status der Gemeinnützigkeit, die Qualifikation, das Maß an Verantwortung und den branchenüblichen Rahmen.\n6.Mittelbeschaffung und -verwendung sowie die Vermögenslage werden nachvollziehbar dokumentiert und angemessen geprüft.\n7.Die Organisation berichtet offen und hinreichend umfassend über ihre Arbeit, Strukturen und Finanzen.\nTräger des DZI Spenden-Siegels seit 16.12.1996\nKontakt\nWebsite\nwww.caritas-nah-am-naechsten.de\nE-Mail\nspenden-info@caritasmuenchen.de\nTelefon\n089-551690\nFax\n089-55169577\nAnschrift\nHirtenstraße 2-4\n80335 München\nSpendenkonten\nIBAN: DE53750903000002297779\nBIC: GENODEF1M05\nLIGA Bank\nAllgemeine Informationen\nGründungsjahr\n1901\nSitz der Organisation\nMünchen\nRechtsform\nVerein\nWeltanschauliche Ausrichtung\nkatholisch\nOrganisation\nLeitungsorgan\nVorstand\nMitglieder/Gesellschafter\n115 stimmberechtigte Mitglieder\nAnzahl Mitarbeiter Hilfetext\nhauptamtlich: 9184 ehrenamtlich: 10500"
  },
  {
    "title": "DAHW Deutsche Lepra- und Tuberkulosehilfe e.V.",
    "url": "https://www.dzi.de/organisation/dahw-deutsche-lepra-und-tuberkulosehilfe-e-v/",
    "weltanschaulicheAusrichtung": "unabhängig",
    "finanzen": {
      "bezugsjahr": 2018,
      "gesamtEinnahmen": "14.077.441,33 EUR",
      "anteilKosten": "vertretbar"
    },
    "volltext": "Arbeitsschwerpunkte\nBehindertenhilfe, Bildungs- und Kampagnenarbeit, Corona-Hilfe, Entwicklungszusammenarbeit, Gesundheitshilfe\nLänderschwerpunkte\nAfghanistan, Äthiopien, Bhutan, Bolivien, Brasilien, Indien, Jemen, Kolumbien, Liberia, Myanmar, Nepal, Nigeria, Pakistan, Paraguay, Senegal, Sierra Leone, Sudan, Südsudan, Tansania, Togo, Uganda\n… mehr\nTätigkeitsfelder\nDie DAHW Deutsche Lepra- und Tuberkulosehilfe fördert Projekte und Programme zur Bekämpfung von Lepra und Tuberkulose weltweit. Die räumlichen Arbeitsschwerpunkte liegen in Asien sowie in Afrika. Daneben werden auch Vorhaben in Südamerika sowie vereinzelt in Osteuropa gefördert. Die Hilfsmaßnahmen konzentrieren sich auf die Förderung von Leprakontrollprogrammen, von medizinischen Leistungen und Einrichtungen sowie von Projekten zur sozialen Rehabilitation der Leprapatienten. Darüber hinaus werden Maßnahmen der Gesundheitsaufklärung und Ausbildungszentren unterstützt. Zur Organisation und Betreuung der Projekte werden Regionalbüros unterhalten. Die Arbeit der Deutschen Lepra- und Tuberkulosehilfe, vor allem die Öffentlichkeitsarbeit, wird von über 250 „Aktionsgruppen“ in verschiedenen Städten der Bundesrepublik unterstützt.\nFinanzen\nBezugsjahr:\n2018\nGesamteinnahmen:\n14.077.441,33 EUR\nDavon Sammlungseinnahmen Hilfetext:\n6.823.563,11 EUR\nAnteil Werbe- und Verwaltungskosten Hilfetext:\nvertretbar\nEinschätzung durch das DZI Hilfetext\nDer DAHW Deutschen Lepra- und Tuberkulosehilfe e.V., Würzburg, wurde das DZI Spenden-Siegel zuerkannt. Der Verein ist förderungswürdig.\nDie sieben Spenden-Siegel-Standards erfüllt der Verein wie folgt:\n1.Die Organisation leistet satzungsgemäße Arbeit.\n2.Leitung und Aufsicht sind angemessen strukturiert, klar voneinander getrennt und werden wirksam wahrgenommen.\n3.Werbung und Öffentlichkeitsarbeit informieren klar, wahr, sachlich und offen.\n4.Der Anteil der Werbe- und Verwaltungsausgaben an den Gesamtausgaben ist nach DZI-Maßstab vertretbar („vertretbar“ = 20% bis 30%). Die Wirksamkeit des Mitteleinsatzes wird überprüft, und die Ergebnisse werden dokumentiert und veröffentlicht.\n5.Die von der Organisation gezahlten Vergütungen berücksichtigen den Status der Gemeinnützigkeit, die Qualifikation, das Maß an Verantwortung und den branchenüblichen Rahmen.\n6.Mittelbeschaffung und -verwendung sowie die Vermögenslage werden nachvollziehbar dokumentiert und angemessen geprüft.\n7.Die Organisation berichtet offen und umfassend über ihre Arbeit, Strukturen und Finanzen.\nTräger des DZI Spenden-Siegels seit 27.04.1993\nKontakt\nWebsite\nwww.dahw.de\nE-Mail\ninfo@dahw.de\nTelefon\n0931-79480\nFax\n0931-7948160\nAnschrift\nRaiffeisenstraße 3\n97080 Würzburg\nSpendenkonten\nIBAN: DE35790500000000009696\nBIC: BYLADEM1SWU\nSparkasse Mainfranken Würzburg\nAllgemeine Informationen\nGründungsjahr\n1957\nSitz der Organisation\nWürzburg\nRechtsform\nVerein\nWeltanschauliche Ausrichtung\nunabhängig\nOrganisation\nLeitungsorgan\nVorstand\nGeschäftsführung\nBurkard Kömm\nMitglieder/Gesellschafter\n83 stimmberechtigte Mitglieder\nAnzahl Mitarbeiter Hilfetext\nhauptamtlich: 63 ehrenamtlich: 10"
  },
  {
    "title": "Das Hunger Projekt e.V.",
    "url": "https://www.dzi.de/organisation/das-hunger-projekt-e-v/",
    "weltanschaulicheAusrichtung": "unabhängig",
    "finanzen": {
      "bezugsjahr": 2018,
      "gesamtEinnahmen": "668.157,62 EUR",
      "anteilKosten": "vertretbar"
    },
    "volltext": "Arbeitsschwerpunkte\nBildungs- und Kampagnenarbeit, Entwicklungszusammenarbeit, Frauenförderung, Menschenrechte\nLänderschwerpunkte\nÄthiopien, Bangladesch, Benin, Burkina Faso, Deutschland, Ghana, Indien, Malawi, Mexiko, Mosambik, Peru, Sambia, Senegal, Uganda\nTätigkeitsfelder\nDas Global Hunger Project setzt sich seit 1977 für die nachhaltige Überwindung des chronischen Hungers ein. Ziel hierbei ist es, Menschen zur Zusammenarbeit zu befähigen und aus eigener Kraft ihre Lebensbedingungen in den Bereichen Gesundheit, Ernährung, Einkommen und Ausbildung zu verbessern. Gleichzeitig bindet es einheimische Fach- und Führungskräfte aller Sektoren der Gesellschaft ein, um so ein unterstützendes gesellschaftspolitisches Umfeld für die lokalen Maßnahmen, Projekte und Kampagnen zu schaffen (Community-Led Development). Ein Schwerpunkt der Arbeit liegt im Empowerment der Frauen. Sie werden ausgebildet und dazu befähigt, in den lokalen demokratischen Gremien mitzuwirken, um so ihre zentrale Bedeutung im Entwicklungsprozess hervorzuheben und mitzugestalten. Mit Einkommen schaffenden Maßnahmen, Kleinkrediten, Alphabetisierungskursen, Gesundheitsvorsorge und vielen weiteren Programmen werden sie systematisch gestärkt. Neben dem Einsatz für die Gleichstellung von Frau und Mann legt das Hunger Projekt den Fokus auf die Förderung demokratischer Strukturen und politischer Mitsprache. Der deutsche Zweig des Hunger Projekts leistet darüber hinaus Bildungs- und Kampagnenarbeit (Globales Lernen).\nFinanzen\nBezugsjahr:\n2018\nGesamteinnahmen:\n668.157,62 EUR\nDavon Sammlungseinnahmen Hilfetext:\n245.589,86 EUR\nAnteil Werbe- und Verwaltungskosten Hilfetext:\nvertretbar\nEinschätzung durch das DZI Hilfetext\nDer Organisation Das Hunger Projekt e.V., Ravensburg, wurde das DZI Spenden-Siegel zuerkannt. Der Verein ist förderungswürdig.\nDie sieben Spenden-Siegel-Standards erfüllt der Verein wie folgt:\n1.Die Organisation leistet satzungsgemäße Arbeit.\n2.Leitung und Aufsicht sind angemessen strukturiert, klar voneinander getrennt und werden\nwirksam wahrgenommen.\n3.Werbung und Öffentlichkeitsarbeit informieren klar, wahr, sachlich und offen.\n4.Der Anteil der Werbe- und Verwaltungsausgaben an den Gesamtausgaben ist nach DZI-Maßstab vertretbar („vertretbar“ = 20% bis 30%). Die Wirksamkeit des Mitteleinsatzes wird überprüft, und die Ergebnisse werden dokumentiert und veröffentlicht.\n5.Die von der Organisation gezahlten Vergütungen berücksichtigen den Status der Gemeinnützigkeit, die Qualifikation, das Maß an Verantwortung und den branchenüblichen Rahmen.\n6.Mittelbeschaffung und -verwendung sowie die Vermögenslage werden nachvollziehbar dokumentiert und angemessen geprüft.\n7.Die Organisation berichtet offen und umfassend über ihre Arbeit, Strukturen und Finanzen.\nTräger des DZI Spenden-Siegels seit 27.01.2003\nKontakt\nWebsite\nwww.das-hunger-projekt.de\nE-Mail\ninfo@das-hunger-projekt.de\nTelefon\n089-21552420\nAnschrift\nRüdesheimer Straße 7\n80686 München\nSpendenkonten\nIBAN: DE10370501980000047571\nBIC: COLSDE33\nSparkasse KölnBonn\nAllgemeine Informationen\nGründungsjahr\n1983\nSitz der Organisation\nRavensburg\nRechtsform\nVerein\nWeltanschauliche Ausrichtung\nunabhängig\nOrganisation\nLeitungsorgan\nVorstand\nGeschäftsführung\nLeni Nebel (Landesdirektorin)\nMitglieder/Gesellschafter\n50 stimmberechtigte Mitglieder\nAnzahl Mitarbeiter Hilfetext\nhauptamtlich: 5 ehrenamtlich: 60"
  },
  {
    "title": "EIRENE Internationaler Christlicher Friedensdienst e.V.",
    "url": "https://www.dzi.de/organisation/eirene-internationaler-christlicher-friedensdienst-e-v/",
    "weltanschaulicheAusrichtung": "christlich",
    "finanzen": {
      "bezugsjahr": 2019,
      "gesamtEinnahmen": "6.899.966,54 EUR",
      "anteilKosten": "angemessen"
    },
    "volltext": "Arbeitsschwerpunkte\nBildung, Bildungs- und Kampagnenarbeit, Entwicklungszusammenarbeit, Frauenförderung, Menschenrechte, Völkerverständigung\nLänderschwerpunkte\nBelgien, Bolivien, Bosnien und Herzegowina, Burkina Faso, Burundi, Costa Rica, Demokratische Republik Kongo, Deutschland, Frankreich, Kanada, Mali, Marokko, Nicaragua, Niger, Nordirland, Ruanda, Rumänien, Uganda, USA\n… mehr\nTätigkeitsfelder\nEIRENE (griechisch für Frieden) entsendet Freiwillige in Projekte nach Afrika, Lateinamerika, West- und Osteuropa sowie in die USA und Kanada. Im Durchschnitt sind rund 30 Personen neben dem lokalen Personal in Entwicklungsprojekten und -programmen (Südprogramm: Afrika und Lateinamerika) sowie etwa 50 Freiwillige im Friedens- und Sozialdienst (Nord- und Ostprogramm: USA, Kanada und Europa) tätig. In Deutschland leistet EIRENE Informations- und Bildungsarbeit und fördert den Austausch und die Verständigung zwischen den Ländern und Kulturen. Das Südprogramm des Vereins umfasst die Förderung von Entwicklungs- und Kleinprojekten insbesondere im Niger, der DR Kongo sowie in Nicaragua und Costa Rica. Im Rahmen dieses Programms bietet der Verein fachlich Qualifizierten die Möglichkeit, in einem Projekt Entwicklungsdienst zu leisten. Das Nord- und Ostprogramm soll zur Verwirklichung der Menschenrechte und zur Versöhnung in Kriegsgebieten beitragen und Solidarität mit an den gesellschaftlichen Rand gedrängten Menschen ausdrücken (u.a. Obdachlose, Behinderte, psychisch kranke Menschen, Arbeitslose). Im Rahmen des Ostprogramms vermittelt EIRENE Freiwillige in Projekte nach Bosnien-Herzegowina und Rumänien. Sie tragen dort zum Aufbau der Zivilgesellschaften bei und arbeiten mit Straßenkindern, diskriminierten Minderheiten oder Jugendlichen zusammen.\nFinanzen\nBezugsjahr:\n2019\nGesamteinnahmen:\n6.899.966,54 EUR\nDavon Sammlungseinnahmen Hilfetext:\n854.146,24 EUR\nAnteil Werbe- und Verwaltungskosten Hilfetext:\nangemessen\nEinschätzung durch das DZI Hilfetext\nEIRENE Internationaler Christlicher Friedensdienst e.V., Neuwied, wurde das DZI Spenden-Siegel zuerkannt. Der Verein ist förderungswürdig.\nDie sieben Spenden-Siegel-Standards erfüllt der Verein wie folgt:\n1.Die Organisation leistet satzungsgemäße Arbeit.\n2.Leitung und Aufsicht sind angemessen strukturiert, klar voneinander getrennt und werden wirksam wahrgenommen.\n3.Werbung und Öffentlichkeitsarbeit informieren klar, wahr, sachlich und offen.\n4.Der Anteil der Werbe- und Verwaltungsausgaben an den Gesamtausgaben ist nach DZI-Maßstab angemessen („angemessen“ = 10% bis unter 20%). Die Wirksamkeit des Mitteleinsatzes wird überprüft, und die Ergebnisse werden dokumentiert und veröffentlicht.\n5.Die von der Organisation gezahlten Vergütungen berücksichtigen den Status der Gemeinnützigkeit, die Qualifikation, das Maß an Verantwortung und den branchenüblichen Rahmen.\n6.Mittelbeschaffung und -verwendung sowie die Vermögenslage werden nachvollziehbar dokumentiert und angemessen geprüft.\n7.Die Organisation berichtet offen und umfassend über ihre Arbeit, Strukturen und Finanzen.\nTräger des DZI Spenden-Siegels seit 12.05.1995\nKontakt\nWebsite\nwww.eirene.org\nE-Mail\neirene-int@eirene.org\nTelefon\n02631-83790\nFax\n02631-837990\nAnschrift\nEngerser Straße 81\n56564 Neuwied\nSpendenkonten\nIBAN: DE16350601901011380014\nBIC: GENODED1DKD\nBank für Kirche und Diakonie - KD-Bank\nAllgemeine Informationen\nGründungsjahr\n1957\nSitz der Organisation\nNeuwied\nRechtsform\nVerein\nWeltanschauliche Ausrichtung\nchristlich\nOrganisation\nLeitungsorgan\nVorstand\nGeschäftsführung\nDr. Anthea Bethge\nMitglieder/Gesellschafter\n302 stimmberechtigte Mitglieder\nAnzahl Mitarbeiter Hilfetext\nhauptamtlich: 71 ehrenamtlich: 120"
  },
  {
    "title": "Elternverein für leukämie- und krebskranke Kinder, Gießen e.V.",
    "url": "https://www.dzi.de/organisation/elternverein-fuer-leukaemie-und-krebskranke-kinder-giessen-e-v/",
    "weltanschaulicheAusrichtung": "unabhängig",
    "finanzen": {
      "bezugsjahr": 2018,
      "gesamtEinnahmen": "868.911,40 EUR",
      "anteilKosten": "angemessen"
    },
    "volltext": "Arbeitsschwerpunkte\nEinzelfallhilfe, Familienfürsorge, Forschung, Gesundheitshilfe, Kinder- und Jugendhilfe\nLänderschwerpunkte\nDeutschland\nTätigkeitsfelder\nDer Verein betreut Kinder und Jugendliche, die an Leukämie oder Krebs erkrankt sind, sowie deren Eltern. Dazu fördert er die Station Peiper der Universitätskinderklinik Gießen und Marburg, Standort Gießen, und hilft auf der nach dem Leipziger Kinderarzt Prof. Dr. med. Albrecht Peiper (1889-1969) benannten Kinderkrebsstation, die Behandlung und Betreuung unter anderem durch die Finanzierung von Personalstellen zu verbessern und die Station kindgerecht zu gestalten. Zudem unterstützt er das Familienzentrum für krebskranke Kinder Gießen e.V., das den betroffenen Familien während der stationären Behandlungsphase ein vorübergehendes Zuhause in der Nähe ihrer Kinder bietet. Darüber hinaus finanziert der Verein einen Ambulanzdienst, der die Kinder und Eltern zu Hause betreut, und gewährt auf Antrag finanzielle Hilfen für durch die Krankheit in Not geratene Familien. Ein weiterer Schwerpunkt ist die Förderung der angewandten Forschung auf dem Gebiet der Leukämieerkrankung von Kindern und Jugendlichen.\nFinanzen\nBezugsjahr:\n2018\nGesamteinnahmen:\n868.911,40 EUR\nDavon Sammlungseinnahmen Hilfetext:\n833.956,43 EUR\nAnteil Werbe- und Verwaltungskosten Hilfetext:\nangemessen\nEinschätzung durch das DZI Hilfetext\nDem Elternverein für leukämie- und krebskranke Kinder, Gießen e.V., Gießen, wurde das DZI Spenden-Siegel zuerkannt. Der Verein ist förderungswürdig.\nDie sieben Spenden-Siegel-Standards erfüllt der Verein wie folgt:\n1.Die Organisation leistet satzungsgemäße Arbeit.\n2.Leitung und Aufsicht sind angemessen strukturiert, klar voneinander getrennt und werden wirksam wahrgenommen.\n3.Werbung und Öffentlichkeitsarbeit informieren klar, wahr, sachlich und offen.\n4.Der Anteil der Werbe- und Verwaltungsausgaben an den Gesamtausgaben ist nach DZI-Maßstab angemessen („angemessen“ = 10% bis unter 20%). Die Wirksamkeit des Mitteleinsatzes wird überprüft, und die Ergebnisse werden dokumentiert und veröffentlicht.\n5.Die von der Organisation gezahlten Vergütungen berücksichtigen den Status der Gemeinnützigkeit, die Qualifikation, das Maß an Verantwortung und den branchenüblichen Rahmen.\n6.Mittelbeschaffung und -verwendung sowie die Vermögenslage werden nachvollziehbar dokumentiert und angemessen geprüft.\n7.Die Organisation berichtet offen und umfassend über ihre Arbeit, Strukturen und Finanzen.\nTräger des DZI Spenden-Siegels seit 11.05.1995\nKontakt\nWebsite\nwww.krebskrankekinder-giessen.de\nE-Mail\nkrebskranke-kinder-giessen@t-online.de\nTelefon\n06172-74341\nFax\n06172-777935\nAnschrift\nAm Houiller Platz 15\n61381 Friedrichsdorf\nSpendenkonten\nIBAN: DE09513900000000019119\nBIC: VBMHDE5F\nVolksbank Mittelhessen\nAllgemeine Informationen\nGründungsjahr\n1982\nSitz der Organisation\nGießen\nRechtsform\nVerein\nWeltanschauliche Ausrichtung\nunabhängig\nOrganisation\nLeitungsorgan\nVorstand\nMitglieder/Gesellschafter\n440 stimmberechtigte Mitglieder\nAnzahl Mitarbeiter Hilfetext\nhauptamtlich: 8 ehrenamtlich: 20"
  },
  {
    "title": "Fidesco e.V.",
    "url": "https://www.dzi.de/organisation/fidesco-e-v/",
    "weltanschaulicheAusrichtung": "katholisch",
    "finanzen": {
      "bezugsjahr": 2019,
      "gesamtEinnahmen": "170.353,22 EUR",
      "anteilKosten": "angemessen"
    },
    "volltext": "Arbeitsschwerpunkte\nBildung, Bildungs- und Kampagnenarbeit, Entwicklungszusammenarbeit, Frauenförderung, Gesundheitshilfe, Kinder- und Jugendhilfe, Religion\nLänderschwerpunkte\nBrasilien, Demokratische Republik Kongo, Deutschland, Guinea, Haiti, Kambodscha, Kolumbien, Madagaskar, Ruanda, Südafrika, Timor-Leste\nTätigkeitsfelder\nBei dem Verein handelt es sich um den deutschen Zweig der im Jahr 1981 von der katholischen Gemeinschaft Emmanuel gegründeten Missions- und Entwicklungshilfeorganisation Fidesco International. Sie leistet in erster Linie Entwicklungshilfe in den Bereichen Sozialarbeit, Bildungs- und Gesundheitswesen, Verwaltung, Handwerk sowie landwirtschaftliche Entwicklung. Einen weiteren Schwerpunkt bilden die Missionsarbeit und der hiermit verbundene Nord-Süd-Austausch von gut ausgebildeten Volontären. Die Fachkräfte werden vor ihrer Entsendung in die ein- bis zweijährige Missionsarbeit von der Organisation auf ihre Einsätze vorbereitet. Sie arbeiten nach dem Grundsatz der „Hilfe zur Selbsthilfe“ eng mit den lokalen Mitarbeitern in den Projekten zusammen und fördern so die Anstrengungen der Betroffenen, ihre Lebensumstände aus eigener Kraft zu verbessern. Neben der Anwerbung, Betreuung und finanziellen Unterstützung von Volontären in Deutschland liegt der Schwerpunkt der Vereinsarbeit insbesondere in der Förderung eines Straßenkinderzentrums in Ruanda, eines Gesundheitszentrums mit Geburtsklinik in Guinea sowie einer Berufsschule in Haiti. In Deutschland betreibt die Organisation Bildungs- und Informationsarbeit beispielsweise durch Veranstaltungen und Vorträge an Schulen und fördert zudem kulturelle Austauschprojekte.\nFinanzen\nBezugsjahr:\n2019\nGesamteinnahmen:\n170.353,22 EUR\nDavon Sammlungseinnahmen Hilfetext:\n121.674,55 EUR\nAnteil Werbe- und Verwaltungskosten Hilfetext:\nangemessen\nEinschätzung durch das DZI Hilfetext\nFidesco e.V., Altötting, wurde das DZI Spenden-Siegel zuerkannt. Der Verein ist förderungswürdig.\nDie sieben Spenden-Siegel-Standards erfüllt der Verein wie folgt:\n1.Die Organisation leistet satzungsgemäße Arbeit.\n2.Leitung und Aufsicht sind angemessen strukturiert, klar voneinander getrennt und werden wirksam wahrgenommen.\n3.Werbung und Öffentlichkeitsarbeit informieren klar, wahr, sachlich und offen.\n4.Der Anteil der Werbe- und Verwaltungsausgaben an den Gesamtausgaben ist nach DZI-Maßstab angemessen („angemessen“ = 10% bis unter 20%). Die Wirksamkeit des Mitteleinsatzes wird überprüft, und die Ergebnisse werden dokumentiert und veröffentlicht.\n5.Die von der Organisation gezahlten Vergütungen berücksichtigen den Status der Gemeinnützigkeit, die Qualifikation, das Maß an Verantwortung und den branchenüblichen Rahmen.\n6.Mittelbeschaffung und -verwendung sowie die Vermögenslage werden nachvollziehbar dokumentiert und angemessen geprüft.\n7.Die Organisation berichtet offen und umfassend über ihre Arbeit, Strukturen und Finanzen.\nTräger des DZI Spenden-Siegels seit 03.05.2013\nKontakt\nWebsite\nwww.fidesco.de\nwww.fidesco-international.org/de\nE-Mail\ninfo@fidesco.de\nTelefon\n0931-40480080\nAnschrift\nBinsenstraße 36\n97297 Waldbüttelbrunn\nSpendenkonten\nIBAN: DE60550205000008632100\nBIC: BFSWDE33MNZ\nBank für Sozialwirtschaft\nAllgemeine Informationen\nGründungsjahr\n1987\nSitz der Organisation\nAltötting\nRechtsform\nVerein\nWeltanschauliche Ausrichtung\nkatholisch\nOrganisation\nLeitungsorgan\nVorstand\nGeschäftsführung\nKarel Dekempe\nMitglieder/Gesellschafter\n10 stimmberechtigte Mitglieder\nAnzahl Mitarbeiter Hilfetext\nhauptamtlich: 3 ehrenamtlich: 21"
  },
  {
    "title": "Flughafenverein München e.V.",
    "url": "https://www.dzi.de/organisation/flughafenverein-muenchen-e-v/",
    "weltanschaulicheAusrichtung": "christlich",
    "finanzen": {
      "bezugsjahr": 2018,
      "gesamtEinnahmen": "162.916,78 EUR",
      "anteilKosten": "angemessen"
    },
    "volltext": "Arbeitsschwerpunkte\nAltenhilfe, Behindertenhilfe, Bildung, Corona-Hilfe, Einzelfallhilfe, Flüchtlingsfürsorge, Katastrophenhilfe, Kinder- und Jugendhilfe, Rettungswesen\nLänderschwerpunkte\nDeutschland\nTätigkeitsfelder\nDer Flughafenverein München e.V. unterstützt auf vielfältige Weise Menschen in Not. Meist handelt es sich um individuelle Hilfen, etwa bei Schicksalsschlägen. Der Schwerpunkt der Aktivitäten liegt in der Region um den Flughafen München. Die Organisation engagiert sich aber auch bei Not- und Katastrophenfällen im Ausland. Hinzu kommen bisweilen Hilfsgüter-Transporte ins Ausland. Voraussetzung für Hilfe sind eine konkrete Notsituation und die Bedürftigkeit der Betroffenen. Dies wird im Vorfeld vom Verein geprüft, gegebenenfalls in Kooperation mit anderen Stellen, etwa Ämtern oder Konsulaten. Bei Unterstützungsleistungen für Mitarbeiter der Flughafen München GmbH oder ihrer Tochtergesellschaften erfolgen zum Teil Abstimmungen mit Betriebsräten oder dem Sozialdienst.\nFinanzen\nBezugsjahr:\n2018\nGesamteinnahmen:\n162.916,78 EUR\nDavon Sammlungseinnahmen Hilfetext:\n162.916,78 EUR\nAnteil Werbe- und Verwaltungskosten Hilfetext:\nangemessen\nEinschätzung durch das DZI Hilfetext\nDem Flughafenverein München e.V., Freising, wurde das DZI Spenden-Siegel zuerkannt. Der Verein ist förderungswürdig.\nDie sieben Spenden-Siegel-Standards erfüllt der Verein wie folgt:\n1.Die Organisation leistet satzungsgemäße Arbeit.\n2.Leitung und Aufsicht sind angemessen strukturiert, klar voneinander getrennt und werden wirksam wahrgenommen.\n3.Werbung und Öffentlichkeitsarbeit informieren klar, wahr, sachlich und offen.\n4.Der Anteil der Werbe- und Verwaltungsausgaben an den Gesamtausgaben ist nach DZI-Maßstab angemessen („angemessen“ = 10% bis unter 20%). Die Wirksamkeit des Mitteleinsatzes wird überprüft, und die Ergebnisse werden dokumentiert und veröffentlicht.\n5.Vergütungen (trifft nicht zu)\n6.Mittelbeschaffung und -verwendung sowie die Vermögenslage werden nachvollziehbar dokumentiert und angemessen geprüft.\n7.Die Organisation berichtet offen und umfassend über ihre Arbeit, Strukturen und Finanzen.\nTräger des DZI Spenden-Siegels seit 19.05.2016\nKontakt\nWebsite\nwww.flughafenverein.de\nE-Mail\ninfo@flughafenverein.de\nTelefon\n089-97564200\nFax\n089-97564206\nAnschrift\nTerminalstraße Mitte 18\n85356 Flughafen München\nSpendenkonten\nIBAN: DE12700519950000966333\nBIC: BYLADEM1ERD\nSparkasse Erding-Dorfen\nAllgemeine Informationen\nGründungsjahr\n1996\nSitz der Organisation\nFreising\nRechtsform\nVerein\nWeltanschauliche Ausrichtung\nchristlich\nOrganisation\nLeitungsorgan\nVorstand\nMitglieder/Gesellschafter\n565 stimmberechtigte Mitglieder\nAnzahl Mitarbeiter Hilfetext\nehrenamtlich: 4"
  },
  {
    "title": "Gegen NOMA – PARMED e.V.",
    "url": "https://www.dzi.de/organisation/gegen-noma-parmed-e-v/",
    "weltanschaulicheAusrichtung": "unabhängig",
    "finanzen": {
      "bezugsjahr": 2018,
      "gesamtEinnahmen": "475.522,53 EUR",
      "anteilKosten": "angemessen"
    },
    "volltext": "Arbeitsschwerpunkte\nBildungs- und Kampagnenarbeit, Entwicklungszusammenarbeit, Gesundheitshilfe, Kinder- und Jugendhilfe\nLänderschwerpunkte\nBurkina Faso, Deutschland\nTätigkeitsfelder\nGegen NOMA - PARMED e.V. setzt sich für die nachhaltige Bekämpfung der Kinderkrankheit Noma in Burkina Faso ein. Der Schwerpunkt liegt in der Umsetzung von Präventionsprogrammen in Partnerschaft mit dem burkinischen Gesundheitsministerium. Hierzu wurden zunächst in allen 650 Dörfern der Sahel-Region ca. 1.500 einheimische Gesundheitsagenten bzw. traditionelle Heiler sowie Pressevertreter und Mitglieder lokaler Vereine für die Prävention, Frühdiagnose und adäquate Behandlung der Krankheit ausgebildet. Anschließend wurden mehrere hunderttausend Einwohner der Region durch eine breit angelegte Sensibilisierungskampagne in den verschiedenen Landessprachen über die Krankheit Noma und allgemeine Hygiene, Mund- und Zahnhygiene sowie Mangelernährung aufgeklärt. Neben der Sensibilisierungs- und Aufklärungsarbeit hat Gegen Noma gemeinsam mit verschiedenen Akteuren auf nationaler und regionaler Ebene die Einrichtung eines gemeindebasierten, elektronischen Forschungs- und Überwachungssystems initiiert. Dies soll dem Verein und allen Ebenen des Gesundheitssystems in der Sahel-Region eine verbesserte Überwachung von Noma und anderen Mund- und Gesichtskrankheiten ermöglichen. Dazu gehört die Entwicklung einer mobilen App, um durch die Nutzung von Mobiltelefonen Informationen zu übertragen und zu verbreiten sowie Daten zu Noma-Fällen und anderen Krankheiten systematisch zu sammeln und zu überwachen. Gegen Noma plant, seine Aktivitäten in der Sahel-Region auf andere Regionen Burkina Fasos auszuweiten und die Kapazitäten von Gesundheitspersonal in der Prävention, Pflege und Überwachung von Noma und weiteren Mund- und Gesichtskrankheiten auf nationaler Ebene zu stärken. Verantwortlich für die Koordination der Programme vor Ort ist ein von Gegen Noma zusammengestelltes und gesteuertes Projektteam des Projektpartners RESEAU in Ouagadougou. Weiterhin unterstützt der Verein mehrere Gesundheitsstationen sowie eine Universität in Burkina Faso (Medizin-Stipendien) und kümmert sich seit 2016 auch um die Koordination bzw. die medizinische Versorgung von akuten Noma-Fällen.\nFinanzen\nBezugsjahr:\n2018\nGesamteinnahmen:\n475.522,53 EUR\nDavon Sammlungseinnahmen Hilfetext:\n198.234,53 EUR\nAnteil Werbe- und Verwaltungskosten Hilfetext:\nangemessen\nEinschätzung durch das DZI Hilfetext\nGegen NOMA - PARMED e.V., Kempten (Allgäu), wurde das DZI Spenden-Siegel zuerkannt. Der Verein ist förderungswürdig.\nDie sieben Spenden-Siegel-Standards erfüllt der Verein wie folgt:\n1.Die Organisation leistet satzungsgemäße Arbeit.\n2.Leitung und Aufsicht sind angemessen strukturiert, klar voneinander getrennt und werden wirksam wahrgenommen.\n3.Werbung und Öffentlichkeitsarbeit informieren klar, wahr, sachlich und offen.\n4.Der Anteil der Werbe- und Verwaltungsausgaben an den Gesamtausgaben ist nach DZI-Maßstab angemessen („angemessen“ = 10% bis unter 20%). Die Wirksamkeit des Mitteleinsatzes wird überprüft, und die Ergebnisse werden dokumentiert und veröffentlicht.\n5.Vergütungen (trifft nicht zu).\n6.Mittelbeschaffung und -verwendung sowie die Vermögenslage werden nachvollziehbar dokumentiert und angemessen geprüft.\n7.Die Organisation berichtet offen und umfassend über ihre Arbeit, Strukturen und Finanzen.\nTräger des DZI Spenden-Siegels seit 08.08.2013\nKontakt\nWebsite\nwww.gegen-noma.de\nE-Mail\ninfo@gegen-noma.de\nTelefon\n0831-2539358\nFax\n0831-2539378\nAnschrift\nOberstdorfer Straße 7\n87435 Kempten (Allgäu)\nSpendenkonten\nIBAN: DE96510800600013944001\nBIC: DRESDEFF510\nCommerzbank\nAllgemeine Informationen\nGründungsjahr\n2008\nSitz der Organisation\nKempten (Allgäu)\nRechtsform\nVerein\nWeltanschauliche Ausrichtung\nunabhängig\nOrganisation\nLeitungsorgan\nVorstand\nMitglieder/Gesellschafter\n23 stimmberechtigte Mitglieder\nAnzahl Mitarbeiter Hilfetext\nehrenamtlich: 35"
  },
  {
    "title": "Gemeinschaft Sant´Egidio e.V.",
    "url": "https://www.dzi.de/organisation/gemeinschaft-santegidio-e-v/",
    "weltanschaulicheAusrichtung": "katholisch",
    "finanzen": {
      "bezugsjahr": 2018,
      "gesamtEinnahmen": "2.826.158,21 EUR",
      "anteilKosten": "niedrig"
    },
    "volltext": "Arbeitsschwerpunkte\nAids, Altenhilfe, Behindertenhilfe, Bildung, Entwicklungszusammenarbeit, Familienfürsorge, Flüchtlingsfürsorge, Gesundheitshilfe, Katastrophenhilfe, Kinder- und Jugendhilfe, Kinderpatenschaft, Menschenrechte, Religion, Völkerverständigung\nLänderschwerpunkte\nBurkina Faso, Demokratische Republik Kongo, Deutschland, Guinea, Kenia, Malawi, Mosambik, Senegal, Südsudan, Tansania, Uganda, Zentralafrikanische Republik\nTätigkeitsfelder\nBei der Gemeinschaft Sant´Egidio e.V. handelt es sich um den deutschen Zweig der im Jahr 1968 in Rom gegründeten Comunitá di Sant´Egidio. Nationale Organisationen bestehen weltweit in mehr als 70 Ländern. Die Gemeinschaft versteht sich als eine Laienbewegung mit rund 60.000 Mitgliedern, die sich für die Weitergabe des Evangeliums und die Solidarität mit den Armen einsetzen. Im Mittelpunkt der Arbeit der Gemeinschaft stehen das Gebet und die Weitergabe des Evangeliums. Weitere Anliegen der Gemeinschaft sind der Dienst an den Armen, das Engagement für Frieden und Menschenrechte sowie die Bekämpfung von HIV/AIDS in Afrika. So unterhält der deutsche Verein beispielsweise eine Mensa für Obdachlose und arme Menschen sowie „Schulen des Friedens“, in der Kinder Hilfe bei schulischen Schwierigkeiten und familiären Sorgen erhalten und Eltern in ihren Erziehungsaufgaben unterstützt werden. Ein finanzieller Schwerpunkt der Vereinsarbeit liegt in der Unterstützung des Programms DREAM 2.0 (Disease Relief through Excellent and Advanced Means), dessen Ziel es ist, AIDS sowie weitere Krankheiten wie beispielsweise Herz-Kreislauf-Erkrankungen und Diabetes in Afrika zu bekämpfen. Darüber hinaus unterstützt die Gemeinschaft Sant’Egidio e.V. melderechtliche Registrierungen von Kindern und Erwachsenen vor allem in Burkina Faso und Mosambik und trägt so zur Stärkung der Menschenrechte bei (Programm BRAVO! Birth Registration for All Versus Oblivion).\nFinanzen\nBezugsjahr:\n2018\nGesamteinnahmen:\n2.826.158,21 EUR\nDavon Sammlungseinnahmen Hilfetext:\n541.501,45 EUR\nAnteil Werbe- und Verwaltungskosten Hilfetext:\nniedrig\nEinschätzung durch das DZI Hilfetext\nDer Gemeinschaft Sant´Egidio e.V., Würzburg, wurde das DZI Spenden-Siegel zuerkannt. Der Verein ist förderungswürdig.\nDie sieben Spenden-Siegel-Standards erfüllt der Verein wie folgt:\n1.Die Organisation leistet satzungsgemäße Arbeit.\n2.Leitung und Aufsicht sind angemessen strukturiert, klar voneinander getrennt und werden wirksam wahrgenommen.\n3.Werbung und Öffentlichkeitsarbeit informieren klar, wahr, sachlich und offen.\n4.Der Anteil der Werbe- und Verwaltungsausgaben an den Gesamtausgaben ist nach DZI-Maßstab niedrig („niedrig“ = unter 10%). Die Wirksamkeit des Mitteleinsatzes wird überprüft, und die Ergebnisse werden dokumentiert und veröffentlicht.\n5.Die von der Organisation gezahlten Vergütungen berücksichtigen den Status der Gemeinnützigkeit, die Qualifikation, das Maß an Verantwortung und den branchenüblichen Rahmen.\n6.Mittelbeschaffung und -verwendung sowie die Vermögenslage werden nachvollziehbar dokumentiert und angemessen geprüft.\n7.Die Organisation berichtet offen und umfassend über ihre Arbeit, Strukturen und Finanzen.\nTräger des DZI Spenden-Siegels seit 23.04.2009\nKontakt\nWebsite\nwww.santegidio.de\nE-Mail\ninfo@santegidio.de\nTelefon\n0931-322940\nFax\n0931-3229439\nAnschrift\nSchönthalstraße 6\n97070 Würzburg\nSpendenkonten\nIBAN: DE71750903000003029999\nBIC: GENODEF1M05\nLIGA Bank\nAllgemeine Informationen\nGründungsjahr\n1984\nSitz der Organisation\nWürzburg\nRechtsform\nVerein\nWeltanschauliche Ausrichtung\nkatholisch\nOrganisation\nLeitungsorgan\nVorstand\nMitglieder/Gesellschafter\n32 stimmberechtigte Mitglieder\nAnzahl Mitarbeiter Hilfetext\nhauptamtlich: 6 ehrenamtlich: 5000"
  },
  {
    "title": "HAMMER FORUM Medical Aid for Children e.V.",
    "url": "https://www.dzi.de/organisation/hammer-forum-medical-aid-for-children-e-v/",
    "weltanschaulicheAusrichtung": "unabhängig",
    "finanzen": {
      "bezugsjahr": 2018,
      "gesamtEinnahmen": "953.592,41 EUR",
      "anteilKosten": "vertretbar"
    },
    "volltext": "Arbeitsschwerpunkte\nBildung, Entwicklungszusammenarbeit, Gesundheitshilfe, Kinder- und Jugendhilfe\nLänderschwerpunkte\nBurkina Faso, Demokratische Republik Kongo, Eritrea, Griechenland, Guinea, Guinea-Bissau, Jemen, Palästinensische Gebiete, Somalia, Tansania\nTätigkeitsfelder\nDer Verein leistet medizinische Hilfe für erkrankte und verletzte Kinder in Krisengebieten und unterstützt dort den Auf- und Ausbau von Gesundheitseinrichtungen. Qualifizierte Fachärzte fliegen zusammen mit ihren Teams in Krisengebiete und untersuchen, behandeln und operieren Kinder vor Ort in ehrenamtlicher Tätigkeit. Sie leiten einheimische Ärzte und Pflegerinnen in den Einsatzländern bei Operationen, der Nachsorge und Pflege an. Kinder, die nicht vor Ort behandelt werden können, werden nach Deutschland oder Österreich ausgeflogen und nach einer Genesungsphase in ihr Heimatland zurückgeführt.\nFinanzen\nBezugsjahr:\n2018\nGesamteinnahmen:\n953.592,41 EUR\nDavon Sammlungseinnahmen Hilfetext:\n738.291,43 EUR\nAnteil Werbe- und Verwaltungskosten Hilfetext:\nvertretbar\nEinschätzung durch das DZI Hilfetext\nHAMMER FORUM e.V. Medizinische Hilfe für Kinder in Krisengebieten, Hamm, wurde das DZI Spenden-Siegel zuerkannt. Der Verein ist förderungswürdig.\nDie sieben Spenden-Siegel-Standards erfüllt der Verein wie folgt:\n1.Die Organisation leistet satzungsgemäße Arbeit.\n2.Leitung und Aufsicht sind angemessen strukturiert, klar voneinander getrennt und werden wirksam wahrgenommen.\n3.Werbung und Öffentlichkeitsarbeit informieren klar, wahr, sachlich und offen.\n4.Der Anteil der Werbe- und Verwaltungsausgaben an den Gesamtausgaben ist nach DZI-Maßstab vertretbar („vertretbar“ = 20% bis 30%). Die Wirksamkeit des Mitteleinsatzes wird überprüft, und die Ergebnisse werden dokumentiert und veröffentlicht.\n5.Die von der Organisation gezahlten Vergütungen berücksichtigen den Status der Gemeinnützigkeit, die Qualifikation, das Maß an Verantwortung und den branchenüblichen Rahmen.\n6.Mittelbeschaffung und -verwendung sowie die Vermögenslage werden nachvollziehbar dokumentiert und angemessen geprüft.\n7.Die Organisation berichtet offen und umfassend über ihre Arbeit, Strukturen und Finanzen.\nTräger des DZI Spenden-Siegels seit 16.12.2010\nKontakt\nWebsite\nwww.hammer-forum.de\nE-Mail\ninfo@hammer-forum.de\nTelefon\n02381-871720\nFax\n02381-8717219\nAnschrift\nCaldenhofer Weg 118\n59063 Hamm\nSpendenkonten\nIBAN: DE33410500950004070181\nBIC: WELADED1HAM\nSparkasse Hamm\nAllgemeine Informationen\nGründungsjahr\n1991\nSitz der Organisation\nHamm\nRechtsform\nVerein\nWeltanschauliche Ausrichtung\nunabhängig\nOrganisation\nLeitungsorgan\nVorstand\nMitglieder/Gesellschafter\n110 stimmberechtigte Mitglieder\nAnzahl Mitarbeiter Hilfetext\nhauptamtlich: 7 ehrenamtlich: 60"
  },
  {
    "title": "Hans-Rosenthal-Stiftung – Schnelle Hilfe in akuter Not – e.V.",
    "url": "https://www.dzi.de/organisation/hans-rosenthal-stiftung-schnelle-hilfe-in-akuter-not-e-v/",
    "weltanschaulicheAusrichtung": "unabhängig",
    "finanzen": {
      "bezugsjahr": 2018,
      "gesamtEinnahmen": "1.942.311,76 EUR",
      "anteilKosten": "angemessen"
    },
    "volltext": "Arbeitsschwerpunkte\nBehindertenhilfe, Einzelfallhilfe, Familienfürsorge, Gesundheitshilfe, Kinder- und Jugendhilfe\nLänderschwerpunkte\nDeutschland, Österreich, Schweiz\nTätigkeitsfelder\nDer Verein leistet Einzelfallhilfe für Familien und Einzelpersonen, die unverschuldet in Not geraten sind, ihre Bedürftigkeit nicht durch zumutbare Eigenanstrengungen beheben und die eine baldige finanzielle Hilfe von anderer Seite nicht erwarten können. Er setzt damit die Tätigkeit der Aktion „Dalli-Dalli-hilft“ fort, die Hans Rosenthal in seiner Fernsehsendung ins Leben rief.\nFinanzen\nBezugsjahr:\n2018\nGesamteinnahmen:\n1.942.311,76 EUR\nDavon Sammlungseinnahmen Hilfetext:\n1.865.211,04 EUR\nAnteil Werbe- und Verwaltungskosten Hilfetext:\nangemessen\nEinschätzung durch das DZI Hilfetext\nDer Hans-Rosenthal-Stiftung – Schnelle Hilfe in akuter Not – e.V., Berlin, wurde das DZI Spenden-Siegel zuerkannt. Der Verein ist förderungswürdig.\nDie sieben Spenden-Siegel-Standards erfüllt der Verein wie folgt:\n1.Die Organisation leistet satzungsgemäße Arbeit.\n2.Leitung und Aufsicht sind hinreichend angemessen strukturiert, klar voneinander getrennt und werden wirksam wahrgenommen.\n3.Werbung und Öffentlichkeitsarbeit informieren klar, wahr, sachlich und offen.\n4.Der Anteil der Werbe- und Verwaltungsausgaben an den Gesamtausgaben ist nach DZI-Maßstab angemessen („angemessen“ = 10% bis unter 20%). Die Wirksamkeit des Mitteleinsatzes wird überprüft, und die Ergebnisse werden dokumentiert und veröffentlicht.\n5.Die von der Organisation gezahlten Vergütungen berücksichtigen den Status der Gemeinnützigkeit, die Qualifikation, das Maß an Verantwortung und den branchenüblichen Rahmen.\n6.Mittelbeschaffung und -verwendung sowie die Vermögenslage werden nachvollziehbar dokumentiert und angemessen geprüft.\n7.Die Organisation berichtet offen und umfassend über ihre Arbeit, Strukturen und Finanzen.\nTräger des DZI Spenden-Siegels seit 28.10.2003\nKontakt\nWebsite\nwww.hans-rosenthal-stiftung.de\nE-Mail\nhans-rosenthal-stiftung@t-online.de\nTelefon\n030-7724355\nFax\n030-7724451\nAnschrift\nPostfach 45 04 04\n12174 Berlin\nSpendenkonten\nIBAN: DE28100708480150420800\nBIC: DEUTDEDB110\nBerliner Bank Niederlassung der Deutsche Bank PGK\nAllgemeine Informationen\nGründungsjahr\n1987\nSitz der Organisation\nBerlin\nRechtsform\nVerein\nWeltanschauliche Ausrichtung\nunabhängig\nOrganisation\nLeitungsorgan\nVorstand\nMitglieder/Gesellschafter\n7 stimmberechtigte Mitglieder\nAnzahl Mitarbeiter Hilfetext\nhauptamtlich: 1"
  },
  {
    "title": "Indienhilfe e.V.",
    "url": "https://www.dzi.de/organisation/indienhilfe-e-v/",
    "weltanschaulicheAusrichtung": "unabhängig",
    "finanzen": {
      "bezugsjahr": 2018,
      "gesamtEinnahmen": "519.143,56 EUR",
      "anteilKosten": "niedrig"
    },
    "volltext": "Arbeitsschwerpunkte\nBildung, Bildungs- und Kampagnenarbeit, Entwicklungszusammenarbeit, Gesundheitshilfe, Kinder- und Jugendhilfe, Menschenrechte, Völkerverständigung\nLänderschwerpunkte\nDeutschland, Indien\nTätigkeitsfelder\nZiel der Projektarbeit der Indienhilfe e.V. ist die Verbesserung der Lebensbedingungen von Kindern und Jugendlichen aus armen und benachteiligten Familien in ländlichen Gebieten Westbengalens sowie in Slums in Kalkutta in den Bereichen Bildung, Gesundheit, Ernährung und Recht. Schwerpunkt der Vereinsaktivitäten ist der Kampf gegen Kinderarbeit. Bei der Durchführung der Fördermaßnahmen arbeitet die Indienhilfe e.V. mit ortsansässigen Nichtregierungsorganisationen zusammen. Darüber hinaus setzt sich die Organisation für politische Teilhabe der geförderten Personengruppen ein und fördert die Vernetzung der indischen Projektpartner untereinander. In Deutschland ist der Verein als eine von 25 bayerischen Eine Welt-Stationen anerkannt und unterhält ein Indien-Archiv. Zudem vermittelt und begleitet er Schul- und Städtepartnerschaften zwischen Bayern und Indien und beteiligt sich am regionalen Agenda-21-Prozess. Durch den angeschlossenen Weltladen und die Beteiligung an Kampagnen unterstützt die Indienhilfe e.V. den fairen Handel.\nFinanzen\nBezugsjahr:\n2018\nGesamteinnahmen:\n519.143,56 EUR\nDavon Sammlungseinnahmen Hilfetext:\n345.092,48 EUR\nAnteil Werbe- und Verwaltungskosten Hilfetext:\nniedrig\nEinschätzung durch das DZI Hilfetext\nDer Indienhilfe e.V., Herrsching am Ammersee, wurde das DZI Spenden-Siegel zuerkannt. Der Verein ist förderungswürdig.\nDie sieben Spenden-Siegel-Standards erfüllt der Verein wie folgt:\n1.Die Organisation leistet satzungsgemäße Arbeit.\n2.Leitung und Aufsicht sind angemessen strukturiert, klar voneinander getrennt und werden wirksam wahrgenommen.\n3.Werbung und Öffentlichkeitsarbeit informieren klar, wahr, sachlich und offen.\n4.Der Anteil der Werbe- und Verwaltungsausgaben an den Gesamtausgaben ist nach DZI-Maßstab niedrig („niedrig“ = unter 10%). Die Wirksamkeit des Mitteleinsatzes wird überprüft, und die Ergebnisse werden dokumentiert und veröffentlicht.\n5.Die von der Organisation gezahlten Vergütungen berücksichtigen den Status der Gemeinnützigkeit, die Qualifikation, das Maß an Verantwortung und den branchenüblichen Rahmen.\n6.Mittelbeschaffung und -verwendung sowie die Vermögenslage werden nachvollziehbar dokumentiert und angemessen geprüft.\n7.Die Organisation berichtet offen und umfassend über ihre Arbeit, Strukturen und Finanzen.\nTräger des DZI Spenden-Siegels seit 30.03.1998\nKontakt\nWebsite\nwww.indienhilfe-herrsching.de\nE-Mail\nemail@indienhilfe-herrsching.de\nTelefon\n08152-1231\nFax\n08152-48278\nAnschrift\nLuitpoldstraße 20, im Welthaus „Alte Schule“\n82211 Herrsching am Ammersee\nSpendenkonten\nIBAN: DE29702501500430377663\nBIC: BYLADEM1KMS\nKreissparkasse München Starnberg Ebersberg\nAllgemeine Informationen\nGründungsjahr\n1980\nSitz der Organisation\nHerrsching am Ammersee\nRechtsform\nVerein\nWeltanschauliche Ausrichtung\nunabhängig\nOrganisation\nLeitungsorgan\nVorstand\nMitglieder/Gesellschafter\n55 stimmberechtigte Mitglieder\nAnzahl Mitarbeiter Hilfetext\nhauptamtlich: 12 ehrenamtlich: 25"
  },
  {
    "title": "Indienhilfe Köln e.V.",
    "url": "https://www.dzi.de/organisation/indienhilfe-koeln-e-v/",
    "weltanschaulicheAusrichtung": "christlich",
    "finanzen": {
      "bezugsjahr": 2018,
      "gesamtEinnahmen": "253.108,25 EUR",
      "anteilKosten": "niedrig"
    },
    "volltext": "Arbeitsschwerpunkte\nAids, Bildung, Frauenförderung, Gesundheitshilfe, Kinder- und Jugendhilfe, Kinderpatenschaft\nLänderschwerpunkte\nÄthiopien, Indien, Kenia, Tansania\nTätigkeitsfelder\nDer Verein unterstützt Projekte der katholischen Schwesterngemeinschaft „Helpers of Mary“ in Indien, Kenia, Äthiopien und Tansania, insbesondere durch Kinderpatenschaften. Diese Gemeinschaft wurde 1942 durch die gebürtige Deutsche Anna Huberta Roggendorf in Andheri, einem Vorort Mumbais (Bombays), gegründet. Die „Helpers of Mary“ betreuen zirka 60 Sozialstationen und mehrere Kinderheime, in denen Kinder, die kein Zuhause haben, von den Schwestern versorgt werden, sowie diverse Krankenbehandlungszentren und Entbindungsstationen. Einen weiteren Schwerpunkt der Arbeit der Schwestern stellt die Betreuung von Lepra- und Aidskranken dar. Zudem unterhält die Schwesterngemeinschaft in verschiedenen Stationen mobile Kliniken und engagiert sich im Bereich der Frauenförderung.\nFinanzen\nBezugsjahr:\n2018\nGesamteinnahmen:\n253.108,25 EUR\nDavon Sammlungseinnahmen Hilfetext:\n253.108,25 EUR\nAnteil Werbe- und Verwaltungskosten Hilfetext:\nniedrig\nEinschätzung durch das DZI Hilfetext\nIndienhilfe Köln e.V., Köln, wurde das DZI Spenden-Siegel zuerkannt. Der Verein ist förderungswürdig.\nDie sieben Spenden-Siegel-Standards erfüllt der Verein wie folgt:\n1.Die Organisation leistet satzungsgemäße Arbeit.\n2.Leitung und Aufsicht sind angemessen strukturiert, klar voneinander getrennt und werden wirksam wahrgenommen.\n3.Werbung und Öffentlichkeitsarbeit informieren klar, wahr, sachlich und offen.\n4.Der Anteil der Werbe- und Verwaltungsausgaben an den Gesamtausgaben ist nach DZI-Maßstab niedrig („niedrig“ = unter 10%). Die Wirksamkeit des Mitteleinsatzes wird überprüft, und die Ergebnisse werden dokumentiert und veröffentlicht.\n5.Vergütungen (trifft nicht zu).\n6.Mittelbeschaffung und -verwendung sowie die Vermögenslage werden nachvollziehbar dokumentiert und angemessen geprüft.\n7.Die Organisation berichtet offen und umfassend über ihre Arbeit, Strukturen und Finanzen.\nTräger des DZI Spenden-Siegels seit 26.08.1992\nKontakt\nWebsite\nwww.indienhilfe.koeln\nE-Mail\nindienhilfe-koeln@online.de\nTelefon\n02266-3674\nAnschrift\nc/o Martin Kramm, Pollerhofstraße 33a\n51789 Lindlar\nSpendenkonten\nIBAN: DE41370601930036480017\nBIC: GENODED1PAX\nPax-Bank\nAllgemeine Informationen\nGründungsjahr\n1981\nSitz der Organisation\nKöln\nRechtsform\nVerein\nWeltanschauliche Ausrichtung\nchristlich\nOrganisation\nLeitungsorgan\nVorstand\nMitglieder/Gesellschafter\n47 stimmberechtigte Mitglieder\nAnzahl Mitarbeiter Hilfetext\nehrenamtlich: 4"
  },
  {
    "title": "Jambo Bukoba e.V.",
    "url": "https://www.dzi.de/organisation/jambo-bukoba-e-v/",
    "weltanschaulicheAusrichtung": "unabhängig",
    "finanzen": {
      "bezugsjahr": 2017,
      "gesamtEinnahmen": "329.727,40 EUR",
      "anteilKosten": "vertretbar"
    },
    "volltext": "Arbeitsschwerpunkte\nAids, Bildung, Entwicklungszusammenarbeit, Frauenförderung, Gesundheitshilfe, Kinder- und Jugendhilfe\nLänderschwerpunkte\nTansania\nTätigkeitsfelder\nJambo Bukoba e.V. betreibt in der Region Kagera/Tansania unterschiedliche Projekte. Alle Projekte werden unter Rücksichtnahme auf die bestehenden tansanischen Verhältnisse sowie unter Einbeziehung der betroffenen Bevölkerung geplant und durchgeführt. Zu den konkreten Aktivitäten des Vereins gehört insbesondere die Umsetzung des sportpädagogischen Programms „Life Skills through Games“, welches gemeinsam mit der Deutschen Sporthochschule in Köln entwickelt wurde. Es umfasst Workshops für Lehrer zu den Themen Bildung, Gleichberechtigung und Gesundheit (z.B. Aufklärungsarbeit zum Thema Aids) sowie die Durchführung von Sportwettbewerben unter Teilnahme von Mädchen und Jungen. Hierbei werden „Lebenskompetenzen“ wie beispielsweise Kommunikationsfähigkeit, Selbstvertrauen und Teamwork vermittelt. Die Gewinnerschule wird bei einem Schulbauprojekt unterstützt (z.B. Sanitäranlagen, Klassenräume), wobei zur Stärkung der Eigenverantwortung von den lokalen Akteuren eine finanzielle Beteiligung in Höhe von 25 Prozent vorausgesetzt wird. Ziel des spezifischen Förderansatzes von Jambo Bukoba e.V. ist es, Kindern und Jugendlichen mithilfe des Sports neue Lebensperspektiven zu eröffnen, damit diese ihr Leben selbstbestimmt und in Würde gestalten können. Darüber hinaus fördert der Verein den Bau von Wasserreservoirs und Handwaschanlagen an Grundschulen sowie die Durchführung von Workshops zum Thema Hygiene. Zudem beteiligt sich die Organisation auch bei der Hilfe nach Katastrophen.\nFinanzen\nBezugsjahr:\n2017\nGesamteinnahmen:\n329.727,40 EUR\nDavon Sammlungseinnahmen Hilfetext:\n196.113,36 EUR\nAnteil Werbe- und Verwaltungskosten Hilfetext:\nvertretbar\nEinschätzung durch das DZI Hilfetext\nJambo Bukoba e.V., München, wurde das DZI Spenden-Siegel zuerkannt. Der Verein ist förderungswürdig.\nDie sieben Spenden-Siegel-Standards erfüllt der Verein wie folgt:\n1.Die Organisation leistet satzungsgemäße Arbeit.\n2.Leitung und Aufsicht sind angemessen strukturiert, klar voneinander getrennt und werden wirksam wahrgenommen.\n3.Werbung und Öffentlichkeitsarbeit informieren hinreichend klar, wahr, sachlich und offen.\n4.Der Anteil der Werbe- und Verwaltungsausgaben an den Gesamtausgaben ist nach DZI-Maßstab vertretbar („vertretbar“ = 20% bis 30%). Die Wirksamkeit des Mitteleinsatzes wird überprüft, und die Ergebnisse werden dokumentiert und veröffentlicht.\n5.Die von der Organisation gezahlten Vergütungen berücksichtigen den Status der Gemein-\nnützigkeit, die Qualifikation, das Maß an Verantwortung und den branchenüblichen Rahmen.\n6.Mittelbeschaffung und -verwendung sowie die Vermögenslage werden nachvollziehbar dokumentiert und angemessen geprüft.\n7.Die Organisation berichtet offen und hinreichend umfassend über ihre Arbeit, Strukturen und Finanzen.\nTräger des DZI Spenden-Siegels seit 05.12.2019\nKontakt\nWebsite\nwww.jambobukoba.com\nE-Mail\nclemens.mulokozi@jambobukoba.com\nTelefon\n0173-4333202\nAnschrift\nHeinrich-Wieland-Str. 170\n81735 München\nSpendenkonten\nIBAN: DE59700202700660531637\nBIC: HYVEDEMMXXX\nUniCredit Bank - HypoVereinsbank\nAllgemeine Informationen\nGründungsjahr\n2008\nSitz der Organisation\nMünchen\nRechtsform\nVerein\nWeltanschauliche Ausrichtung\nunabhängig\nOrganisation\nLeitungsorgan\nVorstand\nMitglieder/Gesellschafter\n380 stimmberechtigte Mitglieder\nAnzahl Mitarbeiter Hilfetext\nhauptamtlich: 11 ehrenamtlich: 57"
  },
  {
    "title": "Johannes-Hospiz Münster gGmbH",
    "url": "https://www.dzi.de/organisation/johannes-hospiz-muenster-ggmbh/",
    "weltanschaulicheAusrichtung": "christlich",
    "finanzen": {
      "bezugsjahr": 2018,
      "gesamtEinnahmen": "2.356.149,72 EUR",
      "anteilKosten": "angemessen"
    },
    "volltext": "Arbeitsschwerpunkte\nAltenhilfe, Bildung, Gesundheitshilfe\nLänderschwerpunkte\nDeutschland\nTätigkeitsfelder\nDie Gesellschaft betreibt ein Hospiz für schwerkranke und sterbende Menschen in Münster. Die Aufnahme erfolgt auf eigenen Wunsch. Der Fort- und Weiterbildungsbereich (Akademie) des Johannes-Hospizes wendet sich insbesondere an Fachkräfte im medizinisch-pflegerischen Bereich. Des Weiteren bildet die Organisation ehrenamtliche Helferinnen und Helfer für ihre Aufgabe in der Begleitung Sterbender und ihrer Angehörigen aus. Sie unterhält einen ehrenamtlichen ambulanten Hospizdienst und führt Öffentlichkeitsarbeit zum Thema Sterben und Tod durch.\nFinanzen\nBezugsjahr:\n2018\nGesamteinnahmen:\n2.356.149,72 EUR\nDavon Sammlungseinnahmen Hilfetext:\n647.159,22 EUR\nAnteil Werbe- und Verwaltungskosten Hilfetext:\nangemessen\nEinschätzung durch das DZI Hilfetext\nDer Johannes-Hospiz Münster gGmbH, Münster, wurde das DZI Spenden-Siegel zuerkannt. Die Organisation ist förderungswürdig.\nDie sieben Spenden-Siegel-Standards erfüllt die Gesellschaft wie folgt:\n1.Die Organisation leistet satzungsgemäße Arbeit.\n2.Leitung und Aufsicht sind angemessen strukturiert, klar voneinander getrennt und werden wirksam wahrgenommen.\n3.Werbung und Öffentlichkeitsarbeit informieren klar, wahr, sachlich und offen.\n4.Der Anteil der Werbe- und Verwaltungsausgaben an den Gesamtausgaben ist nach DZI-Maßstab angemessen („angemessen“ = 10% bis unter 20%). Die Wirksamkeit des Mitteleinsatzes wird überprüft, und die Ergebnisse werden dokumentiert und veröffentlicht.\n5.Die von der Organisation gezahlten Vergütungen berücksichtigen den Status der Gemeinnützigkeit, die Qualifikation, das Maß an Verantwortung und den branchenüblichen Rahmen.\n6.Mittelbeschaffung und -verwendung sowie die Vermögenslage werden nachvollziehbar dokumentiert und angemessen geprüft.\n7.Die Organisation berichtet offen und umfassend über ihre Arbeit, Strukturen und Finanzen.\nTräger des DZI Spenden-Siegels seit 24.07.2008\nKontakt\nWebsite\nwww.johannes-hospiz.de\nE-Mail\ninfo@johannes-hospiz.de\nTelefon\n0251-9337626\nFax\n0251-9337598\nAnschrift\nSt. Mauritz-Freiheit 44\n48145 Münster\nSpendenkonten\nIBAN: DE30400602650002222600\nBIC: GENODEM1DKM\nDKM Darlehnskasse Münster\nAllgemeine Informationen\nGründungsjahr\n1998\nSitz der Organisation\nMünster\nRechtsform\nGmbH\nWeltanschauliche Ausrichtung\nchristlich\nOrganisation\nLeitungsorgan\nGeschäftsführung\nMitglieder/Gesellschafter\n4 stimmberechtigte Mitglieder\nAnzahl Mitarbeiter Hilfetext\nhauptamtlich: 35 ehrenamtlich: 92"
  },
  {
    "title": "Karuna Deutschland e.V.",
    "url": "https://www.dzi.de/organisation/karuna-deutschland-e-v/",
    "weltanschaulicheAusrichtung": "sonstige",
    "finanzen": {
      "bezugsjahr": 2019,
      "gesamtEinnahmen": "495.549,66 EUR",
      "anteilKosten": "niedrig"
    },
    "volltext": "Arbeitsschwerpunkte\nBildung, Entwicklungszusammenarbeit, Frauenförderung, Gesundheitshilfe, Kinder- und Jugendhilfe, Menschenrechte\nLänderschwerpunkte\nIndien, Nepal\nTätigkeitsfelder\nKaruna Deutschland e.V. unterstützt verschiedene Projekte in Indien und Nepal. Dazu arbeitet der Verein unter anderem mit der britischen Schwesterorganisation Karuna Trust London und ortsansässigen Partnerorganisationen zusammen. Vor dem Hintergrund der Hilfe zur Selbsthilfe finanziert der Verein insbesondere Schulen für Mädchen und Jungen, ein Wohnheim für benachteiligte Mädchen und junge Frauen sowie den Bau und Unterhalt von Geburtshilfestationen. Ziel der Fördermaßnahmen ist es, Armut und Diskriminierung zu überwinden und insbesondere Mädchen, Frauen und Angehörigen der niedrigen Kasten (Dalits und Adivasi) neue Lebensperspektiven und einen selbstbestimmten Lebensweg zu ermöglichen. Der Verein fördert zudem die Einrichtung von Selbsthilfegruppen, die sich für die Stärkung von Frauen und die Wahrung der Menschenrechte einsetzen. Hierzu gehören beispielsweise das „Maitri-Netzwerk“ und das Projekt „Stimme der Frauen“, die unter anderem Frauen aus marginalisierten Gruppen nach Gewalterfahrungen in die Lage versetzen, juristische Schritte einzuleiten. Ein weiteres Projekt unterstützt junge Frauen durch Aus- und Fortbildung gemeinsam ein Kleingewerbe zu gründen und auf diese Weise dauerhaft eigenes Einkommen zu erwirtschaften.\nFinanzen\nBezugsjahr:\n2019\nGesamteinnahmen:\n495.549,66 EUR\nDavon Sammlungseinnahmen Hilfetext:\n40.143,59 EUR\nAnteil Werbe- und Verwaltungskosten Hilfetext:\nniedrig\nEinschätzung durch das DZI Hilfetext\nKaruna Deutschland e.V., Essen, wurde das DZI Spenden-Siegel zuerkannt. Der Verein ist förderungswürdig.\n1.Die Organisation leistet satzungsgemäße Arbeit.\n2.Leitung und Aufsicht sind angemessen strukturiert, klar voneinander getrennt und werden wirksam wahrgenommen.\n3.Werbung und Öffentlichkeitsarbeit informieren klar, wahr, sachlich und offen.\n4.Der Anteil der Werbe- und Verwaltungsausgaben an den Gesamtausgaben ist nach DZI-Maßstab niedrig („niedrig“ = unter 10%). Die Wirksamkeit des Mitteleinsatzes wird überprüft, und die Ergebnisse werden dokumentiert und veröffentlicht.\n5.Die von der Organisation gezahlten Vergütungen berücksichtigen den Status der Gemein-\nnützigkeit, die Qualifikation, das Maß an Verantwortung und den branchenüblichen Rahmen.\n6.Mittelbeschaffung und -verwendung sowie die Vermögenslage werden überwiegend nachvollziehbar dokumentiert und angemessen geprüft.\n7.Die Organisation berichtet offen und hinreichend umfassend über ihre Arbeit, Strukturen und Finanzen.\nTräger des DZI Spenden-Siegels seit 02.11.2020\nKontakt\nWebsite\nwww.karunadeutschland.org\nE-Mail\ninfo@karunadeutschland.org\nTelefon\n0201-45866102\nAnschrift\nHerkulesstraße 13 a\n45127 Essen\nSpendenkonten\nIBAN: DE54430609674019173700\nBIC: GENODEM1GLS\nGLS Gemeinschaftsbank\nAllgemeine Informationen\nGründungsjahr\n2007\nSitz der Organisation\nEssen\nRechtsform\nVerein\nWeltanschauliche Ausrichtung\nsonstige\nOrganisation\nLeitungsorgan\nVorstand\nMitglieder/Gesellschafter\n26 stimmberechtigte Mitglieder\nAnzahl Mitarbeiter Hilfetext\nhauptamtlich: 1 ehrenamtlich: 8"
  },
  {
    "title": "Katachel e.V.",
    "url": "https://www.dzi.de/organisation/katachel-e-v/",
    "weltanschaulicheAusrichtung": "unabhängig",
    "finanzen": {
      "bezugsjahr": 2019,
      "gesamtEinnahmen": "208.498,96 EUR",
      "anteilKosten": "niedrig"
    },
    "volltext": "Arbeitsschwerpunkte\nBehindertenhilfe, Bildung, Einzelfallhilfe, Entwicklungszusammenarbeit, Familienfürsorge, Frauenförderung, Gesundheitshilfe\nLänderschwerpunkte\nAfghanistan\nTätigkeitsfelder\nDer Verein fördert Projekte in der Provinz Kunduz im Norden Afghanistans. Hier unterhält er Patenschaften für Witwen und deren Kinder, leistet Hilfe für weitere Bedürftige, unterstützt den Bau und Betrieb von Schulen und fördert Infrastrukturmaßnahmen.\nFinanzen\nBezugsjahr:\n2019\nGesamteinnahmen:\n208.498,96 EUR\nDavon Sammlungseinnahmen Hilfetext:\n208.498,96 EUR\nAnteil Werbe- und Verwaltungskosten Hilfetext:\nniedrig\nEinschätzung durch das DZI Hilfetext\nKatachel e.V., Bergfeld, wurde das DZI Spenden-Siegel zuerkannt. Der Verein ist förderungswürdig.\nDie sieben Spenden-Siegel-Standards erfüllt der Verein wie folgt:\n1.Die Organisation leistet satzungsgemäße Arbeit.\n2.Leitung und Aufsicht sind angemessen strukturiert, klar voneinander getrennt und werden wirksam wahrgenommen.\n3.Werbung und Öffentlichkeitsarbeit informieren klar, wahr, sachlich und offen.\n4.Der Anteil der Werbe- und Verwaltungsausgaben an den Gesamtausgaben ist nach DZI-Maßstab niedrig („niedrig“ = unter 10%). Die Wirksamkeit des Mitteleinsatzes wird überprüft, und die Ergebnisse werden dokumentiert und veröffentlicht.\n5.Vergütungen (trifft nicht zu).\n6.Mittelbeschaffung und -verwendung sowie die Vermögenslage werden nachvollziehbar dokumentiert und angemessen geprüft.\n7.Die Organisation berichtet offen und umfassend über ihre Arbeit, Strukturen und Finanzen.\nTräger des DZI Spenden-Siegels seit 12.03.2003\nKontakt\nWebsite\nwww.katachel.de\nE-Mail\ninfo@katachel.de\nTelefon\n05368-505\nFax\n05368-978016\nAnschrift\nHauptstraße 1a\n38467 Bergfeld\nSpendenkonten\nIBAN: DE24269513110014160006\nBIC: NOLADE21GFW\nSparkasse Gifhorn-Wolfsburg\nAllgemeine Informationen\nGründungsjahr\n1994\nSitz der Organisation\nBergfeld\nRechtsform\nVerein\nWeltanschauliche Ausrichtung\nunabhängig\nOrganisation\nLeitungsorgan\nVorstand\nMitglieder/Gesellschafter\n121 stimmberechtigte Mitglieder\nAnzahl Mitarbeiter Hilfetext\nehrenamtlich: 5"
  },
  {
    "title": "LandsAid e.V. – Verein für Internationale Humanitäre Hilfe",
    "url": "https://www.dzi.de/organisation/landsaid-e-v-verein-fuer-internationale-humanitaere-hilfe/",
    "weltanschaulicheAusrichtung": "unabhängig",
    "finanzen": {
      "bezugsjahr": 2018,
      "gesamtEinnahmen": "556.107,97 EUR",
      "anteilKosten": "angemessen"
    },
    "volltext": "Arbeitsschwerpunkte\nBildung, Entwicklungszusammenarbeit, Gesundheitshilfe, Katastrophenhilfe\nLänderschwerpunkte\nBangladesch, Deutschland, Ecuador, Haiti, Indonesien, Jemen, Jordanien, Kenia, Kongo, Nepal, Pakistan, Uganda\nTätigkeitsfelder\nLandsAid verfolgt das Ziel, Menschen, die durch Natur- oder Umweltkatastrophen, durch bewaffnete Konflikte oder Unterdrückung in Not geraten sind, zu helfen. Neben notfallmedizinischer Versorgung in Katastrophenfällen fördert der Verein Projekte in den Bereichen Basismedizin und Ernährung. Ein weiterer Schwerpunkt der Vereinsarbeit liegt in der Ausbildung von Einsatzkräften. Sie beinhaltet die Einsatzvor- und -nachbereitung ebenso wie die Personalfürsorge während des Einsatzes und bietet den Teilnehmern die Möglichkeit zur Orientierung und den Einstieg in die humanitäre Arbeit. Die Ausbildung ist offen für alle Interessierten und nicht zwingend mit einem Einsatz für LandsAid verbunden. Jedoch bietet die Organisation interessierten Projektmitarbeitern die Möglichkeit, sich in der LandsAid-Datenbank registrieren zu lassen.\nFinanzen\nBezugsjahr:\n2018\nGesamteinnahmen:\n556.107,97 EUR\nDavon Sammlungseinnahmen Hilfetext:\n127.497,40 EUR\nAnteil Werbe- und Verwaltungskosten Hilfetext:\nangemessen\nEinschätzung durch das DZI Hilfetext\nLandsAid e.V. – Verein für Internationale Humanitäre Hilfe, Kaufering, wurde das DZI Spenden-Siegel zuerkannt. Der Verein ist förderungswürdig.\nDie sieben Spenden-Siegel-Standards erfüllt der Verein wie folgt:\n1.Die Organisation leistet satzungsgemäße Arbeit.\n2.Leitung und Aufsicht sind angemessen strukturiert, klar voneinander getrennt und werden wirksam wahrgenommen.\n3.Werbung und Öffentlichkeitsarbeit informieren klar, wahr, sachlich und offen.\n4.Der Anteil der Werbe- und Verwaltungsausgaben an den Gesamtausgaben ist nach DZI-Maßstab angemessen („angemessen“ = 10% bis 20%). Die Wirksamkeit des Mitteleinsatzes wird überprüft, und die Ergebnisse werden dokumentiert und veröffentlicht.\n5.Die von der Organisation gezahlten Vergütungen berücksichtigen den Status der Gemeinnützigkeit, die Qualifikation, das Maß an Verantwortung und den branchenüblichen Rahmen.\n6.Mittelbeschaffung und -verwendung sowie die Vermögenslage werden nachvollziehbar dokumentiert und angemessen geprüft.\n7.Die Organisation berichtet offen und umfassend über ihre Arbeit, Strukturen und Finanzen.\nTräger des DZI Spenden-Siegels seit 09.04.2009\nKontakt\nWebsite\nwww.landsaid.org\nE-Mail\ninfo@landsaid.org\nTelefon\n08191-4287832\nFax\n08191-4287833\nAnschrift\nDr.-Gerbl-Straße 48\n86916 Kaufering\nSpendenkonten\nIBAN: DE66700520600000014001\nBIC: BYLADEM1LLD\nSparkasse Landsberg-Dießen\nAllgemeine Informationen\nGründungsjahr\n2006\nSitz der Organisation\nKaufering\nRechtsform\nVerein\nWeltanschauliche Ausrichtung\nunabhängig\nOrganisation\nLeitungsorgan\nVorstand\nGeschäftsführung\nSven Weber\nMitglieder/Gesellschafter\n30 stimmberechtigte Mitglieder\nAnzahl Mitarbeiter Hilfetext\nhauptamtlich: 9 ehrenamtlich: 5"
  },
  {
    "title": "Leben nach Tschernobyl e.V.",
    "url": "https://www.dzi.de/organisation/leben-nach-tschernobyl-e-v/",
    "weltanschaulicheAusrichtung": "unabhängig",
    "finanzen": {
      "bezugsjahr": 2017,
      "gesamtEinnahmen": "484.871,22 EUR",
      "anteilKosten": "niedrig"
    },
    "volltext": "Arbeitsschwerpunkte\nBehindertenhilfe, Bildung, Bildungs- und Kampagnenarbeit, Gesundheitshilfe, Kinder- und Jugendhilfe, Umwelt- und Naturschutz, Völkerverständigung\nLänderschwerpunkte\nWeißrussland\nTätigkeitsfelder\nDen wesentlichen Schwerpunkt der Aktivitäten von Leben nach Tschernobyl e.V. bildet die Förderung der belarussisch-deutschen gemeinsamen Gesellschaft mit beschränkter Haftung „Rehabilitations- und Erholungskinderzentrum Nadeshda“ in Minsk/Weißrussland. In dieses Zentrum werden Kinder und Jugendliche, die aus durch die Tschernobyl-Katastrophe radioaktiv belasteten Regionen stammen, zu einem mehrwöchigen Erholungsaufenthalt aufgenommen. Zudem fördert der Verein die Umrüstung des Zentrums auf erneuerbare Energien sowie den Aufbau eines zertifizierten Umweltmanagementsystems und begleitet die Entwicklung von Umweltprojekten in Weißrussland. Leben nach Tschernobyl e.V. unterstützt das Zentrum in finanzieller Form (z.B. Finanzierung der Aufenthalte der Kinder, Anschaffung und Instandhaltung von technischen Geräten), durch die Beteiligung an der Leitung und konzeptionellen Entwicklung des Zentrums sowie durch ehrenamtliche Arbeit (z.B. Installationen, Reparaturen, Fortbildung des pädagogischen Personals etc.).\nFinanzen\nBezugsjahr:\n2017\nGesamteinnahmen:\n484.871,22 EUR\nDavon Sammlungseinnahmen Hilfetext:\n56.435,81 EUR\nAnteil Werbe- und Verwaltungskosten Hilfetext:\nniedrig\nEinschätzung durch das DZI Hilfetext\nLeben nach Tschernobyl e.V., Frankfurt am Main, wurde das Spenden-Siegel zuerkannt. Der Verein ist förderungswürdig.\nDie sieben Spenden-Siegel-Standards erfüllt der Verein wie folgt:\n1.Die Organisation leistet satzungsgemäße Arbeit.\n2.Leitung und Aufsicht sind angemessen strukturiert, klar voneinander getrennt und werden wirksam wahrgenommen.\n3.Werbung und Öffentlichkeitsarbeit informieren klar, wahr, sachlich und offen.\n4.Der Anteil der Werbe- und Verwaltungsausgaben an den Gesamtausgaben ist nach DZI-Maßstab niedrig („niedrig“ = unter 10%). Die Wirksamkeit des Mitteleinsatzes wird überprüft, und die Ergebnisse werden dokumentiert und veröffentlicht.\n5.Vergütungen (trifft nicht zu).\n6.Mittelbeschaffung und -verwendung sowie die Vermögenslage werden nachvollziehbar dokumentiert und angemessen geprüft.\n7.Die Organisation berichtet offen und hinreichend umfassend über ihre Arbeit, Strukturen und Finanzen.\nTräger des DZI Spenden-Siegels seit 04.05.2015\nKontakt\nWebsite\nwww.leben-nach-tschernobyl-ev.de\nE-Mail\nLnT.eV@t-online.de\nTelefon\n069-70760317\nFax\n069-70760319\nAnschrift\nLudolfusstraße 2-4\n60487 Frankfurt am Main\nSpendenkonten\nIBAN: DE03520604100004114400\nBIC: GENODEF1EK1\nEvangelische Bank\nAllgemeine Informationen\nGründungsjahr\n1990\nSitz der Organisation\nFrankfurt am Main\nRechtsform\nVerein\nWeltanschauliche Ausrichtung\nunabhängig\nOrganisation\nLeitungsorgan\nVorstand\nMitglieder/Gesellschafter\n28 stimmberechtigte Mitglieder\nAnzahl Mitarbeiter Hilfetext\nehrenamtlich: 4"
  },
  {
    "title": "Malteser Stiftung",
    "url": "https://www.dzi.de/organisation/malteser-stiftung/",
    "weltanschaulicheAusrichtung": "katholisch",
    "finanzen": {
      "bezugsjahr": 2018,
      "gesamtEinnahmen": "923.186,61 EUR",
      "anteilKosten": "niedrig"
    },
    "volltext": "Arbeitsschwerpunkte\nAltenhilfe, Behindertenhilfe, Bildungs- und Kampagnenarbeit, Entwicklungszusammenarbeit, Familienfürsorge, Gesundheitshilfe, Katastrophenhilfe, Kinder- und Jugendhilfe, Religion, Rettungswesen, Suchthilfe\nLänderschwerpunkte\nDeutschland, weltweit\nTätigkeitsfelder\nZiel der Malteser Stiftung ist es, die humanitäre Hilfe des Malteser Hilfsdienst e.V. langfristig zu unterstützen. Zu diesem Zweck fördert die Stiftung verschiedene Aktivitäten des Vereins wie unter anderem die Hospizarbeit, die psychosoziale Krisenintervention oder die Not- und Katastrophenhilfeeinsätze von Malteser International in Entwicklungsländern. Zudem verfügt die Malteser Stiftung über das Malteser Stiftungszentrum der Stiftungszentrum.de Servicegesellschaft mbH über das Vermögen von rund 80 Treuhandstiftungen, deren Erträge für Projekte des Malteser Verbundes verwendet werden.\nFinanzen\nBezugsjahr:\n2018\nGesamteinnahmen:\n923.186,61 EUR\nDavon Sammlungseinnahmen Hilfetext:\n868.694,65 EUR\nAnteil Werbe- und Verwaltungskosten Hilfetext:\nniedrig\nEinschätzung durch das DZI Hilfetext\nDer Malteser Stiftung, München, wurde das DZI Spenden-Siegel zuerkannt. Die Stiftung ist förderungswürdig.\nDie sieben Spenden-Siegel-Standards erfüllt die Stiftung wie folgt:\n1.Die Organisation leistet satzungsgemäße Arbeit.\n2.Leitung und Aufsicht sind angemessen strukturiert, klar voneinander getrennt und werden wirksam wahrgenommen.\n3.Werbung und Öffentlichkeitsarbeit informieren klar, wahr, sachlich und offen.\n4.Der Anteil der Werbe- und Verwaltungsausgaben an den Gesamtausgaben ist nach DZI-Maßstab niedrig („niedrig“ = unter 10%). Die Wirksamkeit des Mitteleinsatzes wird überprüft, und die Ergebnisse werden dokumentiert und in hinreichendem Maße veröffentlicht.\n5.Vergütungen (trifft nicht zu).\n6.Mittelbeschaffung und -verwendung sowie die Vermögenslage werden nachvollziehbar dokumentiert und angemessen geprüft.\n7.Die Organisation berichtet offen und umfassend über ihre Arbeit, Strukturen und Finanzen.\nTräger des DZI Spenden-Siegels seit 16.09.2010\nKontakt\nWebsite\nwww.malteser-stiftung.de\nE-Mail\nstiftung@malteser.org\nTelefon\n0221-98222323\nFax\n040-69459710272\nAnschrift\nErna-Scheffler-Straße 2\n51103 Köln\nSpendenkonten\nIBAN: DE71700205000008869107\nBIC: BFSWDE33MUE\nBank für Sozialwirtschaft\nAllgemeine Informationen\nGründungsjahr\n2003\nSitz der Organisation\nMünchen\nRechtsform\nStiftung\nWeltanschauliche Ausrichtung\nkatholisch\nOrganisation\nLeitungsorgan\nVorstand\nAnzahl Mitarbeiter Hilfetext\nehrenamtlich: 3"
  },
  {
    "title": "Marianne Strauß Stiftung",
    "url": "https://www.dzi.de/organisation/marianne-strauss-stiftung/",
    "weltanschaulicheAusrichtung": "unabhängig",
    "finanzen": {
      "bezugsjahr": 2018,
      "gesamtEinnahmen": "1.595.715,63 EUR",
      "anteilKosten": "niedrig"
    },
    "volltext": "Arbeitsschwerpunkte\nAltenhilfe, Behindertenhilfe, Einzelfallhilfe, Kinder- und Jugendhilfe, Kultur\nLänderschwerpunkte\nDeutschland\nTätigkeitsfelder\nDie Marianne Strauß Stiftung leistet gezielte Einzelfallhilfe. Diese wird insbesondere in Form von finanzieller Hilfe, aber auch durch intensive persönliche Betreuung gewährt. Die Stiftung unterstützt unverschuldet in Not geratene Menschen und hilft in besonderen Härtefällen, in denen gesetzliche oder andere Unterstützungen nicht ausreichend oder nicht rechtzeitig geleistet werden können. Die Fördermittel müssen von den Betroffenen zweckgebunden eingesetzt und ihre Verwendung muss entsprechend nachgewiesen werden. Die Marianne Strauß Stiftung arbeitet teilweise mit anderen gemeinnützigen Organisationen zusammen, darunter Sternstunden e.V., München. Die Hilfeleistungen der Stiftung konzentrieren sich auf das Bundesland Bayern.\nFinanzen\nBezugsjahr:\n2018\nGesamteinnahmen:\n1.595.715,63 EUR\nDavon Sammlungseinnahmen Hilfetext:\n217.081,13 EUR\nAnteil Werbe- und Verwaltungskosten Hilfetext:\nniedrig\nEinschätzung durch das DZI Hilfetext\nDer Marianne Strauss Stiftung, München, wurde das DZI Spenden-Siegel zuerkannt. Die Stiftung ist förderungswürdig.\nDie sieben Spenden-Siegel-Standards erfüllt der Verein wie folgt:\n1.Die Organisation leistet satzungsgemäße Arbeit.\n2.Leitung und Aufsicht sind hinreichend angemessen strukturiert, klar voneinander getrennt und werden wirksam wahrgenommen.\n3.Werbung und Öffentlichkeitsarbeit informieren klar, wahr, sachlich und offen.\n4.Der Anteil der Werbe-und Verwaltungsausgaben an den Gesamtausgaben ist nach DZI-Maßstab niedrig („niedrig“ = unter 10%). Die Wirksamkeit des Mitteleinsatzes wird überprüft, und die Ergebnisse werden dokumentiert und veröffentlicht.\n5.Die von der Organisation gezahlten Vergütungen berücksichtigen den Status der Gemeinnützigkeit, die Qualifikation, das Maß an Verantwortung und den branchenüblichen Rahmen.\n6.Mittelbeschaffung und -verwendung sowie die Vermögenslage werden nachvollziehbar dokumentiert und angemessen geprüft.\n7.Die Organisation berichtet hinreichend offen und umfassend über ihre Arbeit, Strukturen und Finanzen.\nTräger des DZI Spenden-Siegels seit 17.09.2008\nKontakt\nWebsite\nwww.msshilft.de\nE-Mail\ninfo@msshilft.de\nTelefon\n089-294967\nFax\n089-297394\nAnschrift\nOettingenstraße 22\n80538 München\nSpendenkonten\nIBAN: DE30701500001000506517\nBIC: SSKMDEMM\nStadtsparkasse München\nAllgemeine Informationen\nGründungsjahr\n1984\nSitz der Organisation\nMünchen\nRechtsform\nStiftung\nWeltanschauliche Ausrichtung\nunabhängig\nOrganisation\nLeitungsorgan\nStiftungsvorstand\nAnzahl Mitarbeiter Hilfetext\nhauptamtlich: 2 ehrenamtlich: 7"
  },
  {
    "title": "NCL-Stiftung",
    "url": "https://www.dzi.de/organisation/ncl-stiftung/",
    "weltanschaulicheAusrichtung": "unabhängig",
    "finanzen": {
      "bezugsjahr": 2018,
      "gesamtEinnahmen": "1.059.283,03 EUR",
      "anteilKosten": "niedrig"
    },
    "volltext": "Arbeitsschwerpunkte\nForschung, Gesundheitshilfe, Kinder- und Jugendhilfe\nLänderschwerpunkte\nDeutschland, Großbritannien, Luxemburg, USA\nTätigkeitsfelder\nDie NCL-Stiftung konzentriert sich auf die Bekämpfung der Krankheit Neuronale Ceroid Lipofuszinose (NCL), einer erblich bedingten und tödlich verlaufenden Stoffwechselkrankheit, die im Kindesalter ausbricht und ein zunehmendes Absterben von Nervenzellen zur Folge hat. Die Kinder verlieren sukzessive die Fähigkeit zu sehen, zu gehen und zu handeln. Im Endstadium können schließlich auch die lebenserhaltenden Funktionen nicht mehr aufrechterhalten werden. Ziel der Stiftung ist es, über die Krankheit und deren Verlauf aufzuklären, Forschungsprojekte zu initiieren, Netzwerke von Wissenschaftlern unterschiedlicher Disziplinen aufzubauen und bereits vorhandenes Wissen verwandter Gebiete zu bündeln, um letztlich Heilungsstrategien zu entwickeln. Des Weiteren übernimmt die Stiftung die Beratung von NCL-interessierten Forschenden und die Vermittlung von Drittmitteln, die von Firmen und anderen Organisationen vergeben werden.\nFinanzen\nBezugsjahr:\n2018\nGesamteinnahmen:\n1.059.283,03 EUR\nDavon Sammlungseinnahmen Hilfetext:\n925.025,83 EUR\nAnteil Werbe- und Verwaltungskosten Hilfetext:\nniedrig\nEinschätzung durch das DZI Hilfetext\nDer NCL-Stiftung, Hamburg, wurde das DZI Spenden-Siegel zuerkannt. Die Stiftung ist förderungswürdig.\nDie sieben Spenden-Siegel-Standards erfüllt die Stiftung wie folgt:\n1.Die Organisation leistet satzungsgemäße Arbeit.\n2.Leitung und Aufsicht sind angemessen strukturiert, klar voneinander getrennt und werden wirksam wahrgenommen.\n3.Werbung und Öffentlichkeitsarbeit informieren klar, wahr, sachlich und offen.\n4.Der Anteil der Werbe-und Verwaltungsausgaben an den Gesamtausgaben ist nach DZI-Maßstab niedrig („niedrig“ = unter 10%). Die Wirksamkeit des Mitteleinsatzes wird überprüft, und die Ergebnisse werden dokumentiert und veröffentlicht.\n5.Die von der Organisation gezahlten Vergütungen berücksichtigen den Status der Gemeinnützigkeit, die Qualifikation, das Maß an Verantwortung und den branchenüblichen Rahmen.\n6.Mittelbeschaffung und -verwendung sowie die Vermögenslage werden nachvollziehbar dokumentiert und angemessen geprüft.\n7.Die Organisation berichtet offen und umfassend über ihre Arbeit, Strukturen und Finanzen.\nTräger des DZI Spenden-Siegels seit 31.05.2006\nKontakt\nWebsite\nwww.ncl-stiftung.de\nE-Mail\ninfo@ncl-stiftung.de\nTelefon\n040-69666740\nFax\n040-696667469\nAnschrift\nHolstenwall 10\n20355 Hamburg\nSpendenkonten\nIBAN: DE50200505501059223030\nBIC: HASPDEHHXXX\nHamburger Sparkasse\nAllgemeine Informationen\nGründungsjahr\n2002\nSitz der Organisation\nHamburg\nRechtsform\nStiftung\nWeltanschauliche Ausrichtung\nunabhängig\nOrganisation\nLeitungsorgan\nVorstand\nAnzahl Mitarbeiter Hilfetext\nhauptamtlich: 10 ehrenamtlich: 9"
  },
  {
    "title": "NETZ Partnerschaft für Entwicklung und Gerechtigkeit e.V.",
    "url": "https://www.dzi.de/organisation/netz-partnerschaft-fuer-entwicklung-und-gerechtigkeit-e-v/",
    "weltanschaulicheAusrichtung": "unabhängig",
    "finanzen": {
      "bezugsjahr": 2018,
      "gesamtEinnahmen": "3.479.406,92 EUR",
      "anteilKosten": "niedrig"
    },
    "volltext": "Arbeitsschwerpunkte\nBildung, Bildungs- und Kampagnenarbeit, Corona-Hilfe, Entwicklungszusammenarbeit, Frauenförderung, Katastrophenhilfe, Menschenrechte, Völkerverständigung\nLänderschwerpunkte\nBangladesch, Deutschland, Indien\nTätigkeitsfelder\nNETZ Bangladesch ist insbesondere auf dem Gebiet der Entwicklungszusammenarbeit tätig. Inhaltlich legt der Verein die Schwerpunkte auf Einkommen schaffende Maßnahmen, Grundbildung und Menschenrechte. Konkret werden in Projekten lokaler Kooperationspartner zum Beispiel Existenzgründungen insbesondere von Frauen, sowie Kleinkreditprogramme, Aus- und Fortbildungsprojekte, Schulen oder auch Menschenrechtsbildung für Benachteiligte unterstützt. Mit dem Programm „Ein Leben lang genug Reis“ werden auch in Indien Familien in die Lage versetzt, dauerhaft eigenes Einkommen zu erwirtschaften. Darüber hinaus leistet die Organisation Hilfe in Katastrophenfällen. Der Verein ist des Weiteren als Entsendeorganisation des Freiwilligenprogramms „weltwärts“ des Bundesministerium für wirtschaftliche Zusammenarbeit und Entwicklung (BMZ) anerkannt. Im Inland ist NETZ Bangladesch in der Bildungs- und Öffentlichkeitsarbeit aktiv. Hierzu gehören Aufklärungsarbeit in Schulen, Veranstaltungen und Aktionstage in Kirchengemeinden, Austauschprogramme und Tagungen, der Austausch mit anderen Organisationen und die Herausgabe von Infoschriften.\nFinanzen\nBezugsjahr:\n2018\nGesamteinnahmen:\n3.479.406,92 EUR\nDavon Sammlungseinnahmen Hilfetext:\n511.910,93 EUR\nAnteil Werbe- und Verwaltungskosten Hilfetext:\nniedrig\nEinschätzung durch das DZI Hilfetext\nNETZ Partnerschaft für Entwicklung und Gerechtigkeit e.V., Wetzlar, wurde das DZI Spenden-Siegel zuerkannt. Der Verein ist förderungswürdig.\nDie sieben Spenden-Siegel-Standards erfüllt der Verein wie folgt:\n1.Die Organisation leistet satzungsgemäße Arbeit.\n2.Leitung und Aufsicht sind angemessen strukturiert, klar voneinander getrennt und werden wirksam wahrgenommen.\n3.Werbung und Öffentlichkeitsarbeit informieren klar, wahr, sachlich und offen.\n4.Der Anteil der Werbe- und Verwaltungsausgaben an den Gesamtausgaben ist nach DZI-Maßstab niedrig („niedrig“ = unter 10%). Die Wirksamkeit des Mitteleinsatzes wird überprüft, und die Ergebnisse werden dokumentiert und veröffentlicht.\n5.Die von der Organisation gezahlten Vergütungen berücksichtigen den Status der Gemein-\nnützigkeit, die Qualifikation, das Maß an Verantwortung und den branchenüblichen Rahmen.\n6.Mittelbeschaffung und -verwendung sowie die Vermögenslage werden nachvollziehbar dokumentiert und angemessen geprüft.\n7.Die Organisation berichtet offen und umfassend über ihre Arbeit, Strukturen und Finanzen.\nTräger des DZI Spenden-Siegels seit 24.10.2002\nKontakt\nWebsite\nwww.bangladesch.org\nE-Mail\ninfo@bangladesch.org\nTelefon\n06441-974630\nFax\n06441-9746329\nAnschrift\nMoritz-Hensoldt-Straße 20\n35576 Wetzlar\nSpendenkonten\nIBAN: DE82513900000000006262\nBIC: VBMHDE5F\nVolksbank Mittelhessen\nAllgemeine Informationen\nGründungsjahr\n1989\nSitz der Organisation\nWetzlar\nRechtsform\nVerein\nWeltanschauliche Ausrichtung\nunabhängig\nOrganisation\nLeitungsorgan\nVorstand\nGeschäftsführung\nDr. Max Stille, Niko Richter\nMitglieder/Gesellschafter\n274 stimmberechtigte Mitglieder\nAnzahl Mitarbeiter Hilfetext\nhauptamtlich: 45"
  },
  {
    "title": "OBDACH e.V. Wohnung+Betreuung+Beschäftigung für alleinstehende Menschen",
    "url": "https://www.dzi.de/organisation/obdach-e-v-wohnungbetreuungbeschaeftigung-fuer-alleinstehende-menschen/",
    "weltanschaulicheAusrichtung": "unabhängig",
    "finanzen": {
      "bezugsjahr": 2018,
      "gesamtEinnahmen": "938.806,76 EUR",
      "anteilKosten": "angemessen"
    },
    "volltext": "Arbeitsschwerpunkte\nBildungs- und Kampagnenarbeit, Einzelfallhilfe, Gesundheitshilfe\nLänderschwerpunkte\nDeutschland\nTätigkeitsfelder\nOBDACH e.V. kümmert sich um alleinstehende wohnungslose Menschen überwiegend im Stadtgebiet von Heidelberg und versucht, diese durch Hilfe zur Selbsthilfe an ein normales Leben heranzuführen. Durch persönliche Zuwendung soll die soziale Ausgrenzung überwunden werden, die Arbeitslosigkeit und Alkoholmissbrauch, Krankheit und Verwahrlosung verursacht haben. Zu diesem Zweck mietet OBDACH e.V. dezentral Wohnraum an und schließt mit den betreuten Personen Untermietverträge ab. Der Verein besitzt darüber hinaus mehrere Eigentumswohnungen. In Wohngemeinschaften finden die ehemals Wohnungslosen ein geschütztes Zuhause und Geborgenheit. Der betreute Personenkreis wird durch vom Verein angestellte Sozialarbeiterinnen und Sozialarbeiter sowie ehrenamtlich Tätige umfassend unterstützt, beispielsweise durch persönliche Gespräche oder die Begleitung bei Behörden- und Arztbesuchen sowie bei der Schuldenregulierung und Beschäftigungssuche. Des Weiteren bietet der Verein den ehemals Wohnungslosen sinnvolle Beschäftigungsmöglichkeiten etwa in Form von Heimwerkerarbeiten, Freizeitbeschäftigung oder Nachbarschaftshilfe an.\nFinanzen\nBezugsjahr:\n2018\nGesamteinnahmen:\n938.806,76 EUR\nDavon Sammlungseinnahmen Hilfetext:\n165.854,59 EUR\nAnteil Werbe- und Verwaltungskosten Hilfetext:\nangemessen\nEinschätzung durch das DZI Hilfetext\nOBDACH e.V. Wohnung + Betreuung + Beschäftigung für alleinstehende Menschen, Heidelberg, wurde das DZI Spenden-Siegel zuerkannt. Der Verein ist förderungswürdig.\nDie sieben Spenden-Siegel-Standards erfüllt der Verein wie folgt:\n1.Die Organisation leistet satzungsgemäße Arbeit.\n2.Leitung und Aufsicht sind angemessen strukturiert, klar voneinander getrennt und werden wirksam wahrgenommen.\n3.Werbung und Öffentlichkeitsarbeit informieren klar, wahr, sachlich und offen.\n4.Der Anteil der Werbe- und Verwaltungsausgaben an den Gesamtausgaben ist nach DZI-Maßstab angemessen („angemessen“ = 10% bis unter 20%). Die Wirksamkeit des Mitteleinsatzes wird überprüft, und die Ergebnisse werden dokumentiert und veröffentlicht.\n5.Die von der Organisation gezahlten Vergütungen berücksichtigen den Status der Gemeinnützigkeit, die Qualifikation, das Maß an Verantwortung und den branchenüblichen Rahmen.\n6.Mittelbeschaffung und -verwendung sowie die Vermögenslage werden nachvollziehbar dokumentiert und geprüft.\n7.Die Organisation berichtet offen und umfassend über ihre Arbeit, Strukturen und Finanzen.\nTräger des DZI Spenden-Siegels seit 15.02.1995\nKontakt\nWebsite\nwww.obdach-hd.de\nE-Mail\nverein@obdach-hd.de\nTelefon\n06221-1875520\nFax\n06221-187559920\nAnschrift\nBahnhofstaße 3\n69115 Heidelberg\nSpendenkonten\nIBAN: DE73672500200001017195\nBIC: SOLADES1HDB\nSparkasse Heidelberg\nAllgemeine Informationen\nGründungsjahr\n1987\nSitz der Organisation\nHeidelberg\nRechtsform\nVerein\nWeltanschauliche Ausrichtung\nunabhängig\nOrganisation\nLeitungsorgan\nVorstand\nGeschäftsführung\nSilke Ssymank\nMitglieder/Gesellschafter\n123 stimmberechtigte Mitglieder\nAnzahl Mitarbeiter Hilfetext\nhauptamtlich: 14 ehrenamtlich: 15"
  },
  {
    "title": "Opportunity International Deutschland (OID)",
    "url": "https://www.dzi.de/organisation/opportunity-international-deutschland-oid/",
    "weltanschaulicheAusrichtung": "christlich",
    "finanzen": {
      "bezugsjahr": 2018,
      "gesamtEinnahmen": "2.245.462,30 EUR",
      "anteilKosten": "vertretbar"
    },
    "volltext": "Arbeitsschwerpunkte\nBildung, Bildungs- und Kampagnenarbeit, Corona-Hilfe, Entwicklungszusammenarbeit, Frauenförderung\nLänderschwerpunkte\nGhana, Haiti, Indien, Indonesien, Philippinen, Uganda\nTätigkeitsfelder\nDer Arbeitsschwerpunkt von OID liegt in der Armutsbekämpfung in Entwicklungsländern, und zwar insbesondere durch die Vergabe von Kleinkrediten an mittellose Menschen. Konkret zielen die Projektmaßnahmen darauf ab, die unmittelbare Lebenssituation zu verbessern und die wirtschaftliche Kraft (Einkommensschaffung) der Armen zu fördern, indem Menschen, die nach konventionellen Kriterien keinerlei Chancen für den Erhalt eines Kredites hätten, Zugang zu finanziellen Mitteln erhalten. Das bedeutet, ein Kreditsystem ohne Garantien wie Grundbesitz oder berufliche Bildung zu schaffen und stattdessen die Eigeninitiative dieser Menschen zu fördern. Die Kleinkredite und begleitenden Trainings werden dabei speziell auf die Bedürfnisse der Kreditnehmerinnen und -nehmer abgestimmt, bei denen es sich überwiegend um Frauen handelt.\nFinanzen\nBezugsjahr:\n2018\nGesamteinnahmen:\n2.245.462,30 EUR\nDavon Sammlungseinnahmen Hilfetext:\n1.361.172,09 EUR\nAnteil Werbe- und Verwaltungskosten Hilfetext:\nvertretbar\nEinschätzung durch das DZI Hilfetext\nOpportunity International Deutschland (OID), Schorndorf, wurde das DZI Spenden-Siegel zuerkannt. Die Stiftung ist förderungswürdig.\nDie sieben Spenden-Siegel-Standards erfüllt die Stiftung wie folgt:\n1.Die Organisation leistet satzungsgemäße Arbeit.\n2.Leitung und Aufsicht sind angemessen strukturiert, klar voneinander getrennt und werden wirksam wahrgenommen.\n3.Werbung und Öffentlichkeitsarbeit informieren klar, wahr, sachlich und offen.\n4.Der Anteil der Werbe- und Verwaltungsausgaben an den Gesamtausgaben ist nach DZI-Maßstab vertretbar („vertretbar“ = 20% bis 30%). Die Wirksamkeit des Mitteleinsatzes wird überprüft, und die Ergebnisse werden dokumentiert und veröffentlicht.\n5.Die von der Organisation gezahlten Vergütungen berücksichtigen den Status der Gemeinnützigkeit, die Qualifikation, das Maß an Verantwortung und den branchenüblichen Rahmen.\n6.Mittelbeschaffung und -verwendung sowie die Vermögenslage werden nachvollziehbar dokumentiert und geprüft.\n7.Die Organisation berichtet offen und umfassend über ihre Arbeit, Strukturen und Finanzen.\nTräger des DZI Spenden-Siegels seit 19.12.2006\nKontakt\nWebsite\nwww.oid.org\nE-Mail\ninfo@oid.org\nTelefon\n0221-25081630\nFax\n0221-25081639\nAnschrift\nBremsstraße 6\n50969 Köln\nSpendenkonten\nIBAN: DE15370205000001275800\nBIC: BFSWDE33XXX\nBank für Sozialwirtschaft\nAllgemeine Informationen\nGründungsjahr\n1996\nSitz der Organisation\nSchorndorf\nRechtsform\nStiftung\nWeltanschauliche Ausrichtung\nchristlich\nOrganisation\nLeitungsorgan\nStiftungsvorstand\nAnzahl Mitarbeiter Hilfetext\nhauptamtlich: 10 ehrenamtlich: 35"
  },
  {
    "title": "Patengemeinschaft für hungernde Kinder e.V.",
    "url": "https://www.dzi.de/organisation/patengemeinschaft-fuer-hungernde-kinder-e-v/",
    "weltanschaulicheAusrichtung": "unabhängig",
    "finanzen": {
      "bezugsjahr": 2018,
      "gesamtEinnahmen": "594.642,96 EUR",
      "anteilKosten": "niedrig"
    },
    "volltext": "Arbeitsschwerpunkte\nBehindertenhilfe, Bildung, Einzelfallhilfe, Entwicklungszusammenarbeit, Familienfürsorge, Frauenförderung, Gesundheitshilfe, Kinder- und Jugendhilfe, Kinderpatenschaft\nLänderschwerpunkte\nIndien\nTätigkeitsfelder\nDie Patengemeinschaft für hungernde Kinder e.V. unterstützt Kinder und Jugendliche in mehr als 30 Kinderheimen und Ausbildungseinrichtungen in Südindien mit dem Ziel, ihnen eine Schul- und gegebenenfalls Berufsausbildung zu ermöglichen. Zu diesem Zweck bestehen vor Ort zwei Vereine indischen Rechts. Im Rahmen von Familienhilfen hilft die Organisation beim Bau von Häusern, sanitären Einrichtungen sowie mit Einrichtungsgegenständen, Bekleidung oder auch der Verteilung von Kühen und Ziegen. Außerdem engagiert sich der Verein in der Gesundheitshilfe und der Krankenpflege durch den Unterhalt einer Orthopädieklinik mit Rehabilitationszentrum und orthopädischer Werkstatt. Weitere Aktivitäten umfassen den Betrieb von Frauenausbildungszentren und Kindertagesstätten, die Unterstützung von Existenzgründungen, Hilfen für Behinderte und Taubstumme sowie bauliche Maßnahmen wie Brunnenbohrungen oder Zuschüsse zu Häuserrenovierungen. Eine Zielgruppe ist dabei die gesellschaftlich benachteiligte Bevölkerungsgruppe der Adivasi.\nFinanzen\nBezugsjahr:\n2018\nGesamteinnahmen:\n594.642,96 EUR\nDavon Sammlungseinnahmen Hilfetext:\n590.993,55 EUR\nAnteil Werbe- und Verwaltungskosten Hilfetext:\nniedrig\nEinschätzung durch das DZI Hilfetext\nDer Patengemeinschaft für hungernde Kinder e.V., Sahms, wurde das DZI Spenden-Siegel zuerkannt. Der Verein ist förderungswürdig.\nDie sieben Spenden-Siegel-Standards erfüllt der Verein wie folgt:\n1.Die Organisation leistet satzungsgemäße Arbeit.\n2.Leitung und Aufsicht sind angemessen strukturiert, klar voneinander getrennt und werden wirksam wahrgenommen.\n3.Werbung und Öffentlichkeitsarbeit informieren klar, wahr, sachlich und offen.\n4.Der Anteil der Werbe- und Verwaltungsausgaben an den Gesamtausgaben ist nach DZI-Maßstab niedrig („niedrig“ = unter 10%). Die Wirksamkeit des Mitteleinsatzes wird überprüft, und die Ergebnisse werden dokumentiert und veröffentlicht.\n5.Vergütungen (trifft nicht zu).\n6.Mittelbeschaffung und -verwendung sowie die Vermögenslage werden nachvollziehbar dokumentiert und angemessen geprüft.\n7.Die Organisation berichtet offen und umfassend über ihre Arbeit, Strukturen und Finanzen.\nTräger des DZI Spenden-Siegels seit 26.05.1995\nKontakt\nWebsite\nwww.patengemeinschaft.de\nE-Mail\ninfo@patengemeinschaft.de\nTelefon\n040-86624884\nAnschrift\nLigusterweg 21c\n22609 Hamburg\nSpendenkonten\nIBAN: DE66120300001001188810\nBIC: BYLADEM1001\nDeutsche Kreditbank\nAllgemeine Informationen\nGründungsjahr\n1969\nSitz der Organisation\nSahms\nRechtsform\nVerein\nWeltanschauliche Ausrichtung\nunabhängig\nOrganisation\nLeitungsorgan\nVorstand\nMitglieder/Gesellschafter\n69 stimmberechtigte Mitglieder\nAnzahl Mitarbeiter Hilfetext\nehrenamtlich: 15"
  },
  {
    "title": "PERSPEKTIVEN Gemeinschaft zur Unterstützung von Projekten für sozial Benachteiligte in Osteuropa e.V.",
    "url": "https://www.dzi.de/organisation/perspektiven-gemeinschaft-zur-unterstuetzung-von-projekten-fuer-sozial-benachteiligte-in-osteuropa-e-v/",
    "weltanschaulicheAusrichtung": "unabhängig",
    "finanzen": {
      "bezugsjahr": 2018,
      "gesamtEinnahmen": "673.591,10 EUR",
      "anteilKosten": "niedrig"
    },
    "volltext": "Arbeitsschwerpunkte\nBehindertenhilfe, Bildung, Einzelfallhilfe, Familienfürsorge, Gesundheitshilfe, Kinder- und Jugendhilfe, Menschenrechte\nLänderschwerpunkte\nRussische Föderation\nTätigkeitsfelder\nPerspektiven e.V. unterstützt im Raum Sankt Petersburg, Russland, angesiedelte Projekte für behinderte Kinder und Erwachsene sowie für Kinder und Jugendliche aus sozialen Risikogruppen und leistet auf diese Weise Hilfe zur Selbsthilfe. Im Bereich der Behindertenarbeit konzentriert sich die Organisation auf zwei staatliche Heime mit dem Ziel, die Lebensbedingungen der Bewohner durch ergänzende Betreuungsangebote zu verbessern. Zudem werden auch Familien mit behinderten Kindern bei deren Betreuung unterstützt und beraten. Neben der direkten Betreuung und Unterstützung leistet der Verein auch Rechtsberatung für Menschen mit Behinderungen und setzt sich im Rahmen politischer Arbeit für eine Stärkung von deren Rechten in Russland ein. Projektträger der Aktivitäten in Russland ist der in St. Petersburg ansässige Verein Perspektivy. Der russische Partnerverein ist für die Durchführung der Projektarbeit gemäß beschlossener Projekt- und Budgetanträge, für die Planung, Begleitung, Kontrolle und Evaluation der vom deutschen Verein finanzierten Aktivitäten verantwortlich. Perspektiven e.V. bietet zudem Praktikumsplätze in den Projekten für interessierte Menschen aller Altersstufen an.\nFinanzen\nBezugsjahr:\n2018\nGesamteinnahmen:\n673.591,10 EUR\nDavon Sammlungseinnahmen Hilfetext:\n337.016,55 EUR\nAnteil Werbe- und Verwaltungskosten Hilfetext:\nniedrig\nEinschätzung durch das DZI Hilfetext\nPERSPEKTIVEN Gemeinschaft zur Unterstützung von Projekten für sozial Benachteiligte in Osteuropa e.V., Nieheim, wurde das DZI Spenden-Siegel zuerkannt. Der Verein ist förderungswürdig.\nDie sieben Spenden-Siegel-Standards erfüllt der Verein wie folgt:\n1.Die Organisation leistet satzungsgemäße Arbeit.\n2.Leitung und Aufsicht sind angemessen strukturiert, klar voneinander getrennt und werden wirksam wahrgenommen.\n3.Werbung und Öffentlichkeitsarbeit informieren klar, wahr, sachlich und offen.\n4.Der Anteil der Werbe- und Verwaltungsausgaben an den Gesamtausgaben ist nach DZI-Maßstab niedrig („niedrig“ = unter 10%). Die Wirksamkeit des Mitteleinsatzes wird überprüft, und die Ergebnisse werden dokumentiert und veröffentlicht.\n5.Die von der Organisation gezahlten Vergütungen berücksichtigen den Status der Gemeinnützigkeit, die Qualifikation, das Maß an Verantwortung und den branchenüblichen Rahmen.\n6.Mittelbeschaffung und -verwendung sowie die Vermögenslage werden nachvollziehbar dokumentiert und angemessen geprüft.\n7.Die Organisation berichtet offen und umfassend über ihre Arbeit, Strukturen und Finanzen.\nTräger des DZI Spenden-Siegels seit 16.12.2009\nKontakt\nWebsite\nwww.perspektiven-verein.de\nE-Mail\nkontakt@perspektiven-verein.de\nTelefon\n039037-956087\nAnschrift\nc/o Thomas Seifert, Klein Gartz 10\n29410 Salzwedel\nSpendenkonten\nIBAN: DE94370205000007155100\nBIC: BFSWDE33XXX\nBank für Sozialwirtschaft\nAllgemeine Informationen\nGründungsjahr\n1992\nSitz der Organisation\nNieheim\nRechtsform\nVerein\nWeltanschauliche Ausrichtung\nunabhängig\nOrganisation\nLeitungsorgan\nVorstand\nGeschäftsführung\nThomas Seifert\nMitglieder/Gesellschafter\n39 stimmberechtigte Mitglieder\nAnzahl Mitarbeiter Hilfetext\nhauptamtlich: 1 ehrenamtlich: 10"
  },
  {
    "title": "Rambazotti – internationaler Kinder- und Jugendcircus e.V.",
    "url": "https://www.dzi.de/organisation/rambazotti-internationaler-kinder-und-jugendcircus-e-v/",
    "weltanschaulicheAusrichtung": "unabhängig",
    "finanzen": {
      "bezugsjahr": 2017,
      "gesamtEinnahmen": "349.274,68 EUR",
      "anteilKosten": "angemessen"
    },
    "volltext": "Arbeitsschwerpunkte\nBehindertenhilfe, Bildung, Gesundheitshilfe, Kinder- und Jugendhilfe, Sport, Straffälligenhilfe, Völkerverständigung\nLänderschwerpunkte\nDeutschland\nTätigkeitsfelder\nDer Verein betreibt den Circus „Rambazotti“, in dem Kinder und Jugendliche auftreten. Teil dieses pädagogischen Gesamtprojekts, das überwiegend als Zweckbetrieb geführt wird, sind wöchentliche Trainingsstunden, Wochenend-Workshops und Tourneen im In- und Ausland, in denen die Kinder und Jugendlichen Selbstständigkeit und Verantwortung sowie einen konstruktiven, vielseitigen und positiven Umgang mit sich und ihrer Umwelt erlernen sollen. Darüber hinaus unterhält der Verein ein „Circus-(Pädagogik-)Haus“, einen eigenen „Circuswagen“, betreibt einen „Circusladen“, der die entsprechenden Utensilien anbietet, sowie ein Café. Für Kinder mit physischen oder psychischen Defiziten oder Behinderungen hält die Organisation besondere therapeutische Angebote bereit.\nFinanzen\nBezugsjahr:\n2017\nGesamteinnahmen:\n349.274,68 EUR\nDavon Sammlungseinnahmen Hilfetext:\n187.633,43 EUR\nAnteil Werbe- und Verwaltungskosten Hilfetext:\nangemessen\nEinschätzung durch das DZI Hilfetext\nRambazotti – internationaler Kinder- und Jugendcircus e.V., Kassel, wurde das DZI Spenden-Siegel zuerkannt. Der Verein ist förderungswürdig.\nDie sieben Spenden-Siegel-Standards erfüllt der Verein wie folgt:\n1.Die Organisation leistet satzungsgemäße Arbeit.\n2.Leitung und Aufsicht sind angemessen strukturiert, klar voneinander getrennt und werden wirksam wahrgenommen.\n3.Werbung und Öffentlichkeitsarbeit informieren klar, wahr, sachlich und offen.\n4.Der Anteil der Werbe- und Verwaltungsausgaben an den Gesamtausgaben ist nach DZI-Maßstab angemessen („angemessen“ = 10% bis unter 20%). Die Wirksamkeit des Mitteleinsatzes wird überprüft, und die Ergebnisse werden dokumentiert und veröffentlicht.\n5.Die von der Organisation gezahlten Vergütungen berücksichtigen den Status der Gemeinnützigkeit, die Qualifikation, das Maß an Verantwortung und den branchenüblichen Rahmen.\n6.Mittelbeschaffung und -verwendung sowie die Vermögenslage werden nachvollziehbar dokumentiert und angemessen geprüft.\n7.Die Organisation berichtet offen und umfassend über ihre Arbeit, Strukturen und Finanzen.\nTräger des DZI Spenden-Siegels seit 07.10.2010\nKontakt\nWebsite\nwww.rambazotti.de\nE-Mail\ninfo@rambazotti.de\nTelefon\n0561-44440\nFax\n0561-31690040\nAnschrift\nLudwig-Erhard-Straße 21\n34131 Kassel\nSpendenkonten\nIBAN: DE86520503530001234561\nBIC: HELADEF1KAS\nKasseler Sparkasse\nAllgemeine Informationen\nGründungsjahr\n1995\nSitz der Organisation\nKassel\nRechtsform\nVerein\nWeltanschauliche Ausrichtung\nunabhängig\nOrganisation\nLeitungsorgan\nVorstand\nGeschäftsführung\nIris Riedmüller\nMitglieder/Gesellschafter\n36 stimmberechtigte Mitglieder\nAnzahl Mitarbeiter Hilfetext\nhauptamtlich: 5 ehrenamtlich: 38"
  },
  {
    "title": "Reiner Meutsch Stiftung – fly and help",
    "url": "https://www.dzi.de/organisation/reiner-meutsch-stiftung-fly-and-help/",
    "weltanschaulicheAusrichtung": "unabhängig",
    "finanzen": {
      "bezugsjahr": 2019,
      "gesamtEinnahmen": "5.344.732,32 EUR",
      "anteilKosten": "niedrig"
    },
    "volltext": "Arbeitsschwerpunkte\nBildung, Entwicklungszusammenarbeit, Kinder- und Jugendhilfe\nLänderschwerpunkte\nArgentinien, Äthiopien, Bolivien, Botsuana, Brasilien, Burkina Faso, Burundi, Demokratische Republik Kongo, Dominikanische Republik, Ghana, Guatemala, Haiti, Indien, Indonesien, Kambodscha, Kenia, Kuba, Laos, Liberia, Madagaskar, Malawi, Mali, Myanmar, Namibia, Nepal, Nicaragua, Nigeria, Peru, Philippinen, Ruanda, Salomonen, Sambia, Senegal, Sierra Leone, Sri Lanka, Südafrika, Sudan, Südsudan, Tansania, Togo, Tschad, Türkei, Uganda, Vietnam\n… mehr\nTätigkeitsfelder\nDie Reiner Meutsch Stiftung – fly and help engagiert sich in der Entwicklungszusammenarbeit. Sie unterstützt in verschiedenen Ländern vor allem Projekte, die sich für die schulische Ausbildung von Kindern und Jugendlichen einsetzen. Die Fördergelder werden insbesondere für Bauinvestitionen und die Ausstattung von Schulen verwendet, beispielsweise für den Bau neuer Klassenräume, die Verbesserung der hygienischen Situation sowie die Finanzierung von Lehrern und Lehrmaterialien.\nFinanzen\nBezugsjahr:\n2019\nGesamteinnahmen:\n5.344.732,32 EUR\nDavon Sammlungseinnahmen Hilfetext:\n4.755.026,47 EUR\nAnteil Werbe- und Verwaltungskosten Hilfetext:\nniedrig\nEinschätzung durch das DZI Hilfetext\nDer Reiner Meutsch Stiftung – fly and help, Kroppach, wurde das DZI Spenden-Siegel zuerkannt. Die Stiftung ist förderungswürdig.\nDie sieben Spenden-Siegel-Standards erfüllt die Stiftung wie folgt:\n1.Die Organisation leistet satzungsgemäße Arbeit.\n2.Leitung und Aufsicht sind angemessen strukturiert, klar voneinander getrennt und werden wirksam wahrgenommen.\n3.Werbung und Öffentlichkeitsarbeit informieren klar, wahr, sachlich und offen.\n4.Der Anteil der Werbe- und Verwaltungsausgaben an den Gesamtausgaben ist nach DZI-Maßstab niedrig („niedrig“ = unter 10%). Die Wirksamkeit des Mitteleinsatzes wird überprüft, und die Ergebnisse werden dokumentiert und veröffentlicht.\n5.Vergütungen (trifft nicht zu).\n6.Mittelbeschaffung und -verwendung sowie die Vermögenslage werden nachvollziehbar dokumentiert und angemessen geprüft.\n7.Die Organisation berichtet offen und umfassend über ihre Arbeit, Strukturen und Finanzen.\nTräger des DZI Spenden-Siegels seit 15.07.2014\nKontakt\nWebsite\nwww.fly-and-help.de\nE-Mail\ninfo@fly-and-help.de\nTelefon\n02688-989011\nFax\n02688-989013\nAnschrift\nLangstraße 10\n57612 Kroppach\nSpendenkonten\nIBAN: DE94573918000000005550\nBIC: GENODE51WW1\nWesterwald Bank\nAllgemeine Informationen\nGründungsjahr\n2009\nSitz der Organisation\nKroppach\nRechtsform\nStiftung\nWeltanschauliche Ausrichtung\nunabhängig\nOrganisation\nLeitungsorgan\nVorstand\nGeschäftsführung\nJürgen Schumacher\nAnzahl Mitarbeiter Hilfetext\nehrenamtlich: 13"
  },
  {
    "title": "Samaritan´s Purse e.V.",
    "url": "https://www.dzi.de/organisation/samaritans-purse-e-v/",
    "weltanschaulicheAusrichtung": "christlich",
    "finanzen": {
      "bezugsjahr": 2019,
      "gesamtEinnahmen": "23.522.526,85 EUR",
      "anteilKosten": "angemessen"
    },
    "volltext": "Arbeitsschwerpunkte\nCorona-Hilfe, Entwicklungszusammenarbeit, Flüchtlingsfürsorge, Gesundheitshilfe, Katastrophenhilfe, Kinder- und Jugendhilfe, Religion\nLänderschwerpunkte\nBahamas, Bangladesch, Georgien, Indien, Indonesien, Irak, Kambodscha, Kongo, Lettland, Litauen, Montenegro, Mosambik, Myanmar, Nordmazedonien, Philippinen, Polen, Republik Moldau, Rumänien, Serbien, Slowakei, Thailand, Uganda, Ukraine\n… mehr\nTätigkeitsfelder\nSamaritan’s Purse e.V. (ehemals Geschenke der Hoffnung e.V.) ist ein christliches Hilfswerk und Zweig der amerikanischen Organisation „Samaritan´s Purse“. Der Verein hat seine Wurzeln in der im Jahre 1950 in den USA errichteten Organisation „Billy Graham Evangelistic Association“, die nach ihrem Gründer, dem amerikanischen Evangelisten und Baptistenpastor Billy Graham, benannt ist. Ziel der amerikanischen Organisation ist die Verbreitung der christlichen Botschaft insbesondere mittels Evangelisationskampagnen. Die Schwerpunkte der deutschen Vereinsarbeit liegen neben der Weitergabe des Evangeliums in der humanitären Hilfe sowie der Unterstützung von bedürftigen Kindern und Familien im Rahmen der Entwicklungszusammenarbeit. Einen besonderen Arbeitsschwerpunkt des Vereins bildet die Aktion „Weihnachten im Schuhkarton®“. Mit dieser Maßnahme werden Spender sowohl um Sach- als auch um Geldspenden gebeten. Der Verein wirbt darum, Schuhkartons mit Geschenken wie Spielzeug, Kleidung, Schulmaterialien sowie Hygieneartikeln zu packen. Die gesammelten Pakete werden über christliche Gemeinden an bedürftige Kinder, vor allem in Osteuropa, verteilt. Bei der Verteilung wird von den Gemeinden dort, wo es erlaubt und erwünscht ist, zusätzlich ein Heft mit biblischen Geschichten angeboten, die den Grund für das Weihnachtsfest erläutern. Die Auswahl der bedürftigen Kinder erfolgt häufig in Kooperation mit örtlichen Sozialämtern. „Weihnachten im Schuhkarton“ ist Teil der weltweiten Aktion „Operation Christmas Child“, die von „Samaritan´s Purse“(USA) getragen wird. Darüber hinaus unterstützt der deutsche Verein weitere, unter anderem von Samaritan´s Purse (USA) geförderte Entwicklungsprojekte, wie beispielsweise Maßnahmen der medizinischen Versorgung, der Existenzsicherung, der Flüchtlingsfürsorge, der Katastrophenhilfe oder der Versorgung mit sauberem Wasser.\nFinanzen\nBezugsjahr:\n2019\nGesamteinnahmen:\n23.522.526,85 EUR\nDavon Sammlungseinnahmen Hilfetext:\n22.614.916,55 EUR\nAnteil Werbe- und Verwaltungskosten Hilfetext:\nangemessen\nEinschätzung durch das DZI Hilfetext\nSamaritan´s Purse e.V., Berlin, wurde das DZI Spenden-Siegel zuerkannt. Der Verein ist förderungswürdig.\nDie sieben Spenden-Siegel-Standards erfüllt der Verein wie folgt:\n1.Die Organisation leistet satzungsgemäße Arbeit.\n2.Leitung und Aufsicht sind angemessen strukturiert, klar voneinander getrennt und werden wirksam wahrgenommen.\n3.Werbung und Öffentlichkeitsarbeit informieren klar, wahr, sachlich und offen.\n4.Der Anteil der Werbe- und Verwaltungsausgaben an den Gesamtausgaben ist nach DZI-Maßstab angemessen („angemessen“ = 10% bis unter 20%). Die Wirksamkeit des Mitteleinsatzes wird überprüft, und die Ergebnisse werden dokumentiert und veröffentlicht.\n5.Die von der Organisation gezahlten Vergütungen berücksichtigen den Status der Gemeinnützigkeit, die Qualifikation, das Maß an Verantwortung und den branchenüblichen Rahmen.\n6.Mittelbeschaffung und -verwendung sowie die Vermögenslage werden nachvollziehbar dokumentiert und angemessen geprüft.\n7.Die Organisation berichtet offen und umfassend über ihre Arbeit, Strukturen und Finanzen.\nTräger des DZI Spenden-Siegels seit 23.05.2003\nKontakt\nWebsite\nwww.die-samariter.org\nE-Mail\ninfo@die-samariter.org\nTelefon\n030-76883300\nFax\n030-76883333\nAnschrift\nHaynauer Straße 72a\n12249 Berlin\nSpendenkonten\nIBAN: DE12370601935544332211\nBIC: GENODED1PAX\nPax-Bank\nAllgemeine Informationen\nGründungsjahr\n1963\nSitz der Organisation\nBerlin\nRechtsform\nVerein\nWeltanschauliche Ausrichtung\nchristlich\nOrganisation\nLeitungsorgan\nVorstand\nMitglieder/Gesellschafter\n11 stimmberechtigte Mitglieder\nAnzahl Mitarbeiter Hilfetext\nhauptamtlich: 69 ehrenamtlich: 10400"
  },
  {
    "title": "Save the Children Deutschland e.V.",
    "url": "https://www.dzi.de/organisation/save-the-children-deutschland-e-v/",
    "weltanschaulicheAusrichtung": "unabhängig",
    "finanzen": {
      "bezugsjahr": 2019,
      "gesamtEinnahmen": "43.806.312,58 EUR",
      "anteilKosten": "angemessen"
    },
    "volltext": "Arbeitsschwerpunkte\nBildung, Corona-Hilfe, Entwicklungszusammenarbeit, Gesundheitshilfe, Katastrophenhilfe, Kinder- und Jugendhilfe, Menschenrechte\nLänderschwerpunkte\nAfghanistan, Ägypten, Äthiopien, Bangladesch, Demokratische Republik Kongo, Deutschland, Guatemala, Indien, Indonesien, Irak, Jemen, Jordanien, Kenia, Libanon, Mosambik, Myanmar, Palästinensische Gebiete, Somalia, Südsudan, Syrien, Tansania, Türkei, Uganda\n… mehr\nTätigkeitsfelder\nSave the Children Deutschland e.V. ist der deutsche Zweig des 1919 in England gegründeten Kinderhilfswerks Save the Children, das sich weltweit insbesondere für das Wohlergehen und die Rechte von Kindern einsetzt. Insgesamt 30 nationale Mitgliedsorganisationen sind in dem Netzwerk „Save the Children International“ mit Sitz in London zusammengeschlossen. Mit eigenen Programmen und Projekten für bessere Lebensbedingungen von Kindern und Familien ist die Gesamtorganisation in rund 120 Ländern der Welt tätig. In Kriegsfällen und bei Naturkatastrophen leistet das Netzwerk Not- und Wiederaufbauhilfe. Zu den langfristig angelegten Arbeitsschwerpunkten von Save the Children Deutschland e.V. gehören insbesondere Themen wie Gesundheit, Bildung und Schutz für die am stärksten benachteiligten Kinder der Welt.\nFinanzen\nBezugsjahr:\n2019\nGesamteinnahmen:\n43.806.312,58 EUR\nDavon Sammlungseinnahmen Hilfetext:\n20.804.872,21 EUR\nAnteil Werbe- und Verwaltungskosten Hilfetext:\nangemessen\nEinschätzung durch das DZI Hilfetext\nSave the Children Deutschland e.V., Berlin, wurde das Spenden-Siegel zuerkannt. Der Verein ist förderungswürdig.\nDie sieben Spenden-Siegel-Standards erfüllt der Verein wie folgt:\n1.Die Organisation leistet satzungsgemäße Arbeit.\n2.Leitung und Aufsicht sind angemessen strukturiert, klar voneinander getrennt und werden wirksam wahrgenommen.\n3.Werbung und Öffentlichkeitsarbeit informieren klar, wahr, sachlich und offen.\n4.Der Anteil der Werbe- und Verwaltungsausgaben an den Gesamtausgaben ist nach DZI-Maßstab angemessen („angemessen“ = 10% bis unter 20%). Die Wirksamkeit des Mitteleinsatzes wird überprüft, und die Ergebnisse werden dokumentiert und veröffentlicht.\n5.Die von der Organisation gezahlten Vergütungen berücksichtigen den Status der Gemeinnützigkeit, die Qualifikation, das Maß an Verantwortung und den branchenüblichen Rahmen.\n6.Mittelbeschaffung und -verwendung sowie die Vermögenslage werden nachvollziehbar dokumentiert und angemessen geprüft.\n7.Die Organisation berichtet offen und umfassend über ihre Arbeit, Strukturen und Finanzen.\nTräger des DZI Spenden-Siegels seit 28.09.2011\nKontakt\nWebsite\nwww.savethechildren.de\nE-Mail\ninfo@savethechildren.de\nTelefon\n030-275959790\nFax\n030-275959799\nAnschrift\nSeesener Straße 10-13\n10709 Berlin\nSpendenkonten\nIBAN: DE92100205000003292912\nBIC: BFSWDE33BER\nBank für Sozialwirtschaft\nAllgemeine Informationen\nGründungsjahr\n2004\nSitz der Organisation\nBerlin\nRechtsform\nVerein\nWeltanschauliche Ausrichtung\nunabhängig\nOrganisation\nLeitungsorgan\nVorstand\nGeschäftsführung\nSusanna Krüger\nMitglieder/Gesellschafter\n36 stimmberechtigte Mitglieder\nAnzahl Mitarbeiter Hilfetext\nhauptamtlich: 144 ehrenamtlich: 36"
  },
  {
    "title": "Tabitha Global Care Germany e.V.",
    "url": "https://www.dzi.de/organisation/tabitha-global-care-germany-e-v/",
    "weltanschaulicheAusrichtung": "christlich",
    "finanzen": {
      "bezugsjahr": 2018,
      "gesamtEinnahmen": "286.446,80 EUR",
      "anteilKosten": "niedrig"
    },
    "volltext": "Arbeitsschwerpunkte\nAids, Behindertenhilfe, Bildung, Einzelfallhilfe, Entwicklungszusammenarbeit, Familienfürsorge, Flüchtlingsfürsorge, Frauenförderung, Gesundheitshilfe, Kinder- und Jugendhilfe, Kinderpatenschaft, Religion\nLänderschwerpunkte\nDemokratische Republik Kongo, Sambia, Uganda\nTätigkeitsfelder\nIm Mittelpunkt der Arbeit von Tabitha Global Care Germany e.V. steht die Unterstützung von Kindern, Familien und ihrem Umfeld im Kampf gegen Armut. Dazu betreibt der Verein Projekte in verschiedenen Bereichen wie Bildung, Trinkwasserversorgung, Gesundheit und Hygiene sowie Landwirtschaft und Nutztierhaltung. Die räumlichen Schwerpunkte liegen dabei in Uganda und Sambia. Hauptprojekt des Vereins ist das Tabitha Village in Kawolokota, Uganda. Hier hat die Organisation für sehr bedürftige Familien kleine Häuser und eine Schule errichtet, in der 120 Kinder unterrichtet werden können. In einem Community Center finden Seminare, Hygieneschulungen, Mikrofinanz-Trainings, Lebensberatungen und Gottesdienste statt. Ein weiterer Schwerpunkt liegt im Bau von Trinkwasserbrunnen. Ein Teil der Projektarbeit wird durch Patenschaften ermöglicht.\nFinanzen\nBezugsjahr:\n2018\nGesamteinnahmen:\n286.446,80 EUR\nDavon Sammlungseinnahmen Hilfetext:\n262.852,67 EUR\nAnteil Werbe- und Verwaltungskosten Hilfetext:\nniedrig\nEinschätzung durch das DZI Hilfetext\nTabitha Global Care Germany e.V., Fritzlar, wurde das DZI Spenden-Siegel zuerkannt. Der Verein ist förderungswürdig.\nDie sieben Spenden-Siegel-Standards erfüllt der Verein wie folgt:\n1.Die Organisation leistet satzungsgemäße Arbeit.\n2.Leitung und Aufsicht sind angemessen strukturiert, klar voneinander getrennt und werden wirksam wahrgenommen.\n3.Werbung und Öffentlichkeitsarbeit informieren klar, wahr, überwiegend sachlich und offen.\n4.Der Anteil der Werbe- und Verwaltungsausgaben an den Gesamtausgaben ist nach DZI-Maßstab niedrig („niedrig“ = unter 10%). Die Wirksamkeit des Mitteleinsatzes wird überprüft, und die Ergebnisse werden dokumentiert und veröffentlicht.\n5.Vergütungen (trifft nicht zu).\n6.Mittelbeschaffung und -verwendung sowie die Vermögenslage werden nachvollziehbar dokumentiert und angemessen geprüft.\n7.Die Organisation berichtet offen und hinreichend umfassend über ihre Arbeit, Strukturen und Finanzen.\nTräger des DZI Spenden-Siegels seit 20.11.2019\nKontakt\nWebsite\nwww.tabithaglobalcare.com\nE-Mail\nkontakt@tabithaglobalcare.com\nTelefon\n05622-916545\nAnschrift\nÜber den Bergen 6a\n34560 Fritzlar\nSpendenkonten\nIBAN: DE77520626010000222224\nBIC: GENODEF1HRV\nVR PartnerBank Chattengau-Schwalm-Eder\nAllgemeine Informationen\nGründungsjahr\n2016\nSitz der Organisation\nFritzlar\nRechtsform\nVerein\nWeltanschauliche Ausrichtung\nchristlich\nOrganisation\nLeitungsorgan\nVorstand\nMitglieder/Gesellschafter\n29 stimmberechtigte Mitglieder\nAnzahl Mitarbeiter Hilfetext\nehrenamtlich: 50"
  },
  {
    "title": "Tafel Deutschland e.V.",
    "url": "https://www.dzi.de/organisation/tafel-deutschland-e-v/",
    "weltanschaulicheAusrichtung": "unabhängig",
    "finanzen": {
      "bezugsjahr": 2018,
      "gesamtEinnahmen": "8.172.202,14 EUR",
      "anteilKosten": "angemessen"
    },
    "volltext": "Arbeitsschwerpunkte\nAltenhilfe, Bildungs- und Kampagnenarbeit, Corona-Hilfe, Familienfürsorge, Flüchtlingsfürsorge, Kinder- und Jugendhilfe, Kultur, Umwelt- und Naturschutz\nLänderschwerpunkte\nDeutschland\nTätigkeitsfelder\nDie Tafel Deutschland e.V. ist die Dachorganisation der über 900 lokalen Tafeln, die ihrerseits rechtlich selbstständig sind oder aber in Trägerschaft eines gemeinnützigen Wohlfahrtsverbands arbeiten. Sie geben überschüssige, beanstandungsfreie Lebensmittel aus Produktion, Handel und Gastronomie kostenlos oder zu einem symbolischen Beitrag an bedürftige Menschen ab. Der Verband mit seinen bundesweit mehr als 2.000 Ausgabestellen wird von rund 40.000 ehrenamt-lichen Helferinnen und Helfern sowie unzähligen kleinen und großen Unternehmen unterstützt. Die Angebote der Tafeln werden nach Angaben des Verbands regelmäßig von mehr als einer Million Menschen in Anspruch genommen. Hauptaufgaben der Tafel Deutschland sind die Vermittlung von Sponsorenleistungen für die Tafeln, die Förderung ausgewählter Tafelprojekte, die Interessenvertretung gegenüber Politik, Wirtschaft und Gesellschaft, die Unterstützung seiner Mitglieder durch Wissensaustausch, Weiterbildung und Beratung sowie Hilfestellungen bei Neugründungen von örtlichen Tafeln.\nFinanzen\nBezugsjahr:\n2018\nGesamteinnahmen:\n8.172.202,14 EUR\nDavon Sammlungseinnahmen Hilfetext:\n6.822.093,64 EUR\nAnteil Werbe- und Verwaltungskosten Hilfetext:\nangemessen\nEinschätzung durch das DZI Hilfetext\nDer Tafel Deutschland e.V., Berlin, wurde das DZI Spenden-Siegel zuerkannt. Der Verein ist förderungswürdig.\nDie sieben Spenden-Siegel-Standards erfüllt der Verein wie folgt:\n1.Die Organisation leistet satzungsgemäße Arbeit.\n2.Leitung und Aufsicht sind hinreichend angemessen strukturiert, klar voneinander getrennt und werden wirksam wahrgenommen.\n3.Werbung und Öffentlichkeitsarbeit informieren klar, wahr, sachlich und offen.\n4.Der Anteil der Werbe- und Verwaltungsausgaben an den Gesamtausgaben ist nach DZI-Maßstab angemessen („angemessen“ = 10% bis unter 20%). Die Wirksamkeit des Mitteleinsatzes wird überprüft, und die Ergebnisse werden dokumentiert und veröffentlicht.\n5.Die von der Organisation gezahlten Vergütungen berücksichtigen den Status der Gemeinnützigkeit, die Qualifikation, das Maß an Verantwortung und den branchenüblichen Rahmen.\n6.Mittelbeschaffung und -verwendung sowie die Vermögenslage werden nachvollziehbar dokumentiert und angemessen geprüft.\n7.Die Organisation berichtet offen und umfassend über ihre Arbeit, Strukturen und Finanzen.\nTräger des DZI Spenden-Siegels seit 10.12.2010\nKontakt\nWebsite\nwww.tafel.de\nE-Mail\ninfo@tafel.de\nTelefon\n030-20059760\nFax\n030-200597616\nAnschrift\nGermaniastraße 18\n12099 Berlin\nSpendenkonten\nIBAN: DE63100205000001118500\nBIC: BFSWDE33BER\nBank für Sozialwirtschaft\nAllgemeine Informationen\nGründungsjahr\n1996\nSitz der Organisation\nBerlin\nRechtsform\nVerein\nWeltanschauliche Ausrichtung\nunabhängig\nOrganisation\nLeitungsorgan\nVorstand\nGeschäftsführung\nEvelin Schulz\nMitglieder/Gesellschafter\n947 stimmberechtigte Mitglieder\nAnzahl Mitarbeiter Hilfetext\nhauptamtlich: 25 ehrenamtlich: 48"
  },
  {
    "title": "UNO-Flüchtlingshilfe e.V.",
    "url": "https://www.dzi.de/organisation/uno-fluechtlingshilfe-e-v/",
    "weltanschaulicheAusrichtung": "unabhängig",
    "finanzen": {
      "bezugsjahr": 2018,
      "gesamtEinnahmen": "33.011.106,88 EUR",
      "anteilKosten": "vertretbar"
    },
    "volltext": "Arbeitsschwerpunkte\nBildung, Flüchtlingsfürsorge, Gesundheitshilfe, Katastrophenhilfe, Menschenrechte\nLänderschwerpunkte\nÄgypten, Äthiopien, Bangladesch, Brasilien, Demokratische Republik Kongo, Deutschland, Ecuador, Griechenland, Indonesien, Irak, Italien, Jemen, Jordanien, Kamerun, Kenia, Kolumbien, Libyen, Marokko, Niger, Nigeria, Peru, Somalia, Spanien, Südsudan, Syrien, Tschad, Türkei, Uganda, Venezuela, Zentralafrikanische Republik\n… mehr\nTätigkeitsfelder\nDie UNO-Flüchtlingshilfe ist der deutsche Partner des Flüchtlingshilfswerks der Vereinten Nationen (UNHCR). Ziel der Organisation ist es, das Leben von Flüchtlingen zu schützen und dazu beizutragen, dass alle Flüchtlinge ihr Schicksal wieder in die eigene Hand nehmen können. Insbesondere unterstützt die UNO-Flüchtlingshilfe die direkte Nothilfe im akuten Krisenfall, Aus- und Weiterbildungsprogramme für eine bessere Zukunft und Hilfsprogramme für freiwillig zurückkehrende Flüchtlinge. Hinzu kommen zahlreiche Projekte für Geflüchtete in Deutschland, vor allem im Bereich der psychosozialen Therapie für traumatisierte Flüchtlinge und der Asylverfahrensberatung. Mit gezielter Öffentlichkeitsarbeit informiert die Organisation über Fluchtursachen und -folgen, um so das Verständnis für das Schicksal der Flüchtlinge zu vertiefen.\nFinanzen\nBezugsjahr:\n2018\nGesamteinnahmen:\n33.011.106,88 EUR\nDavon Sammlungseinnahmen Hilfetext:\n26.605.062,80 EUR\nAnteil Werbe- und Verwaltungskosten Hilfetext:\nvertretbar\nEinschätzung durch das DZI Hilfetext\nUNO-Flüchtlingshilfe e.V., Bonn, wurde das DZI Spenden-Siegel zuerkannt. Der Verein ist förderungswürdig.\nDie sieben Spenden-Siegel-Standards erfüllt der Verein wie folgt:\n1.Die Organisation leistet satzungsgemäße Arbeit.\n2.Leitung und Aufsicht sind angemessen strukturiert, klar voneinander getrennt und werden wirksam wahrgenommen.\n3.Werbung und Öffentlichkeitsarbeit informieren klar, wahr, sachlich und offen.\n4.Der Anteil der Werbe- und Verwaltungsausgaben an den Gesamtausgaben ist nach DZI-Maßstab vertretbar („vertretbar“ = 20% bis 30%). Die Wirksamkeit des Mitteleinsatzes wird überprüft, und die Ergebnisse werden dokumentiert und in hinreichendem Maße veröffentlicht.\n5.Die von der Organisation gezahlten Vergütungen berücksichtigen den Status der Gemeinnützigkeit, die Qualifikation, das Maß an Verantwortung und den branchenüblichen Rahmen.\n6.Mittelbeschaffung und -verwendung sowie die Vermögenslage werden nachvollziehbar dokumentiert und angemessen Maße geprüft.\n7.Die Organisation berichtet offen und hinreichend umfassend über ihre Arbeit, Strukturen und Finanzen.\nTräger des DZI Spenden-Siegels seit 10.04.2003\nKontakt\nWebsite\nwww.uno-fluechtlingshilfe.de\nE-Mail\ninfo@uno-fluechtlingshilfe.de\nTelefon\n0228-90908600\nFax\n0228-90908601\nAnschrift\nGraurheindorfer Straße 149a\n53117 Bonn\nSpendenkonten\nIBAN: DE78370501980020008850\nBIC: COLSDE33\nSparkasse KölnBonn\nAllgemeine Informationen\nGründungsjahr\n1980\nSitz der Organisation\nBonn\nRechtsform\nVerein\nWeltanschauliche Ausrichtung\nunabhängig\nOrganisation\nLeitungsorgan\nVorstand\nGeschäftsführung\nPeter Ruhenstroth-Bauer\nMitglieder/Gesellschafter\n98 stimmberechtigte Mitglieder\nAnzahl Mitarbeiter Hilfetext\nhauptamtlich: 46 ehrenamtlich: 7"
  },
  {
    "title": "Verein Programm Klasse 2000 e.V.",
    "url": "https://www.dzi.de/organisation/verein-programm-klasse-2000-e-v/",
    "weltanschaulicheAusrichtung": "unabhängig",
    "finanzen": {
      "bezugsjahr": 2019,
      "gesamtEinnahmen": "5.075.072,98 EUR",
      "anteilKosten": "angemessen"
    },
    "volltext": "Arbeitsschwerpunkte\nBildung, Gesundheitshilfe, Kinder- und Jugendhilfe, Suchthilfe\nLänderschwerpunkte\nDeutschland\nTätigkeitsfelder\nDer Verein führt das Unterrichtsprogramm Klasse2000 zur Gesundheitsförderung, Gewalt- und Suchtprävention in Grund- und Förderschulen durch. Das Programm wurde 1991 am Institut für Präventive Pneumologie des Klinikums Nürnberg entwickelt und wird seitdem laufend überarbeitet sowie evaluiert. Klasse2000 begleitet Kinder von Klasse 1 bis 4. Pro Schuljahr führen Lehrkräfte sowie durch den Verein speziell geschulte Gesundheitsfördererinnen und -förderer zirka 15 Klasse2000-Stunden durch. Ziel ist es, die Gesundheits- und Lebenskompetenzen der Kinder zu stärken: Sie sollen eine positive Einstellung zur Gesundheit gewinnen und erfahren, was sie selbst tun können, damit es ihnen gut geht. Die Themen reichen von Ernährung, Bewegung und Entspannung bis hin zur gewaltfreien Konfliktlösung, zum angemessenen Umgang mit unangenehmen Gefühlen und Nein-Sagen zu Rauchen und Alkohol. Positive Wirkungen des Programms auf das Ernährungs- und Bewegungsverhalten während der Grundschulzeit sowie auf den Konsum von Zigaretten und Alkohol im Jugendalter sind durch wissenschaftliche Studien belegt. Die Finanzierung des Programms erfolgt über Spenden und Fördergelder, meist in Form von Patenschaften für einzelne Klassen. Wichtigster Partner des Vereins sind die Lions Clubs in Deutschland.\nFinanzen\nBezugsjahr:\n2019\nGesamteinnahmen:\n5.075.072,98 EUR\nDavon Sammlungseinnahmen Hilfetext:\n950.572,43 EUR\nAnteil Werbe- und Verwaltungskosten Hilfetext:\nangemessen\nEinschätzung durch das DZI Hilfetext\nDem Verein Programm Klasse 2000 e.V., Nürnberg, wurde das DZI Spenden-Siegel zuerkannt. Der Verein ist förderungswürdig.\nDie sieben Spenden-Siegel-Standards erfüllt der Verein wie folgt:\n1.Die Organisation leistet satzungsgemäße Arbeit.\n2.Leitung und Aufsicht sind angemessen strukturiert, klar voneinander getrennt und werden wirksam wahrgenommen.\n3.Werbung und Öffentlichkeitsarbeit informieren klar, wahr, sachlich und offen.\n4.Der Anteil der Werbe- und Verwaltungsausgaben an den Gesamtausgaben ist nach DZI-Maßstab angemessen („angemessen“ = 10% bis unter 20%). Die Wirksamkeit des Mitteleinsatzes wird überprüft, und die Ergebnisse werden dokumentiert und veröffentlicht.\n5.Die von der Organisation gezahlten Vergütungen berücksichtigen den Status der Gemeinnützigkeit, die Qualifikation, das Maß an Verantwortung und den branchenüblichen Rahmen.\n6.Mittelbeschaffung und -verwendung sowie die Vermögenslage werden nachvollziehbar dokumentiert und angemessen geprüft.\n7.Die Organisation berichtet offen und umfassend über ihre Arbeit, Strukturen und Finanzen.\nTräger des DZI Spenden-Siegels seit 15.06.2005\nKontakt\nWebsite\nwww.klasse2000.de\nE-Mail\ninfo@klasse2000.de\nTelefon\n0911-891210\nFax\n0911-8912130\nAnschrift\nFeldgasse 37\n90489 Nürnberg\nSpendenkonten\nIBAN: DE87760606180000001600\nBIC: GENODEF1NO2\nVolksbank Raiffeisenbank Nürnberg\nAllgemeine Informationen\nGründungsjahr\n2002\nSitz der Organisation\nNürnberg\nRechtsform\nVerein\nWeltanschauliche Ausrichtung\nunabhängig\nOrganisation\nLeitungsorgan\nVorstand\nGeschäftsführung\nThomas Duprée\nMitglieder/Gesellschafter\n26 stimmberechtigte Mitglieder\nAnzahl Mitarbeiter Hilfetext\nhauptamtlich: 33 ehrenamtlich: 6"
  },
  {
    "title": "Verein zur Förderung der Städtepartnerschaft Kreuzberg – San Rafael del Sur e.V.",
    "url": "https://www.dzi.de/organisation/verein-zur-foerderung-der-staedtepartnerschaft-kreuzberg-san-rafael-del-sur-e-v/",
    "weltanschaulicheAusrichtung": "unabhängig",
    "finanzen": {
      "bezugsjahr": 2018,
      "gesamtEinnahmen": "136.494,93 EUR",
      "anteilKosten": "niedrig"
    },
    "volltext": "Arbeitsschwerpunkte\nBildung, Bildungs- und Kampagnenarbeit, Entwicklungszusammenarbeit, Frauenförderung, Gesundheitshilfe, Katastrophenhilfe, Menschenrechte, Völkerverständigung\nLänderschwerpunkte\nDeutschland, Nicaragua\nTätigkeitsfelder\nDer Verein unterstützt Projekte in dem nicaraguanischen Landkreis San Rafael del Sur. Hier leben cirka 42.000 Menschen in der gleichnamigen Stadt und in 59 weiteren, sehr unterschiedlich entwickelten Dörfern und Gemeinden. Das Ziel der Projektentwicklung und -unterstützung ist die Verbesserung der Lebensbedingungen sozial benachteiligter Bevölkerungsgruppen, insbesondere im ländlichen Bereich, nach dem Prinzip der Selbstorganisation. Die Schwerpunkte der Projektarbeit liegen in den Bereichen Gesundheit, Trinkwasserversorgung und Bildung sowie der Förderung der landwirtschaftlichen Produktion. Der Verein arbeitet dabei eng mit der Partnerorganisation „Centro de Desarrollo Rural“ (CEDRU, Zentrum für ländliche Entwicklung) zusammen.\nFinanzen\nBezugsjahr:\n2018\nGesamteinnahmen:\n136.494,93 EUR\nDavon Sammlungseinnahmen Hilfetext:\n31.819,58 EUR\nAnteil Werbe- und Verwaltungskosten Hilfetext:\nniedrig\nEinschätzung durch das DZI Hilfetext\nDem Verein zur Förderung der Städtepartnerschaft Kreuzberg – San Rafael del Sur e.V., Berlin, wurde das DZI Spenden-Siegel zuerkannt. Der Verein ist förderungswürdig.\nDie sieben Spenden-Siegel-Standards erfüllt der Verein wie folgt:\n1.Die Organisation leistet satzungsgemäße Arbeit.\n2.Leitung und Aufsicht sind angemessen strukturiert, klar voneinander getrennt und werden wirksam wahrgenommen.\n3.Werbung und Öffentlichkeitsarbeit informieren klar, wahr, sachlich und offen.\n4.Der Anteil der Werbe- und Verwaltungsausgaben an den Gesamtausgaben ist nach DZI-Maßstab niedrig („niedrig“ = unter 10%). Die Wirksamkeit des Mitteleinsatzes wird überprüft, und die Ergebnisse werden dokumentiert und veröffentlicht.\n5.Die von der Organisation gezahlten Vergütungen berücksichtigen den Status der Gemeinnützigkeit, die Qualifikation, das Maß an Verantwortung und den branchenüblichen Rahmen.\n6.Mittelbeschaffung und -verwendung sowie die Vermögenslage werden nachvollziehbar dokumentiert und angemessen geprüft.\n7.Die Organisation berichtet offen und hinreichend umfassend über ihre Arbeit, Strukturen und Finanzen.\nTräger des DZI Spenden-Siegels seit 05.06.2003\nKontakt\nWebsite\nwww.staepa-berlin.de\nE-Mail\ninfo@staepa-berlin.de\nTelefon\n030-61209165\nFax\n030-61209167\nAnschrift\nAdalbertstraße 23b\n10997 Berlin\nSpendenkonten\nIBAN: DE35100100100464805104\nBIC: PBNKDEFF\nPostbank\nAllgemeine Informationen\nGründungsjahr\n1985\nSitz der Organisation\nBerlin\nRechtsform\nVerein\nWeltanschauliche Ausrichtung\nunabhängig\nOrganisation\nLeitungsorgan\nVorstand\nMitglieder/Gesellschafter\n107 stimmberechtigte Mitglieder\nAnzahl Mitarbeiter Hilfetext\nhauptamtlich: 2 ehrenamtlich: 2"
  },
  {
    "title": "Watoto e.V.",
    "url": "https://www.dzi.de/organisation/watoto-e-v/",
    "weltanschaulicheAusrichtung": "unabhängig",
    "finanzen": {
      "bezugsjahr": 2017,
      "gesamtEinnahmen": "309.405,36 EUR",
      "anteilKosten": "niedrig"
    },
    "volltext": "Arbeitsschwerpunkte\nBildung, Entwicklungszusammenarbeit, Kinder- und Jugendhilfe, Kinderpatenschaft\nLänderschwerpunkte\nKenia\nTätigkeitsfelder\nWatoto (Suaheli: „Kinder“) unterstützt die Mekaela Academies in Kenia. Mekaela Academies wurde 1993 gegründet, um Kindern in Afrika unabhängig von ihrer finanziellen Situation eine schulische Ausbildung zu ermöglichen. Die Einrichtung besteht derzeit aus fünf Schulen, drei Grund- und Hauptschulen mit Vorschule sowie zwei Gymnasien. Drei Schulen haben einen Internatsbetrieb. Insgesamt besuchen rund 1.100 Jungen und Mädchen die Einrichtungen der Mekaela Academies. Der deutsche Verein Watoto sammelt Spenden für Baumaßnahmen und Investitionen an den Schulen und vermittelt über Patenschaften Stipendien an Kinder mittelloser Familien.\nFinanzen\nBezugsjahr:\n2017\nGesamteinnahmen:\n309.405,36 EUR\nDavon Sammlungseinnahmen Hilfetext:\n232.005,36 EUR\nAnteil Werbe- und Verwaltungskosten Hilfetext:\nniedrig\nEinschätzung durch das DZI Hilfetext\nWatoto e.V., Hamburg, wurde das DZI Spenden-Siegel zuerkannt. Der Verein ist förderungswürdig.\nDie sieben Spenden-Siegel-Standards erfüllt der Verein wie folgt:\n1.Die Organisation leistet satzungsgemäße Arbeit.\n2.Leitung und Aufsicht sind angemessen strukturiert, klar voneinander getrennt und werden wirksam wahrgenommen.\n3.Werbung und Öffentlichkeitsarbeit informieren klar, wahr, sachlich und offen.\n4.Der Anteil der Werbe- und Verwaltungsausgaben an den Gesamtausgaben ist nach DZI-Maßstab niedrig („niedrig“ = unter 10%). Die Wirksamkeit des Mitteleinsatzes wird überprüft, und die Ergebnisse werden dokumentiert und veröffentlicht.\n5.Vergütungen (trifft nicht zu).\n6.Mittelbeschaffung und -verwendung sowie die Vermögenslage werden nachvollziehbar dokumentiert und geprüft.\n7.Die Organisation berichtet offen und umfassend über ihre Arbeit, Strukturen und Finanzen.\nTräger des DZI Spenden-Siegels seit 22.10.2009\nKontakt\nWebsite\nwww.watoto.de\nE-Mail\npostfach@watoto.de\nTelefon\n040-55640112\nFax\n0321-35676776\nAnschrift\nLiepmannweg 15\n22399 Hamburg\nSpendenkonten\nIBAN: DE59520503530002193892\nBIC: HELADEF1KAS\nKasseler Sparkasse\nAllgemeine Informationen\nGründungsjahr\n1998\nSitz der Organisation\nHamburg\nRechtsform\nVerein\nWeltanschauliche Ausrichtung\nunabhängig\nOrganisation\nLeitungsorgan\nVorstand\nMitglieder/Gesellschafter\n20 stimmberechtigte Mitglieder\nAnzahl Mitarbeiter Hilfetext\nehrenamtlich: 16"
  },
  {
    "title": "WELTFRIEDENSDIENST e.V.",
    "url": "https://www.dzi.de/organisation/weltfriedensdienst-e-v/",
    "weltanschaulicheAusrichtung": "unabhängig",
    "finanzen": {
      "bezugsjahr": 2018,
      "gesamtEinnahmen": "6.663.291,92 EUR",
      "anteilKosten": "niedrig"
    },
    "volltext": "Arbeitsschwerpunkte\nBildung, Entwicklungszusammenarbeit, Frauenförderung, Gesundheitshilfe, Kinder- und Jugendhilfe, Menschenrechte, Umwelt- und Naturschutz, Völkerverständigung\nLänderschwerpunkte\nArgentinien, Benin, Bolivien, Brasilien, Burundi, Deutschland, Ecuador, Ghana, Guatemala, Guinea, Guinea-Bissau, Kenia, Laos, Myanmar, Namibia, Nicaragua, Palästinensische Gebiete, Peru, Sambia, Senegal, Simbabwe, Südafrika, Tansania\n… mehr\nTätigkeitsfelder\nDer WELTFRIEDENSDIENST e.V. versteht seine Arbeit als Engagement für mehr Gerechtigkeit und gegen die ungleiche Verteilung von gesellschaftlichem Reichtum. In Afrika, Lateinamerika und\nAsien unterstützt der WELTFRIEDENSDIENST e.V. Menschen, die aus eigener Initiative an der Verbesserung ihrer Lebensbedingungen arbeiten. Arbeitsschwerpunkte sind Friedensarbeit, Bildung, der Schutz der natürlichen Ressourcen sowie Menschenrechte. Mit Hilfe von Bildungs- und Öffentlichkeitsarbeit und der Vermittlung von Projektpartnerschaften trägt der WELTFRIEDENSDIENST e.V. zur Sensibilisierung für die Probleme des Südens bei. Darüber hinaus gibt der Verein Impulse in entwicklungspolitischen Diskussionen und Kampagnen. Der WELTFRIEDENSDIENST e.V. ist Träger des Zivilen Friedensdienst und staatlich anerkannter Träger der Entwicklungszusammenarbeit.\nFinanzen\nBezugsjahr:\n2018\nGesamteinnahmen:\n6.663.291,92 EUR\nDavon Sammlungseinnahmen Hilfetext:\n752.889,30 EUR\nAnteil Werbe- und Verwaltungskosten Hilfetext:\nniedrig\nEinschätzung durch das DZI Hilfetext\nDem WELTFRIEDENSDIENST e.V., Berlin, wurde das DZI Spenden-Siegel zuerkannt. Der Verein ist förderungswürdig.\nDie sieben Spenden-Siegel-Standards erfüllt der Verein wie folgt:\n1.Die Organisation leistet satzungsgemäße Arbeit.\n2.Leitung und Aufsicht sind angemessen strukturiert, klar voneinander getrennt und werden wirksam wahrgenommen.\n3.Werbung und Öffentlichkeitsarbeit informieren klar, wahr, sachlich und offen.\n4.Der Anteil der Werbe- und Verwaltungsausgaben an den Gesamtausgaben ist nach DZI-Maßstab niedrig („niedrig“ = unter 10%). Die Wirksamkeit des Mitteleinsatzes wird überprüft, und die Ergebnisse werden dokumentiert und veröffentlicht.\n5.Die von der Organisation gezahlten Vergütungen berücksichtigen den Status der Gemeinnützigkeit, die Qualifikation, das Maß an Verantwortung und den branchenüblichen Rahmen.\n6.Mittelbeschaffung und -verwendung sowie die Vermögenslage werden nachvollziehbar dokumentiert und angemessen geprüft.\n7.Die Organisation berichtet offen und hinreichend umfassend über ihre Arbeit, Strukturen und Finanzen.\nTräger des DZI Spenden-Siegels seit 28.10.1992\nKontakt\nWebsite\nwww.weltfriedensdienst.de\nE-Mail\ninfo@weltfriedensdienst.de\nTelefon\n030-2539900\nFax\n030-2511887\nAnschrift\nAm Borsigturm 9\n13507 Berlin\nSpendenkonten\nIBAN: DE06100205000003147505\nBIC: BFSWDE33BER\nBank für Sozialwirtschaft\nAllgemeine Informationen\nGründungsjahr\n1959\nSitz der Organisation\nBerlin\nRechtsform\nVerein\nWeltanschauliche Ausrichtung\nunabhängig\nOrganisation\nLeitungsorgan\nVorstand\nGeschäftsführung\nJudith Ohene\nMitglieder/Gesellschafter\n151 stimmberechtigte Mitglieder\nAnzahl Mitarbeiter Hilfetext\nhauptamtlich: 18 ehrenamtlich: 120"
  },
  {
    "title": "Zukunftsstiftung Entwicklung",
    "url": "https://www.dzi.de/organisation/zukunftsstiftung-entwicklung/",
    "weltanschaulicheAusrichtung": "unabhängig",
    "finanzen": {
      "bezugsjahr": 2019,
      "gesamtEinnahmen": "6.525.348,83 EUR",
      "anteilKosten": "niedrig"
    },
    "volltext": "Arbeitsschwerpunkte\nBildung, Entwicklungszusammenarbeit, Frauenförderung, Gesundheitshilfe, Kinder- und Jugendhilfe, Kinderpatenschaft, Menschenrechte, Umwelt- und Naturschutz\nLänderschwerpunkte\nAfghanistan, Argentinien, Äthiopien, Bolivien, Brasilien, Ghana, Indien, Kenia, Mexiko, Mongolei, Nepal, Nicaragua, Pakistan, Peru, Russische Föderation, Simbabwe, Südafrika, Tansania, Uganda\n… mehr\nTätigkeitsfelder\nDie Zukunftsstiftung Entwicklung fördert Projekte insbesondere in Afrika, Asien und Südamerika. Sie unterstützt beispielsweise Selbsthilfeprojekte im Bereich der ökologischen Landwirtschaft, regenerativer Energien und im Kleingewerbe, fördert soziale Projekte wie etwa Behinderten- und Kinderheime und engagiert sich in Menschenrechtsprojekten und in der Basisgesundheitsvorsorge. Darüber hinaus vermittelt die Stiftung Patenschaften, die in erster Linie auf schulische Förderungen ausgerichtet sind.\nFinanzen\nBezugsjahr:\n2019\nGesamteinnahmen:\n6.525.348,83 EUR\nDavon Sammlungseinnahmen Hilfetext:\n4.353.116,06 EUR\nAnteil Werbe- und Verwaltungskosten Hilfetext:\nniedrig\nEinschätzung durch das DZI Hilfetext\nDer Zukunftsstiftung Entwicklung, Bochum, wurde das DZI Spenden-Siegel zuerkannt. Die Stiftung ist förderungswürdig.\nDie sieben Spenden-Siegel-Standards erfüllt die Stiftung wie folgt:\n1.Die Organisation leistet satzungsgemäße Arbeit.\n2.Leitung und Aufsicht sind angemessen strukturiert, klar voneinander getrennt und werden wirksam wahrgenommen.\n3.Werbung und Öffentlichkeitsarbeit informieren klar, wahr, sachlich und offen.\n4.Der Anteil der Werbe- und Verwaltungsausgaben an den Gesamtausgaben ist nach DZI-Maßstab niedrig („niedrig“ = unter 10%). Die Wirksamkeit des Mitteleinsatzes wird überprüft, und die Ergebnisse werden dokumentiert und veröffentlicht.\n5.Die von der Organisation gezahlten Vergütungen berücksichtigen den Status der Gemeinnützigkeit, die Qualifikation, das Maß an Verantwortung und den branchenüblichen Rahmen.\n6.Mittelbeschaffung und -verwendung sowie die Vermögenslage werden nachvollziehbar dokumentiert und angemessen geprüft.\n7.Die Organisation berichtet offen und umfassend über ihre Arbeit, Strukturen und Finanzen.\nTräger des DZI Spenden-Siegels seit 14.12.2020\nKontakt\nWebsite\nwww.zukunftsstiftung-entwicklung.de\nE-Mail\nentwicklung@gls-treuhand.de\nTelefon\n0234-57975224\nFax\n0234-57975188\nAnschrift\nChriststraße 9\n44789 Bochum\nSpendenkonten\nIBAN: DE05430609670012330010\nBIC: GENODEM1GLS\nGLS Gemeinschaftsbank\nAllgemeine Informationen\nGründungsjahr\n2001\nSitz der Organisation\nBochum\nRechtsform\nnicht rechtsfähige Stiftung\nWeltanschauliche Ausrichtung\nunabhängig\nOrganisation\nLeitungsorgan\nGeschäftsführung\nAnzahl Mitarbeiter Hilfetext\nhauptamtlich: 13 ehrenamtlich: 9"
  }
]